,index,body,Target,Date,I(positive),I(neutral),I(negative),I(positive)*score,I(neutral)*score,I(negative)*score
3702,27224,do you know that wallstreet price for tesla is 30339,0,2017-08-03 01:21:03,0,1,0,0.0,0.7713618278503418,0.0
3703,18499,tesla carplay system is permanently stuck on springsteen song goingdown down down down,1,2017-07-20 19:44:41,0,1,0,0.0,0.8501808047294617,0.0
3704,5987,tesla eod 175 is about to receive the margin call,1,2015-03-09 17:10:31,0,1,0,0.0,0.7299233675003052,0.0
3705,35422,tesla stock bounces back friday but recovery not just far short of wednesday number but below overall markets rise this morning,1,2018-05-04 15:39:48,0,0,1,0.0,0.0,0.8460171818733215
3706,28360,legal peeps diver vernon unsworth is only suing for 75k why not just settle tesla,1,2018-12-27 23:43:55,0,0,1,0.0,0.0,0.6904396414756775
3707,10565,tesla attacks blogger who fabricated model s suspension issue attacksbloggerwhofabricatedmodelssuspensionissue tesla tesla,1,2016-06-10 16:22:41,0,1,0,0.0,0.626773476600647,0.0
3708,25621,drivers of boring camrys go for tesla the excitement will kill the relationship 3reservationholdersurveyunderlinesteslasmassmarketchallenge via,1,2017-03-08 22:39:40,0,0,1,0.0,0.0,0.8008313775062561
3709,19092,tesla rises as analysts digest first profit in two years tesla,1,2018-10-25 14:58:03,0,1,0,0.0,0.7589829564094543,0.0
3710,4548,tesla astute observation we may not be there yet but we will get there the number of model 3s that fail on day 1 day 2 first week etc is ridiculous so word will get around outside of fanbois and a few illinformed people it will be hard to get takers for these lemons,1,2018-07-07 17:44:25,0,1,0,0.0,0.7683744430541992,0.0
3711,34987,some tesla suppliers fret about getting paidwsj reports tesla,0,2018-08-20 19:37:41,0,1,0,0.0,0.682153582572937,0.0
3712,30385,gdxj spdr gold trust shares last tradeclick here gdxj tesla lsgto bmoto gdxj invest finance,1,2015-05-09 09:55:33,0,0,1,0.0,0.0,0.5139479637145996
3713,1594,hodltsla tslaqwait for itfeel itthe big fella is wobblinga whole lot of distribution going onpatiencewe are approaching the edge of the waterfall i can hear the roar just around the bend,0,2018-08-29 19:01:21,1,0,0,0.9392670392990112,0.0,0.0
3714,22983,tesla he cancelled because of lack of ability to browse music seriously,1,2018-09-17 15:43:17,1,0,0,0.9116339683532715,0.0,0.0
3715,30602,elon musk addresses concerns around autopilot and its beta label tesla stock auto,0,2016-07-25 22:09:03,0,1,0,0.0,0.4997725784778595,0.0
3716,26360,selfdrivingcar next porsche to hire 14k to build ev gm f tesla,0,2016-07-27 14:44:25,1,0,0,0.6166791915893555,0.0,0.0
3717,26978,tesla decent action as its holding the nearest support we wanted it to hold 289,1,2018-09-17 15:40:48,0,1,0,0.0,0.5562810301780701,0.0
3718,21272,oldschool car industry now scrambling to catch up with tesla on electric and autopilot were in trouble they think well done,0,2016-08-24 01:51:34,0,0,1,0.0,0.0,0.7537980079650879
3719,33403,jjg cotiviti holdings inc day highread more jjg pii tesla invest,1,2016-11-02 02:45:33,0,0,1,0.0,0.0,0.8727745413780212
3720,13800,in other words elon got way too far over his skis and we wish he would shut up tesla,0,2018-08-08 13:54:53,0,1,0,0.0,0.6357948780059814,0.0
3721,37429,nbg national bank of greece sharesnbg vnq tesla amzn nbg pennystocks investing,0,2015-06-17 16:42:35,1,0,0,0.5177718997001648,0.0,0.0
3722,16416,now offering 7 day free trial to options day trading team room or twtr feed pcln aapl nflx tesla amzn googl,0,2017-08-27 15:15:04,0,1,0,0.0,0.5603337287902832,0.0
3723,37603,tesla never said i wont be playing long anymore but would consider other side tooit may see bounce to 307ish tomorrow,1,2018-07-23 22:22:20,0,1,0,0.0,0.8854037523269653,0.0
3724,13475,short all the tesla available boyos tslaq on fuckin deck,1,2018-09-18 04:29:57,0,1,0,0.0,0.7469947934150696,0.0
3725,39207,spy qqq baba fb thursday morning market video spy tesla bidu wfm spy tlt sfly,0,2015-02-12 13:01:00,0,1,0,0.0,0.8216063976287842,0.0
3726,12133,hadnt been watching didnt know that in addition to parade they were holding a musk tesla rally on cnbc spx qqq iwm,1,2016-11-04 15:56:56,0,0,1,0.0,0.0,0.8563744425773621
3727,19712,breaking baggy mcbagface throws down the gauntlet to chanos on tesla with a sternlyworded stream of baggygold submitter to the kynikos website,1,2018-07-06 02:54:41,1,0,0,0.3512997031211853,0.0,0.0
3728,23193,who in the fuck is buying tesla,1,2018-09-19 16:59:58,0,0,1,0.0,0.0,0.7318040132522583
3729,5662,tesla new insider selling 3000 shares ttsla,0,2018-06-20 02:36:01,0,0,1,0.0,0.0,0.6897644400596619
3730,6340,tesla howeverthats a goner,1,2015-05-07 13:34:11,0,0,1,0.0,0.0,0.8653357625007629
3731,7800,wow that seems high how does this compare to tesla is the general sentiment positive towards twtr or negative thanks for the great post,0,2018-06-12 20:35:16,0,1,0,0.0,0.7534458041191101,0.0
3732,14876,im still waiting for someone to send me a list of all the 14 yearold tech companies with 19 gross margins doubledigit negative operating margins and annual capex of 40 of revenue feel free to provide that list at any time thanks in advancetsla,1,2017-11-22 14:59:40,0,1,0,0.0,0.8278204798698425,0.0
3733,16912,tesla on a mission to retest the under side of 200 where it will promptly get massacred by the bears,1,2016-02-25 20:44:54,0,1,0,0.0,0.7065897583961487,0.0
3734,8161,80918 elliott wave updates for momentum nvda tesla baba v,0,2018-08-09 18:45:11,0,1,0,0.0,0.8475916981697083,0.0
3735,21593,what good pr looks like tesla,0,2016-07-01 02:28:51,0,0,1,0.0,0.0,0.8971850275993347
3736,34117,ewh japan ishares stock message boardewh tesla drn ge ewh stock nasdaqewj south korea ishares change,0,2015-07-10 22:40:10,0,0,1,0.0,0.0,0.5829602479934692
3737,35910,thoughts on tesla atm heideckers fucked up space venture in the latest episode of billions foreshadowing tesla going bust,0,2018-04-17 12:59:03,1,0,0,0.6541747450828552,0.0,0.0
3738,17766,if you follow re share your thoughts here pen tesla csiq egle,1,2016-11-03 22:46:04,0,1,0,0.0,0.926927924156189,0.0
3739,26735,some parts suppliers will be unwilling or unable to achieve this level of precision i understand that this will be considered an unreasonable request by some thats ok there are lots of other car companies with much lower standards they just cant work with tslahahaha,0,2018-04-17 20:29:31,0,1,0,0.0,0.737633466720581,0.0
3740,7250,some thoughts about these tesla numbers and other data my read of the tmc and second measure data is configuration peaked in july however because of the delivery delay the peak for sales will be in august 1,1,2018-09-05 16:57:39,0,1,0,0.0,0.8944560885429382,0.0
3741,24670,capincghhcotcqbghcapitalotcqbghhcisexploringtheuseofblockchaintechnologyforthenextgenerationofcreditcardpayments fb tesla nflx ghhc strong buy,1,2017-11-27 13:46:23,0,1,0,0.0,0.6011491417884827,0.0
3742,1638,price moves vs expected moves vxx fb hyg amd amzn aapl bac uso ge msft xop tesla,1,2018-12-24 18:41:59,0,0,1,0.0,0.0,0.5754313468933105
3743,18145,tesla 18787 very important level to hold up short term,1,2016-11-02 17:27:26,0,1,0,0.0,0.8752568960189819,0.0
3744,14243,tesla needs a weekly close over 348 to get to my lt swing target of 485,0,2018-01-13 14:28:15,0,0,1,0.0,0.0,0.6316177248954773
3745,28867,tesla 360 put high 7 nice 775,1,2017-06-30 00:59:43,0,1,0,0.0,0.8771182298660278,0.0
3746,11757,tesla gigafactory or be both innovative alteratives i pick tesla for now,1,2018-07-30 16:00:31,0,1,0,0.0,0.91729736328125,0.0
3747,9419,btw cmg is helping my port huge today thinking tesla finally cratering for real this xmaybe will retrace that 100 runup fr feb10 144,0,2016-04-27 15:08:13,0,1,0,0.0,0.7015264630317688,0.0
3748,5715,indeed sam that was always part of the tesla short thesis poor fundamentals built on mountains of debt,1,2016-06-22 04:07:55,0,1,0,0.0,0.7268500328063965,0.0
3749,18925,the displayed lack of fundamentals and risk management by the cult of elon continues to astound me ill stop trying to educate now ill do my best to remain compassionate and understanding if tslaq surprises any of you btw bevs are good and in many cases tesla needs ch 11,1,2018-12-11 20:08:43,0,0,1,0.0,0.0,0.844436764717102
3750,843,tesla may fight for 260 today or tomorrow if the us rally sustained tough struggle ahead stocks trading investor,0,2017-01-25 15:21:21,0,1,0,0.0,0.6224973201751709,0.0
3751,20699,audits arent useless but they are grossly overrated by investors tesla baba etc,1,2018-09-09 19:49:54,1,0,0,0.628491222858429,0.0,0.0
3752,38417,thats how they treat you at a stealership if you need service for your 100k car how was your last service experience teslarians tesla cc,0,2018-08-24 22:29:50,0,1,0,0.0,0.9283428192138672,0.0
3753,26356,tesla stock surges as elonmusk teases product announcement via tslashowinsttypesymbtslax0y0time6startdate12f42f1999enddate102f262f2015freq1compidxaaaaa3a0comptemptextcompnonema4maval51050uf7168lf1lf24lf32type4style320size3timeframetogglefalsecomparetotogglefalseindicatorstogglefalsechartstyletogglefalsestate15bnn,0,2016-08-23 17:57:30,0,0,1,0.0,0.0,0.6730180382728577
3754,28779,dust direxion daily gold miners bear 3x shares stock message boarddust tesla im schw dust investing share,1,2015-08-15 07:36:03,0,0,1,0.0,0.0,0.6581191420555115
3755,33955,you both better agree and please dont cover your shorts tesla will crash,0,2015-01-08 04:21:46,0,1,0,0.0,0.8630591034889221,0.0
3756,20244,anyone want to see some factory turd cars tesla san antonio storeservice center tesla tslaq,1,2018-09-03 17:35:55,0,1,0,0.0,0.9115659594535828,0.0
3757,4903,selling tesla here 60 downsidemusk irresponsibly hyping again to cushion impact of yet more disappointments to come soononly consistency in tesla is overpromise underdeliver for 10 years nowwill never be able to scale up reach profitability,1,2018-07-09 13:31:28,0,0,1,0.0,0.0,0.7374515533447266
3758,34910,brokerages anticipate tesla inc tesla will post earnings of 067 per share,1,2017-04-05 22:28:55,0,0,1,0.0,0.0,0.7166131138801575
3759,16599,tesla lith tesla could acquire us lithium corp this year pressreleasesstockfuturesaremixedafterblowoutadpjobsreportteslacouldacquireuslithiumcorpthisyear,1,2017-03-08 14:36:54,0,1,0,0.0,0.46921831369400024,0.0
3760,7980,tesla hiking again these tesla jan12 330c now 98 from 696 335c now 64 from 41 jan19 340c 675 from 488 wow huge wins again,0,2018-01-09 17:26:13,0,1,0,0.0,0.8771241903305054,0.0
3761,36702,you should buy some stockdelivery numbers are the only thing that matterstsla,1,2018-09-08 00:22:11,0,0,1,0.0,0.0,0.5079098343849182
3762,1549,tesla stock increases 139 as shareholders said to approve ceos 26b compensation plan tesla,1,2018-03-21 17:22:27,0,1,0,0.0,0.8699713945388794,0.0
3763,9842,lapsus who are you referring to frank c is an owner dont expect him to be short tesla nor am i short tesla,1,2018-10-17 07:49:19,0,0,1,0.0,0.0,0.613044798374176
3764,35734,you only have to do a very few things right in your life so long as you dont do too many things wrongthe most undervalued biotech everfunded by the bill and linda gates foundationbestinvestmentfor2018ishtmlspy aapl amzn fb msfttwtr goog andi tesla nvdanvda orcl,0,2018-04-13 18:08:06,0,0,1,0.0,0.0,0.6853723526000977
3765,14443,my question is if tesla is doing a product announcement now what are they saving up for labor day weekend,0,2016-08-23 16:16:55,0,0,1,0.0,0.0,0.7847413420677185
3766,24586,the last thing the tesla ahorts expected was elon and trump to be bff,0,2017-01-06 17:39:40,0,1,0,0.0,0.6991627216339111,0.0
3767,1703,i had a gtc buy order in on tesla for 165 placed over a year ago when stock was 250s it finally filled about a month ago,0,2016-03-14 20:31:09,0,1,0,0.0,0.8830174207687378,0.0
3768,24273,why not just sell puts on tesla and generate income while waiting for a lower stock price entry point,0,2017-08-15 23:56:05,0,0,1,0.0,0.0,0.8660452961921692
3769,2245,i covered tesla short this morning at a loss but thats friday for you explain wtf was the deal with nflx to me down 2 up 4,1,2016-02-12 17:24:55,0,1,0,0.0,0.8913080096244812,0.0
3770,25585,many cos are developing solidstate batteries theyll make panasonics equipment useless but tesla still must pay for it via take or pay,0,2017-06-11 01:15:08,0,0,1,0.0,0.0,0.7291051149368286
3771,19161,jimmy i seem to like option punishment i followed you on this trade and bought tesla feb 16th 390 calls oh tesla,0,2018-02-07 18:32:18,0,0,1,0.0,0.0,0.8287871479988098
3772,3441,premarket watchlist scan for 09282018 igc tesla aldx tlrywatchlist traderequity daytrading propfirm stockstowatch,1,2018-09-28 13:07:58,0,1,0,0.0,0.674721896648407,0.0
3773,9648,keep eyes on tesla,0,2016-08-23 16:45:37,0,1,0,0.0,0.5923750996589661,0.0
3774,36382,then show the financials and any intelligent person would tesla tslaq,1,2018-10-04 09:56:37,0,1,0,0.0,0.8656216859817505,0.0
3775,39533,tesla booyah 1 more line to go then the bleeding begins crew going nuts on the puts profits since week started,1,2018-07-03 16:16:56,0,1,0,0.0,0.623452365398407,0.0
3776,27732,tesla hiking over 2274 impressive intraday reversal play definitely eyeing on 230 possibly 237240 into next week happy trading p,0,2017-01-05 20:28:40,1,0,0,0.6416863799095154,0.0,0.0
3777,20512,quite the binary for tesla shareholders scenario a musk is telling the truth and you make a quick 14 buying shares now scenario b this doesnt happen musk goes to prisonis investigated for market manipulation and the stock craters,0,2018-08-07 17:51:50,0,1,0,0.0,0.6961373090744019,0.0
3778,2865,945 avg gainsmallmicrocap newsletterfamilyrunqqq aapl de tesla amzn ddd hpq,1,2015-11-29 19:02:47,0,0,1,0.0,0.0,0.8351109623908997
3779,4550,curious to know what your trade for tesla was,0,2017-10-03 16:12:02,0,1,0,0.0,0.6598301529884338,0.0
3780,11843,he needed a little cash to buy xmas cheese and cracker baskets for the resident sec attorneys sec tesla,1,2018-12-27 00:55:56,0,0,1,0.0,0.0,0.8236632347106934
3781,10696,as of 73018 tesla has moved all 850 cars stored at their property at 48401 fremont blvd below left is from 723 below right is from 730 are they now at lathrop or on their way to customers model3 tesla,0,2018-08-08 14:19:16,0,1,0,0.0,0.8693244457244873,0.0
3782,6793,rt qqq algos triggered sell in sigmax crossfinder ats lx 0946 pt 10150 quant goog baba fb nflx bidu gpro tesla aapl hft,0,2015-02-04 14:46:51,0,0,1,0.0,0.0,0.6059769988059998
3783,35697,whoa looks like a huge profit for tesla sales beat too bulls and elon musk vindicated shorts squeezed tesla up 7 after hours,1,2018-10-24 20:18:12,0,0,1,0.0,0.0,0.8501999974250793
3784,3566,couldnt even make it out of the weekend without pissing on the agreement classytsla tslaq,1,2018-09-30 17:37:01,1,0,0,0.7338020205497742,0.0,0.0
3785,1078,elon musk hopes to bring tesla to india this year india tesla muskteslaindiaindexhtml,1,2017-02-08 14:20:04,0,0,1,0.0,0.0,0.6657739281654358
3786,33958,bottlenecks what bottlenecks came in and eliminated 80 of the problems we were having tesla tesla,1,2018-05-12 18:38:32,0,0,1,0.0,0.0,0.609917402267456
3787,39077,now offering 7 day free trial to options day trading team room or twtr feed nvda aapl nflx tesla amzn googl,0,2018-08-25 01:45:03,0,0,1,0.0,0.0,0.5673099756240845
3788,37277,fastmoneyespressofinal tradespete najarian buy gmtim seymour buy halbrian kelly buy tslaguy adami buy lll,1,2017-12-13 00:18:11,0,0,1,0.0,0.0,0.8087641596794128
3789,39843,tesla 600 by next year billionaire predicts blue chips to double by 2030 and tesla shares to do even better,0,2017-06-15 04:58:51,0,1,0,0.0,0.8248946070671082,0.0
3790,33299,tesla luxury my arse,0,2018-04-16 15:49:06,0,1,0,0.0,0.8722898960113525,0.0
3791,21921,tesla shares are down 10 this year making 2016 the first time that tesla has dropped in a calendar year since its 2010 ipo,1,2016-12-29 18:08:48,0,1,0,0.0,0.8709534406661987,0.0
3792,36537,tesla totally my nearly worthless calls are now captured gains too early this am was wondering why my limit orders exe,1,2018-10-23 17:51:37,0,1,0,0.0,0.6544032096862793,0.0
3793,28504,klemke did you try the new stock market platform its free aapl tesla spx,1,2015-07-31 17:02:16,0,1,0,0.0,0.7840688228607178,0.0
3794,31284,tslawall street to teslas elon musk get some help elonmuskwallstreetgetsomehelp via,0,2018-08-29 10:12:49,0,0,1,0.0,0.0,0.848518967628479
3795,13972,why apple is targeting battery pioneers for its secret car project tesla aapl,0,2015-02-20 20:25:17,0,1,0,0.0,0.5091201663017273,0.0
3796,20628,verified 64037 loss in tesla bought some tesla calls into weakness end of day friday but of course jpm has to,0,2018-08-21 08:51:11,0,0,1,0.0,0.0,0.4866417646408081
3797,13244,tesla sometimes i blog about great stocks nov 1 2010 the tesla stock had a price of 21 what a remarkable run,0,2017-06-21 13:45:44,0,1,0,0.0,0.6631721258163452,0.0
3798,29925,should we all say no to mazda tesla,1,2018-12-02 18:04:47,0,0,1,0.0,0.0,0.771193265914917
3799,24664,lol tesla admits its drivers blv that model x accelerates when shouldnt but denies these unintended acceleration events bc undefined,0,2017-08-01 17:24:43,0,1,0,0.0,0.8581103682518005,0.0
3800,18470,musk hasnt tweeted in hours the twitter sitters or shitters must have started already unannounced lol tesla tslaq,1,2018-12-28 12:48:23,0,0,1,0.0,0.0,0.815941572189331
3801,9165,the tesla shorts lost so much money that they think that bad mouthing tesla 247 will help them,0,2016-10-21 17:28:43,0,1,0,0.0,0.9206843972206116,0.0
3802,6612,these bears belong in low budget porn with their lackluster ability to fluff anything up tesla,1,2018-07-05 20:54:58,0,0,1,0.0,0.0,0.6474152207374573
3803,11181,this is hilarious frauds want other people to their frauds frauds never put up their own money tesla,1,2018-12-29 22:58:05,0,1,0,0.0,0.7196709513664246,0.0
3804,2189,closed this morning tesla 290 put spreadsmax profit 1500realized profit 950days held 21 days,1,2017-07-28 13:43:22,1,0,0,0.894019365310669,0.0,0.0
3805,22599,model 3 reservation holders wait it out delays and all 1113teslamodel3depositorsstayingputaswaitinlinelengthens via tesla,1,2017-11-13 13:48:01,0,0,1,0.0,0.0,0.4486371874809265
3806,35938,adam jonas of ms cagily side stepping out the door from the rapidly degenerating tesla party as he nods and waves goodbye as the clock strike 2 am he should be doing an irish exit tesla,0,2018-06-07 11:55:22,0,0,1,0.0,0.0,0.9017899632453918
3807,8745,soon the trend will not be tesla s friend,1,2016-02-02 20:12:46,0,1,0,0.0,0.8310633301734924,0.0
3808,19032,maybe they dont want to give it more attention than it deserves tomorrow or even this afternoon there will be another tesla scandal or musk tweet that will have everyone afluttter,1,2018-07-05 14:40:24,0,1,0,0.0,0.8527319431304932,0.0
3809,16703,amzn tesla flat now out of all my weekly options see what tomorrow brings good luck everyone,0,2017-10-12 18:10:58,0,1,0,0.0,0.8917874693870544,0.0
3810,7402,one word to explain it allinvesting for the futureinvesting in tslacant stop luvin tesla,1,2018-07-23 18:54:39,0,0,1,0.0,0.0,0.795126736164093
3811,32874,tesla really wanting to test its 20ma now macd also ready to move higher power move this am breaks 33650 and its clear skies,1,2017-07-24 13:40:40,0,0,1,0.0,0.0,0.5990340709686279
3812,16552,us ev maker tesla lifted the registered capital of its shanghai unit by 46 times from 146m to 682m the capital injection will be used to expand teslas business scope in the mainland to include the making of auto parts and key components more,1,2018-09-11 09:27:31,0,1,0,0.0,0.6243801712989807,0.0
3813,23719,tesla is that a semi in your pants or are you just happy to see me,1,2017-11-21 16:58:54,0,1,0,0.0,0.4618609547615051,0.0
3814,30868,well for one it starts at 35k and musk guessed asp would be lower 40k range tesla tesla,0,2017-01-28 04:14:31,0,1,0,0.0,0.9213467836380005,0.0
3815,37746,just a minimum of 2 billion in debt from china to fund development of tslas new gigafactory,0,2018-08-01 22:20:20,1,0,0,0.7241618037223816,0.0,0.0
3816,14794,tesla better raise cash quickly became negative news mrkt correction lawsuits pending and production shortfalls are waiting in the wings,0,2017-10-11 15:27:02,0,1,0,0.0,0.9087455868721008,0.0
3817,36515,tesla 20 pre teslas price target reduced to 450 at morgan stanley,1,2015-10-06 13:02:25,0,1,0,0.0,0.6151740550994873,0.0
3818,2277,royal bank of canada cuts tesla tesla price target to 28000,1,2018-05-05 04:00:37,1,0,0,0.7650038599967957,0.0,0.0
3819,27929,this is such a silly argument same could be said of ponzie madoff skilling ebbers etc much greater harm to shareholders overall by not doing anything hang em high tesla,1,2018-09-05 05:37:20,0,1,0,0.0,0.5953041315078735,0.0
3820,25878,just woke up is elon in passages malibu yet tesla,0,2018-08-10 09:09:32,0,1,0,0.0,0.8177123665809631,0.0
3821,25228,tesla inc tslas trend up especially after forming a bullish inverse head shoulders inctslastrendupespeciallyafterformingabullishinverseheadshoulders,0,2018-08-07 15:24:37,0,1,0,0.0,0.9020379185676575,0.0
3822,13608,time to long tesla,0,2018-08-08 14:31:33,0,1,0,0.0,0.654799222946167,0.0
3823,1888,ea electronic arts inc stock message boardea amba cemp tesla ea tradeideas investing,0,2015-07-01 13:36:21,0,0,1,0.0,0.0,0.7053121328353882
3824,516,tesla closed all my calls held overnight and opened a small position in the weekly 360 calls for 214,0,2017-06-06 14:02:55,0,0,1,0.0,0.0,0.5119901299476624
3825,19766,morgan stanley increases tesla inc tesla price target to 37900,0,2017-10-11 08:03:33,0,1,0,0.0,0.8726527094841003,0.0
3826,8374,via elonmusk tesla autopilot drive on navigation going to wide release in north america tonight tesla,1,2018-10-27 01:55:18,0,0,1,0.0,0.0,0.4651757776737213
3827,23717,tesla long small size stop 20220 tesla,0,2015-02-26 15:18:23,0,0,1,0.0,0.0,0.7996248006820679
3828,4093,this seems very sinister why oh why cant they be trained to deliver themselves its so unfair my guess is that its because tesla makes 7000 cars a week but only have room for 2k at fremont they are building in batches by color to optimize paintshop the cars must be staged,0,2018-07-31 18:52:15,0,1,0,0.0,0.8604821562767029,0.0
3829,2650,via jacobwolinsky azealia banks says staying at elon musks house has been like a real life episode of get out billboard hop8469828azealiabankselonmuskgrimes tesla,0,2018-08-13 21:11:48,0,1,0,0.0,0.7521159648895264,0.0
3830,28984,and keep in mind he wont do that unless tesla is much lower and the scty will be moving lower with it based on the exchange ratio,1,2016-06-22 17:10:09,0,1,0,0.0,0.8696284890174866,0.0
3831,35287,asti has been selected by enr energizer powerkeep for solar consumer products solarselectedpowerkeepdevelop100000867html flsr tesla vslr suneq,0,2017-10-10 18:59:52,0,1,0,0.0,0.8243814706802368,0.0
3832,38825,as auto makers from around the world begin to finally give some serious competition consumers will have far more ev options to choose from tesla tesla electricvehicles thefutureiselectric newenergynarrative 0502germanyselectriccarsarecomingforelonmuskandtesla via,1,2018-05-03 17:59:26,0,1,0,0.0,0.8734445571899414,0.0
3833,33341,a new low for lora tesla tslaq,0,2018-08-11 06:07:01,0,1,0,0.0,0.5971605181694031,0.0
3834,21258,plot twist it was someone elses deposit receipt tesla,0,2018-11-12 23:43:02,0,1,0,0.0,0.6946740746498108,0.0
3835,15375,they can if the ceo has no reasonable expectation of delivering on what he says secured funding from a source outside the us saudi arabia is useless musk knows the trump admin wont let a deal like that go through he is walking a fine line legally tesla,0,2018-08-08 14:51:51,1,0,0,0.5450930595397949,0.0,0.0
3836,14073,but the media that posted his lame april fools tweet about a watch and tesla dumberthansheep,1,2015-04-02 03:37:59,0,0,1,0.0,0.0,0.564215898513794
3837,5292,despite record q1 deliveries some investors still question teslas inconsistent operational performance tesla,1,2017-04-12 13:01:49,0,1,0,0.0,0.9093255400657654,0.0
3838,33385,but i dont think its news been going on foreverwaitingforacatalyst tesla,1,2018-05-05 16:23:44,0,0,1,0.0,0.0,0.6471055746078491
3839,14592,rt stockguy22 uploaded sat webinar xiv vix tesla aapl jpm twtr fb nflx googl t clx hack feye x vobpuwy1tlag,0,2016-07-04 01:06:46,0,0,1,0.0,0.0,0.5628376007080078
3840,34156,tesla shorted at 28500,1,2018-10-23 16:30:53,0,1,0,0.0,0.729004979133606,0.0
3841,11347,dont miss our next free option trade sign up for our daily free trades at nvda tesla gs orcl bac googl fb,0,2018-11-28 20:01:38,0,1,0,0.0,0.8639581799507141,0.0
3842,23266,morgan stanley says tesla tesla gross cash may reach uncomfortably low levels,1,2017-03-08 13:24:10,0,1,0,0.0,0.6661440134048462,0.0
3843,14686,tesla chart from 129 tradingconcepts resistance,1,2018-12-22 17:19:54,0,1,0,0.0,0.7721119523048401,0.0
3844,1418,so tslaq if you are in a state where teslas cannot be sold direct eg mi ct tx ut you happen to be going to a mall with a small tesla gallery please take some photos eg is there only 1 car left in the store is the gallery closed until oct 1st is it nationwidethx,1,2018-09-27 17:00:41,0,1,0,0.0,0.9019029140472412,0.0
3845,9056,tesla gm i love these fake accounts on stocktwits opened a few weeks ago 86 posts all about tesla going down,1,2017-11-27 19:14:31,0,1,0,0.0,0.6038268208503723,0.0
3846,27164,boomalso given his 2ndbiggest personal holding is tesla what are they going to give him in terms of pay to join other than the annual payout of options i think he may be in there looking to protect his personal wealth somehow like a ron baron,1,2018-12-28 13:52:22,0,1,0,0.0,0.7701018452644348,0.0
