,index,body,Target,Date,I(positive),I(neutral),I(negative),I(positive)*score,I(neutral)*score,I(negative)*score
1195,3168,commented on stocktwits are you buying a car in the next 5 years considered a tesla 86879189,0,2017-06-23 15:15:43,0,1,0,0.0,0.9190082550048828,0.0
1196,32281,at 310 pm est scheduled to appear on to talk tesla and whats coming next disclosure short tesla,0,2018-08-27 17:29:52,0,0,1,0.0,0.0,0.7465439438819885
1197,9444,2 new details about teslas forthcoming model y crossover tesla,1,2017-05-04 21:07:33,0,0,1,0.0,0.0,0.5520020127296448
1198,21455,tesla blew through previous multi month resistance dating back to oct this thing does mot appear to be done,0,2018-06-15 14:10:45,0,1,0,0.0,0.5735340714454651,0.0
1199,22379,staring at all the semis on the road yesterday driving home down the 10 where the 15 meet so much gas waste destroying the environment as californiafires burn tesla will dominate this market too trucks tesla climatechange,1,2017-12-11 14:41:41,0,0,1,0.0,0.0,0.6889246702194214
1200,10562,tesla zero capex revenue on existing super charging network a total of 11041 super chargers tesla amends 040min flat rate to 050min 50 occupation 100min 100 to discourage idling superchargerincarpaymentsoftwareupdate,1,2018-09-20 02:41:25,0,1,0,0.0,0.6274445056915283,0.0
1201,5225,tesla summarysee here tesla airm gcei finance,0,2016-05-17 18:05:03,0,1,0,0.0,0.8567711114883423,0.0
1202,25893,tesla an infiniti q50 has been selfdriving for more than a year vzyzqemkv1k,1,2015-03-24 13:42:24,0,1,0,0.0,0.875069260597229,0.0
1203,18751,the tesla ramp is real happy to be a shareholder only 7 month wait for me thats it which color model3 am i getting such a wonderful email to receive and it was received faster than ever expected ftw,0,2018-06-28 22:38:13,0,1,0,0.0,0.700904130935669,0.0
1204,3214,pete najarian of highlighting notable call activity feb and march in general motors gm currently 07 in the 4430s fpe 7s y 34 nm 21 e feb6th bmo soft psy 50 is arguably conservative target valid alts f tesla,0,2018-01-08 17:47:42,0,0,1,0.0,0.0,0.7184475064277649
1205,4156,about 2 months back a friend and i were joking about the number of agencies that were investigating musk tesla the dea was our hahaha lol pick the usaf never even came on our radar whats next the secret service,1,2018-09-07 21:18:21,0,1,0,0.0,0.8578058481216431,0.0
1206,9632,so 1084 soon to be very disapointed germans then tesla,1,2018-12-24 11:14:07,0,1,0,0.0,0.8508018851280212,0.0
1207,38832,back in puts tesla spy aapl gpro lnkd,1,2015-08-25 19:20:24,0,1,0,0.0,0.5928714871406555,0.0
1208,19002,teslas alien dreadnought factory takes a step forward with structural cable patent tesla tesla,1,2018-10-12 14:45:52,0,1,0,0.0,0.6345616579055786,0.0
1209,33809,from our hero storyafter these is a video post basically saying im not a liar and idgaf about these peopletsla,0,2018-08-21 19:44:16,0,1,0,0.0,0.8124979734420776,0.0
1210,19315,watch on periscope tech stocks lower aapl googl amzn tesla nvda fb twtr dq7ectmdmewv1quf0gzmt4u4ovheng9m36,0,2017-06-27 00:04:08,0,1,0,0.0,0.8103387951850891,0.0
1211,18644,sma vs ema which moving average should you choose vvtw3wig6rnkfmt22 spy qqq gld slv dia djia iwm tlt eem btc stockmarket commodities investing finance stocks gold silver bitcoin cryptocurrency stockcharts aapl amzn tesla twtr ltc eth intc ostk,1,2018-05-08 05:41:39,0,0,1,0.0,0.0,0.5511905550956726
1212,5199,stockalert stocks to watch today on wallstreet tesla amzn aapl business,1,2017-02-14 14:02:25,0,1,0,0.0,0.6721477508544922,0.0
1213,15771,can i give you the 500 that you invested shorting tesla and you promise that i will not see you tweeting again do you do any work besides tweeting,1,2018-07-24 15:55:35,0,0,1,0.0,0.0,0.7141512036323547
1214,3425,gs should seriously be investigated about their tesla upgrade they definitely broke some sec violations,0,2016-05-19 03:46:10,0,1,0,0.0,0.458207905292511,0.0
1215,39046,tesla direxion daily gold miners index bear 3x shares exchangeread more tesla uso wfc stocks,0,2016-08-08 21:56:02,0,0,1,0.0,0.0,0.8657454252243042
1216,34014,tesla i was expecting this to rest today a little more with weekly options you need to be quick you can always get back in,1,2017-04-04 15:25:24,1,0,0,0.6923239231109619,0.0,0.0
1217,38711,i am showing zero tesla 2025 bond trades today on the finra site anyone with a bloomberg terminal that can confirm there has been no volume today seems fishy can you help,1,2018-07-30 16:17:05,0,1,0,0.0,0.6132373213768005,0.0
1218,36499,watch list for 080317 drys mtbc race cost tesla snap,0,2017-08-02 22:41:31,0,0,1,0.0,0.0,0.7606081366539001
1219,23955,tesla tesla model 3 deliveries still ramping slowly says keybanc id2679185,0,2018-02-06 18:50:03,0,0,1,0.0,0.0,0.8563808798789978
1220,36826,tesla board pick of larry ellison is a clone of ceo says jeff sonnenfeld teslaboardpickiscloneofelonmusksaysjeffsonnenfeldhtml via,1,2018-12-29 03:23:57,0,0,1,0.0,0.0,0.8978697061538696
1221,17048,tesla production briefly halted by paint shop fire in fremont factory company says it was up and running normally shortly thereafter,0,2018-04-05 19:53:01,0,0,1,0.0,0.0,0.6451998949050903
1222,29049,it a perfect storm for tesla caused by the lack of major human contribution to climate change maybe subsidy queen can build tanks,0,2017-01-21 14:59:58,1,0,0,0.9607853293418884,0.0,0.0
1223,5936,speculation exist on both the bullish and bearish platform for tesla there is however overwhelming evidence to support a more bearish outcome,0,2018-01-07 17:43:30,1,0,0,0.9080711007118225,0.0,0.0
1224,6708,gpro goldman sachs group inc day highgpro tesla twtr eum gpro finance investing,1,2015-10-14 19:38:34,0,1,0,0.0,0.6840451955795288,0.0
1225,1398,gooddeal will fail 3 reasons imo implied cap 71bn illusory for a loss maker liabilityheavy cash burnerportion of equity payout will largely exceed 33 assumed by elon costcapital dependcy of tesla requires it to tap markets often why cut it offtsla,0,2018-08-15 14:23:02,0,1,0,0.0,0.9281171560287476,0.0
1226,38831,another great morning in chat solid wins lotto friday baby tesla baba nvda,0,2018-06-08 13:57:43,0,1,0,0.0,0.8111917972564697,0.0
1227,17079,its been 6 months but tesla is in the green,0,2015-06-08 15:58:41,0,1,0,0.0,0.6880795955657959,0.0
1228,28776,tesla another admission of failure closing a dozen solar facilitydef not meeting their very ambitious tgt in solarthat said it is sugar quoted wt more empty promisesthe dummest investor can see through it all by nowall hype and subscale tesla will struggle to keep u,1,2018-07-09 15:10:20,0,1,0,0.0,0.7908194065093994,0.0
1229,31764,selfdriving car stock directory added to investor ideas selfdriving car market expected to reach 20 billion by 2024 goph tesla intc goog googl stm aptv alv avx bbto bmwyy cy ddaif f gm nsany nvda qcom tm vlvly,1,2018-03-07 14:45:14,0,1,0,0.0,0.7365988492965698,0.0
1230,31805,thought experimentall the media articles parroting the tesla party line about producing 500k model 3s in 2017 how would they have been rated on the new musk pravda site,1,2018-05-25 12:56:57,0,1,0,0.0,0.5600511431694031,0.0
1231,19458,the new tesla hearse will be used to carry the internal combustion engine to its grave tesla,0,2016-09-30 20:14:06,0,0,1,0.0,0.0,0.7959686517715454
1232,25158,trading in tesla is such a farce its comical,0,2015-06-23 14:24:48,0,1,0,0.0,0.5327165722846985,0.0
1233,5035,yes elons bets will all work 100 smartest guy in the room go all in on margin scty tesla ps sarcasm,0,2016-08-09 23:32:20,0,1,0,0.0,0.6858523488044739,0.0
1234,17078,so having dramatically lost the tesla vote is divesting its tesla shares or was this whole thing actually about trying to install a union at the fremont factoryi mean if it doesnt have confidence in the board why keep it in the portfolio,0,2018-06-07 14:54:01,0,0,1,0.0,0.0,0.5869932770729065
1235,18662,tesla 20171222 maxpain price 34000,1,2017-12-21 16:22:29,0,0,1,0.0,0.0,0.4923044443130493
1236,29884,srmx spx nasdaq djia cac dax ftse jpm tesla esf clf gcf tlt wmt jnj fb googl msft intc amd twtr nflx amzn ma aapl mo pg ge ba utx low hd orcl csco vz dis pcln tesla,0,2018-01-23 03:51:39,0,1,0,0.0,0.5570576190948486,0.0
1237,26516,tesla 13endbut in the end all the lies scams and tricks will come back to bite you in the ass,1,2018-12-01 03:10:18,0,0,1,0.0,0.0,0.7199589014053345
1238,35892,as trump amps up trade war china plays nice with foreign investors,1,2018-07-12 09:18:41,0,1,0,0.0,0.5067837238311768,0.0
1239,9164,tesla version 9 basically is highway level 3 but keep your hands on the wheel and pay attentionregulation needs to catch up to that end i look forward to soon starting to share safety statistics i think exciting times are aheadtsla notsellingasharebefore1250,1,2018-09-23 16:44:47,1,0,0,0.9000738263130188,0.0,0.0
1240,37155,3 ways cryptocurrencies are changing the marijuana industry stocks emhtf gld xauusd tesla barc lyg jpm c gbtc sq amzn coin aapl spy nflx nvda mu opec usd jpy usoil ukoil,0,2018-02-22 20:05:46,0,0,1,0.0,0.0,0.5687342882156372
1241,24020,he is absolutely working incredibly hard but elon has always worked incredibly hard said mr ahuja teslas cfo hes very tough too he can eat glass tesla,0,2018-08-28 20:46:05,1,0,0,0.8387844562530518,0.0,0.0
1242,17160,out of all calls for slight gain tesla bought puts 215,1,2016-06-14 17:51:48,0,1,0,0.0,0.5593162178993225,0.0
1243,32338,teslas strategy of building its own seats may be holding back the electric carmaker via tesla,0,2017-10-26 13:21:06,0,0,1,0.0,0.0,0.6156907081604004
1244,20050,tesla aprils gain of 1975 is its best since a gain of 2078 last august it also broke a 4 month losing streak,1,2015-05-01 05:33:33,0,1,0,0.0,0.7819570302963257,0.0
1245,31649,isis googl tesla february 5th 2015 watch list update from option millionaires markets traded between gains an,0,2015-02-05 14:01:06,0,1,0,0.0,0.5073371529579163,0.0
1246,24482,indeed that will cause my entire story to collapse what no im a bur my story will never collapsenever tslaq tesla,0,2018-04-21 16:24:35,0,1,0,0.0,0.8209548592567444,0.0
1247,2856,im so glad the shorts got run over like they did they are so low class all of them such shitty people tesla,1,2017-11-04 17:37:41,0,1,0,0.0,0.9136755466461182,0.0
1248,37222,headline undersells this wellresearched and reasoned article tesla why indeeed cannot tesla register equity teslas change of course on stock redemptions signals cash flow distress hints at possibility of sec issues tesla,0,2018-01-09 19:35:24,0,1,0,0.0,0.6222184300422668,0.0
1249,27203,a 60 billion company making disclosures like a 001 otc stock,0,2018-08-07 16:56:51,0,0,1,0.0,0.0,0.8097640872001648
1250,39016,ok perfectmore model 3 deliveries means bigger lossesjust remember tesla is a business not a non profit,0,2018-01-04 16:35:47,0,1,0,0.0,0.8048666715621948,0.0
1251,28705,tesla inc tesla given a 36800 price target by robert w baird analysts,1,2017-04-06 10:09:20,0,0,1,0.0,0.0,0.627180278301239
1252,19524,tesla makes sense all these ceos dancing on pinheads to answer questions should do what did force them to ask real questions not poseur questions,1,2018-05-03 14:35:40,0,1,0,0.0,0.35879284143447876,0.0
1253,26278,huge day for tesla up more than 10 37 shares now at 28485 alltime closing high was 28604 last sept,0,2015-07-20 17:55:57,0,1,0,0.0,0.8801652789115906,0.0
1254,13976,tesla shot down quick after news,0,2018-08-10 12:37:51,0,0,1,0.0,0.0,0.6038196682929993
1255,8413,7 tesla raises funds from customer deposits and then uses them to fund operations ie theyre not held in escrow 25 of their endofyear cash balance was refundable deposits it is technically gaap correct to count this in cfo but this is basically cash from financing,1,2018-03-24 17:06:51,1,0,0,0.8293775916099548,0.0,0.0
1256,26520,aig american intl group inc message board postsaig nflx tesla adt aig stockmarket stocksalk alaska air,0,2015-12-06 01:34:07,1,0,0,0.5097702145576477,0.0,0.0
1257,35539,this tweet tesla,1,2018-07-15 21:54:08,0,0,1,0.0,0.0,0.659134566783905
1258,22181,tesla still not even close to last weeks lows holding my puts for continued downside this week,0,2015-06-22 14:34:07,0,1,0,0.0,0.5605519413948059,0.0
1259,2885,in a civilized country crooks should be jailed godmanysuckersbuyingteslamotorssharesv3rmlffs4h5 tesla stocks,0,2016-07-05 12:15:39,0,1,0,0.0,0.8885003328323364,0.0
1260,11477,tesla id short everything thu kitchen sink on weekly or next week 300 puts on thu gap up 2morrow,1,2017-04-03 19:16:59,0,1,0,0.0,0.857582688331604,0.0
1261,30010,fwiw im 95 confident short tesla via puts,1,2017-07-07 13:19:26,0,0,1,0.0,0.0,0.8909774422645569
1262,30410,backlog is looking that good is it hahahahhaahahhaha tesla,0,2018-11-15 17:28:57,0,0,1,0.0,0.0,0.5212894082069397
1263,33844,hyg ishares iboxx high yield corporate bond fund financialshyg tesla fxe hts hyg stockmarket stockmarket,0,2015-06-12 10:40:37,0,0,1,0.0,0.0,0.7896460890769958
1264,13167,tesla report q4 earnings after the bell tomorrow heres our analysis finance,1,2016-02-09 23:55:04,0,1,0,0.0,0.904945433139801,0.0
1265,19025,tesla lemon 1 rolls off the new ga4 tent line i am sure faithful will flock to the p awd car,0,2018-06-16 20:23:27,0,1,0,0.0,0.8528099656105042,0.0
1266,13370,really ever hear of samsung the battery cells in the south australia powerpacks was almost exclusively using cells from samsung ever hear the diversify tesla shortthebottom,0,2018-04-28 15:49:40,0,1,0,0.0,0.776043713092804,0.0
1267,38882,tarrifwars tesla another issue to tackle tesla,0,2018-04-04 15:56:27,0,0,1,0.0,0.0,0.8605352640151978
1268,469,investors buy shares of tesla inc tesla on weakness,0,2017-10-17 01:32:23,1,0,0,0.9035760760307312,0.0,0.0
1269,39785,fear that taking down tesla might be a risk to market psychology may mean the govt goes easy in this environment,0,2018-08-09 19:25:10,0,0,1,0.0,0.0,0.5090103149414062
1270,26273,tesla tesla model 3 headache is growing in a good way teslainctslamodel3headachegrowing,0,2017-07-31 13:35:22,1,0,0,0.8918738961219788,0.0,0.0
1271,35663,now offering 7 day free trial to options day trading team room or twtr feed nvda aapl nflx tesla amzn googl,1,2018-11-30 02:45:03,0,1,0,0.0,0.9098648428916931,0.0
1272,12050,watch the vr mt agatlin game on amd may undercut nvidia with intel deal amd nvda intc tesla sne,0,2016-03-18 18:33:48,0,1,0,0.0,0.873716413974762,0.0
1273,33738,and what about this poor abandoned car doesnt anyone like to adopt puppies anymore where is the humanity,1,2018-12-22 14:57:54,0,1,0,0.0,0.6838248372077942,0.0
1274,13185,tesla is the future we are in the 21st century electric vehicles are the future gm ford reflect in their stock prices f tm hmc grid,0,2016-04-01 12:18:59,0,1,0,0.0,0.8585025668144226,0.0
1275,21496,tesla resisted 287 lets hope it stays that way if news bad today ill be ready to load on an oversold emotional dip like the last call,0,2018-06-05 17:48:35,0,0,1,0.0,0.0,0.8093979358673096
1276,34304,tesla max pain is 31000 for maturity 06022017 prev close 31022,1,2017-05-26 03:22:40,0,1,0,0.0,0.6137402653694153,0.0
1277,10880,all of tech especially fang stocks getting obliterated aapl holding ground not happy about tesla tesla,1,2016-02-05 15:46:30,0,1,0,0.0,0.7884268760681152,0.0
1278,17542,bmw is insane teslarians tell me the whole market going is going all electric and tesla will own the mkt what the hell does bmw know,0,2017-08-07 19:51:02,0,1,0,0.0,0.7860016226768494,0.0
1279,37406,there is no substitute for live webinar if you cant make it because of other life obligations you can still benefit from the power of the ps60 theory click below and get started ps60feed nflx tesla amzn nvda twtr roku,0,2018-04-17 17:57:38,0,0,1,0.0,0.0,0.7001194357872009
1280,21114,on the fly top five analyst downgrades tesla ipgp psxp mrt apa hes,1,2018-09-28 14:36:04,0,0,1,0.0,0.0,0.9113421440124512
1281,7264,this will be good for tesla whats good for tesla is good for america politicsisnecessarybullshit,1,2018-12-03 17:27:01,0,1,0,0.0,0.7220262885093689,0.0
1282,144,tesla stc 8jun18 305 cs 470 position closed 864,0,2018-06-06 13:55:49,0,1,0,0.0,0.9219556450843811,0.0
1283,5148,elon are you considering to take tesla private like spacex so you can ignore all the fake news competitors maligningsince 80 of investors are long term it would be easier when production is ramping at a accelerated pace you can focus on production,1,2018-07-06 13:52:17,0,0,1,0.0,0.0,0.8511990308761597
1284,38537,hedgeye investing summitwhats problematic about tesla is that its a longterm story they dont make money now theyre supposed to make a lot in the future but the focus is always shortterm on tslafree access,1,2018-10-11 16:14:15,0,1,0,0.0,0.5069973468780518,0.0
1285,14117,now offering 7 day free trial to options day trading team room or twtr feed spx aapl nflx tesla amzn googl,0,2018-08-11 18:15:04,0,0,1,0.0,0.0,0.8246756196022034
1286,21813,the 25 biggest shorts in the market relative to index weighting tesla intc t nflx gm cat ge,0,2017-08-14 19:26:02,0,1,0,0.0,0.9099456667900085,0.0
1287,32142,is three more tweets away from a 420 price tag tesla,0,2018-08-14 06:01:23,0,1,0,0.0,0.5021656155586243,0.0
1288,22324,most important steps to daytrading stocks spy dia tesla aapl grpn fb uso gpro iwm,1,2015-11-24 16:05:18,1,0,0,0.9797257781028748,0.0,0.0
1289,8879,cessna plane crashes into tesla model xtslaq will probably explain this by saying tesla autopilot was at fault here,1,2018-09-20 07:23:14,0,1,0,0.0,0.8613641858100891,0.0
1290,22799,and oh by the way mclaren is profitable while tesla has operating losses of a billion dollars a yearaapl,0,2016-09-21 14:41:45,0,0,1,0.0,0.0,0.7698073387145996
1291,36984,tesla on a roll after that post er hiccup to 193 now hit an hod of 21720,0,2015-02-20 15:47:59,1,0,0,0.9319667816162109,0.0,0.0
1292,20450,tesla killing the competition,1,2018-07-18 13:03:23,0,0,1,0.0,0.0,0.5509603023529053
1293,15609,tough call i know but i would like to try and shift the from fundingsecured to noosesecuredtsla tslaq,0,2018-08-13 20:30:54,0,1,0,0.0,0.7328890562057495,0.0
1294,22385,the next catalyst that will drive tesla shares higher nextcatalystwilldriveteslashareshighersourcefeedf tesla,0,2017-01-30 02:04:55,0,1,0,0.0,0.9248731732368469,0.0
1295,28998,elon not to busy to help out puertoricorelief this guy is amazing tesla tesla,0,2018-04-19 14:55:21,0,1,0,0.0,0.67531418800354,0.0
1296,31691,bac opinions updated monday january 25 2016 065920 am amzn mro xli tesla,1,2016-01-25 12:42:09,0,0,1,0.0,0.0,0.7878903150558472
1297,1992,job description is super extensive and states a degree in business and economics with experience is required but ability to read and interpret financial statements is recommended but not essential cc,0,2018-04-26 00:44:33,0,1,0,0.0,0.8206128478050232,0.0
1298,7337,tesla bulls awfully quiet today dont gloat market karma is a bitch spx qqq,0,2018-08-09 18:46:02,0,0,1,0.0,0.0,0.7004277110099792
1299,14844,the hydrogen car from toyota could kill teslas dream tesla tm,0,2015-01-30 20:17:15,0,1,0,0.0,0.4970409572124481,0.0
1300,38650,lmao you elon youve been on twitter all day cranking out your delusion tesla,1,2018-05-24 01:59:31,0,0,1,0.0,0.0,0.7158127427101135
1301,17348,tesla tesla has not received communication from sec regarding autopilot crash probe statement via,0,2016-07-11 20:49:09,0,0,1,0.0,0.0,0.7496543526649475
1302,32676,this is pretty big news for tslagonna be wild to see what happens to the stock monday,1,2018-09-29 21:51:10,0,0,1,0.0,0.0,0.7576542496681213
1303,39332,thats from two months ago insideevs have been aggressively pumping tesla on twitter from around about the same time that electrek backed off doing the same coincidental im sure tesla,1,2018-09-21 16:57:19,0,1,0,0.0,0.8676698803901672,0.0
1304,14625,ps ill be right there with the tesla shorts if this pre open breakdown at 300 302 holds but last night it was reading around 308,1,2017-11-02 12:33:46,0,1,0,0.0,0.8588079214096069,0.0
1305,5215,bring me an equivalent of a models x i own one from a driving perspective from an automakers and i admit defeat tesla,1,2017-03-16 05:42:32,0,1,0,0.0,0.5602449178695679,0.0
1306,17987,active traders try one of these free trading guidesnflx tesla aapl sbux gs fb amzn googl nvda,0,2017-10-22 00:30:09,0,0,1,0.0,0.0,0.8416153192520142
1307,1034,lol have we reached peak tesla bagholder arrogance yet if not we must be close,0,2017-01-05 00:18:01,0,1,0,0.0,0.6585949659347534,0.0
1308,22236,premarket prep outlook for tuesday oct 24 amd cat gm mmm tesla premarket with tripledtrader and spus busin,0,2017-10-24 12:08:18,0,1,0,0.0,0.6515332460403442,0.0
1309,23534,spy i think i see an inverse hs on the oneminute chart spx dia djia qqq iwm aapl amzn goog googl fb nflx cmg tesla yhoo c,0,2016-04-04 15:24:00,1,0,0,0.7143077254295349,0.0,0.0
1310,4650,if you are not making money in this market want consistency try our team sq nflx amzn amd tesla aapl gs,0,2017-10-20 23:45:04,0,1,0,0.0,0.4657876789569855,0.0
1311,5071,acia twtr ahdh tesla poised to be the best of ibb qqq spy,0,2016-10-05 13:34:10,0,1,0,0.0,0.7712791562080383,0.0
1312,26114,tesla another perfect day to block das,0,2018-10-31 18:43:35,0,1,0,0.0,0.9002862572669983,0.0
1313,36445,elon musk tweets stock price jumps its like clockwork he should just tweet at least once a day tesla,1,2015-03-30 16:41:14,0,1,0,0.0,0.8925635814666748,0.0
1314,10873,this is just for temp not longtomo will be another day for tesla,1,2018-10-24 20:28:18,0,1,0,0.0,0.5338864922523499,0.0
1315,896,tesla has an average volume of 5803210 this is a good sign as it is always nice to have a liquid stock utmsourcetwitterutmmediumtautmcontenttautmcampaignsocialtrackingtslakeyb3fb89e7ce524df4906ab4ccaf80eec8,0,2018-02-21 05:38:06,0,1,0,0.0,0.9082297682762146,0.0
1316,38279,what happens when facebook tesla apple and alphabet meet trump fb tesla aapl googl,1,2016-12-12 18:24:30,0,0,1,0.0,0.0,0.7687064409255981
1317,24017,you really believe he rebuilt the car seriously tesla might just be poorly built,1,2018-05-30 20:03:02,0,0,1,0.0,0.0,0.9248826503753662
1318,879,dis walt disney co 52wk highdis xlv tesla aa dis stock share,1,2015-10-02 14:34:35,0,1,0,0.0,0.7126743793487549,0.0
1319,18585,approval requires a mapping system tesla,0,2016-10-20 16:49:00,0,0,1,0.0,0.0,0.6588775515556335
1320,10888,and this is what the panels look like today tesla zika,0,2018-06-27 14:26:01,0,1,0,0.0,0.799644410610199,0.0
1321,28944,why this dumbass option trader keeps playing calls on scty when she breaks will be epic tan tesla fslr,1,2015-05-21 16:56:54,0,0,1,0.0,0.0,0.7109397053718567
1322,35438,rt the tesla conference call has wrapped thanks for joining us you can find s comments on the call hereq3earningsliveblog14755178 bloomberg wsj article technology doncasterisgreat october 24 2018 at 0738pm,1,2018-10-25 08:54:19,0,0,1,0.0,0.0,0.8325020670890808
1323,39550,tesla awesome,0,2015-02-02 16:21:34,0,0,1,0.0,0.0,0.8950020670890808
1324,29989,those people trolling pretending to be procapitalists have adblockers installed in their phones and browsers ijs showerthoughts tesla,0,2018-08-14 01:54:45,0,1,0,0.0,0.8323732018470764,0.0
1325,36162,tech transportsif the market gets bullish look to these two names for strength qqq iyt spy tesla,0,2017-08-15 14:27:01,0,1,0,0.0,0.44316813349723816,0.0
1326,23552,read it here tesla was not 380 learn english strategiessellrhbuyteslatargetpriceraised,0,2017-09-18 04:36:21,1,0,0,0.668586790561676,0.0,0.0
1327,6832,tesla with the good china news today while the rest if the market crying over who knows what ill take your money though thanks,1,2018-12-06 16:51:45,0,0,1,0.0,0.0,0.548510730266571
1328,31984,solar energy has a record quarter ahead of tariff decision fslr tesla spwr vslr run,0,2017-09-12 18:17:12,0,0,1,0.0,0.0,0.9443390369415283
1329,39524,investing in americainvesting in american churchesamerican church mortgage company ticker acmca reit with 7 dividend yield solid management deeply undervaluedway more upside than tesla or amznmaking loans to established churchesnicekag wwg1wga maga,1,2018-12-12 17:44:45,0,1,0,0.0,0.9023616313934326,0.0
1330,8845,teslas 90000 cars are so expensive to repair that one insurer says premiums need to rise 30 14503943995b88ac6e26c9batesla27s24902c000carsaresohtmlsocsrcsocialshsoctrktw tesla,0,2017-06-06 04:00:00,0,0,1,0.0,0.0,0.6003128290176392
1331,29226,tesla some serious opening volume with this move,1,2016-02-01 15:11:18,0,1,0,0.0,0.6342592835426331,0.0
1332,7364,our best guess for tslas q2 earnings next week 4b in revenue 43operating loss of 520m on total gross margins of 15what are you expecting,1,2018-07-26 02:04:43,0,1,0,0.0,0.647033154964447,0.0
1333,27744,keep trying to find the next whatever iq markqd htgm whilst we trade reversals for wins and move on tesla amzn nflx twtr qqq,1,2018-03-29 19:20:25,0,1,0,0.0,0.7863914966583252,0.0
1334,8735,tesla no but they were all at least financially literate where is this stockpile of cash you are referring to,1,2018-05-26 21:58:08,0,0,1,0.0,0.0,0.8452160358428955
1335,34101,the wild west of autonomous vehicles will create a handful of big winners f tesla,1,2017-07-13 19:45:49,0,0,1,0.0,0.0,0.5768063068389893
1336,22724,niotslathe electric car revolution may come sooner than we thought carrevolutionmaycomesoonerwethoughtncna780516,1,2018-09-25 18:51:38,0,1,0,0.0,0.9070384502410889,0.0
1337,32809,lol unleashes a tweet retweet storm about everything but the consumer reports elephant in the garagetsla,1,2016-02-23 21:13:49,0,0,1,0.0,0.0,0.6925460696220398
1338,9398,back at it again tesla,1,2018-09-18 17:25:03,0,1,0,0.0,0.6799481511116028,0.0
1339,19833,tesla could sure use one of those i have a surprise tweets hes famous for,0,2015-02-23 22:42:09,0,1,0,0.0,0.5736887454986572,0.0
1340,33145,but but tesla,0,2018-08-24 00:12:44,0,0,1,0.0,0.0,0.7253283262252808
