,index,body,Target,Date,I(positive),I(neutral),I(negative),I(positive)*score,I(neutral)*score,I(negative)*score
1165,30148,tickers mentioned in fridays linkfest linksboughtbysheep xlk iwm aapl tesla scty brka brkb gs wfc,1,2016-09-09 18:40:57,0,1,0,0.0,0.47726476192474365,0.0
1166,23975,tesla small momo call sweepers detected,1,2016-09-15 15:10:57,0,1,0,0.0,0.6320664286613464,0.0
1167,28630,portfoliobuzz see why these assets are trending in 1 watchlist eurusd goog hpq spy tesla,1,2016-09-12 17:59:01,0,1,0,0.0,0.6414981484413147,0.0
1168,3104,asking bob lutz about tesla today is like asking for ibms advice about pcs in 1988 where wasis each of their biasesexperience innovation always comes from the edges exponential growth only comes from phase changes did lutz predict ford exiting sedan market no,0,2018-09-24 15:05:10,0,1,0,0.0,0.5868390798568726,0.0
1169,29067,i dont follow it closely but one month or so ago the cds market was indeed pricing a pretty high likelihood of tesla going belly up,1,2018-06-08 15:54:22,0,0,1,0.0,0.0,0.5665801763534546
1170,37395,stocknerds heres a short video on watchlist stocks that look poised to make a move higher alrm mnst tesla qqq,1,2017-10-04 11:40:46,0,0,1,0.0,0.0,0.9122852683067322
1171,18087,setting4success baba fas hit our target twtr tesla recap news smallbusiness entrepreneur,1,2015-01-15 01:13:39,0,0,1,0.0,0.0,0.8331953287124634
1172,32647,it actually completely obliterates a lot of the bear thesisthe shorts were whining about supplier issues but clearly suppliers love to work with tesla,0,2018-09-21 12:06:57,0,1,0,0.0,0.6365460157394409,0.0
1173,8610,rt qqq algos triggered sell in sigmax crossfinder ats lx 1247 pt 10150 quant goog baba fb nflx bidu gpro tesla aapl hft,0,2015-02-05 17:47:37,0,1,0,0.0,0.626899003982544,0.0
1174,36725,im not afraid to ask the tough questions bernsteins toni sacconaghi on getting cut off by on the tesla call,1,2018-05-03 18:31:19,1,0,0,0.5416960120201111,0.0,0.0
1175,1483,gdxj market vectors junior gold miners short salesgdxj sltd tesla erhe gdxj invest invest,0,2015-06-02 10:37:17,0,0,1,0.0,0.0,0.9200422167778015
1176,27047,rt tesla hft algos triggered sell in sigmax crossfinder ats lx 1603 pt 20500 msft ibm pcln goog amzn aapl nflx fb qqq,1,2016-07-08 20:06:35,1,0,0,0.9885197281837463,0.0,0.0
1177,26930,tesla tesla given sell rating at needham company llc p386095,0,2018-08-08 19:08:13,0,0,1,0.0,0.0,0.8985573649406433
1178,10721,my guess is that when inexperienced model sx workers were pulled onto the model 3 line they thought they were building usable cars and thus accidentally installed dashboardstslaqtsla,0,2018-04-07 23:03:43,1,0,0,0.8010247945785522,0.0,0.0
1179,36431,tesla will need to fade the 325 level just a tad more as we see the 319s later hold on if you must euphoria is key stocks tradeideas,0,2017-05-10 15:24:28,0,1,0,0.0,0.797065019607544,0.0
1180,2445,crash puts 100to1 payouts bankwuptcyit was all too good to be true tslaq as for tesla i shall buy more tomorrow,1,2018-10-25 01:33:31,0,0,1,0.0,0.0,0.8541388511657715
1181,6014,wait when did tesla start building whole new cars,0,2018-08-31 01:29:00,1,0,0,0.9173702597618103,0.0,0.0
1182,8277,is this why tesla is down apple just poached a senior tesla executive xidfortwsh aapl still down though wtf,0,2016-04-19 16:19:01,0,0,1,0.0,0.0,0.8606102466583252
1183,19293,i love memory lane great threadive seen many tesla bulls clamoring if only elon stopped tweeting tesla would be perfectno bulls tslaqs fate was sealed just over two years ago,1,2018-10-11 01:35:25,0,1,0,0.0,0.8023764491081238,0.0
1184,4563,news on sunday,0,2017-06-30 08:58:39,0,1,0,0.0,0.9019148349761963,0.0
1185,311,tencent bought the majority of its tesla shares in the open market its blended average price is 218 if its smart itll dump em tomorrow,1,2017-06-11 23:58:24,0,1,0,0.0,0.8382108807563782,0.0
1186,31786,tesla amazing how short ppls memories are with tesla next short panic begins to early next week into midnov truck reveal,0,2017-10-28 13:19:45,0,1,0,0.0,0.8394284844398499,0.0
1187,14526,elon musks deal with the sec doesnt fix teslas biggest problems via,0,2018-10-02 00:30:52,0,0,1,0.0,0.0,0.7371506094932556
1188,30674,the bolts 94 cubic feet of passenger space matches that of the tesla model s thingstoknowaboutchevrolets30000boltev7 almost 3 shorter easier parking,0,2016-01-14 14:43:31,0,1,0,0.0,0.539632260799408,0.0
1189,24402,once upon a time i didnt get twitter then elon musk said how big is your short position just curious and i started googling teslacharts twitter weekly three months later i created this account and got out of the cheap seatsi now have 126 followerstslatslaq,0,2018-11-30 08:56:24,0,1,0,0.0,0.932673454284668,0.0
1190,11570,oh they copying tslas strategy,1,2018-06-07 14:24:01,0,1,0,0.0,0.7878158688545227,0.0
1191,32790,dont miss our next free option trade sign up for our daily free trades at nvda tesla gs nflx bac googl fb,0,2017-12-15 15:01:31,0,1,0,0.0,0.9019297957420349,0.0
1192,1291,some comments from the denver area tesla forum,1,2018-09-06 19:29:50,0,1,0,0.0,0.9307622313499451,0.0
1193,28010,keycorp reaffirms hold rating for tesla tesla,1,2018-05-05 04:03:07,0,1,0,0.0,0.7945178747177124,0.0
1194,38701,portfoliobuzz track trending assets in 1 watchlist blockchain djia spx tesla usdcad assetsblockchaindjiaspxtslausdcad,1,2016-09-12 20:09:20,0,1,0,0.0,0.8165387511253357,0.0
1195,3168,have a look at tesla also on the launch pad,0,2018-12-12 01:55:55,0,1,0,0.0,0.9114811420440674,0.0
1196,32281,commented on elio motors files 100 million ipo registration eliomotorsfiles100millioniporegistrationsourcetweet tesla elio,0,2017-08-06 16:52:58,0,0,1,0.0,0.0,0.9318382143974304
1197,9444,well im sure even they dont forecast 100 conversion 50 would be very optimistiv already tesla,1,2017-07-30 16:41:52,0,0,1,0.0,0.0,0.6281411051750183
1198,21455,ahl aspen insurance holdings ltd financialsahl sa cgxto tesla ahl share pennystocks,0,2016-01-04 17:33:19,0,1,0,0.0,0.7004745602607727,0.0
1199,22379,norwegians quietly revolt against tesla 0724norwegiansquietlyrevoltagainsttesla via dont worry teslemmings its only their third biggest market and oh the second biggest china now has a 40 tarifftslaqtsla,1,2018-07-24 10:31:08,0,1,0,0.0,0.9058348536491394,0.0
1200,10562,via bagholderquotes im just sad and i bought in at 305 then a whole bunch at 300 now five more today at 292 buy 300 is what i was told so did it guess ill just leave it there and see how it goes tesla tesla,1,2018-09-05 02:21:40,0,1,0,0.0,0.6306626796722412,0.0
1201,5225,122316 elliott wave updates for momentum names tesla baba nvda acia,0,2016-12-23 19:41:45,0,1,0,0.0,0.9197460412979126,0.0
1202,25893,future headlineauto company ceo runs into back of firetruck with his personal cartsla,1,2018-09-05 12:35:19,1,0,0,0.5294718742370605,0.0,0.0
1203,18751,will this be livestreamed for you to watch for prison tesla,0,2018-09-18 18:29:25,0,1,0,0.0,0.8945121765136719,0.0
1204,3214,of course not why would it affect tesla tesla is a solar and tech company nothing to do with cars,0,2018-09-25 14:57:04,0,1,0,0.0,0.7237386703491211,0.0
1205,4156,next move buy or built a sharing app tesla will worth 200b with a sharing app like uber,1,2016-06-22 19:39:36,1,0,0,0.5966755747795105,0.0,0.0
1206,9632,tesla hotspot 608 yield 316 pts enter on 1hr closeclose 36368 exit 39528 stop 35505 wait for reset 35505 over to you,1,2017-08-16 20:39:09,0,1,0,0.0,0.6163354516029358,0.0
1207,38832,looooooooool elon rekt you bro stop lying thats why you whyne and rant about tesla like a kid yen yen yen talking bout shitcoins i am a bitcoin maximalist whose focused on the longterm i dont have time to hate,1,2018-12-02 19:31:41,0,1,0,0.0,0.6564010381698608,0.0
1208,19002,tesla motors inc tesla upgraded to buy at vetr inc,1,2016-11-30 11:37:29,0,1,0,0.0,0.8425347805023193,0.0
1209,33809,insider tradingill let enforcement eventually handle this onetsla tslaq5,0,2018-08-28 20:37:20,0,0,1,0.0,0.0,0.6450367569923401
1210,19315,post fomc show includes long i talking tlt tesla ge len xle live on,0,2015-03-19 12:31:24,0,1,0,0.0,0.8860617280006409,0.0
1211,18644,early movers twtr wba dis t sbux stz tesla wen agn vrx play pfe ual s wltw amzn dri,1,2016-04-05 12:51:51,0,1,0,0.0,0.9328243732452393,0.0
1212,5199,what a morning everything working googl aapl off of the 112s nflx amzn cmg tesla about to go twtr lnkd dead,1,2015-08-05 13:55:05,0,0,1,0.0,0.0,0.5424906015396118
1213,15771,ah all this negative news about tesla and still 335 usd a huge move down soon or some people knows more about the take private stuff,1,2018-08-16 20:09:34,0,1,0,0.0,0.9428679943084717,0.0
1214,3425,5 top stock trades for monday morningbb tesla cat huya rht,0,2018-06-24 14:08:52,0,0,1,0.0,0.0,0.7771580219268799
1215,39046,greenlight like lehman we think the deception is about to catch up with tesla tesla,0,2018-10-05 18:04:10,1,0,0,0.9483432173728943,0.0,0.0
1216,34014,please do your thingtsla,1,2018-07-11 23:37:27,0,1,0,0.0,0.7981213927268982,0.0
1217,38711,soxl direxion daily semiconductor bull 3x shares stock forumsoxl tesla sgyto amba soxl stockmarket,1,2015-07-07 16:44:37,0,1,0,0.0,0.694725513458252,0.0
1218,36499,i made my reservation on day 1 ill probably cancel if i end up losing the full credit sad,0,2018-08-11 02:54:07,1,0,0,0.7997406125068665,0.0,0.0
1219,23955,tesla jp morgan says concerned that decreased confidence in co on part of investors tesla may impact cos ability to raise capital on amenable term,0,2018-09-28 10:29:35,0,0,1,0.0,0.0,0.7557054758071899
1220,36826,more bad news for tesla and elon musk is recommending investors short tesla is it the right call,1,2016-03-02 14:55:19,0,0,1,0.0,0.0,0.8214573860168457
1221,17048,important note for us tesla buyers federal tax credit drops by 3750 in 3 weeks to be on the cancellation waitlist for delivery this year or if you want a display car order at or visit our stores full refund if tesla cant deliver your car this year,0,2018-12-11 14:09:38,1,0,0,0.7626782655715942,0.0,0.0
1222,29049,slightly higher quality than the more traditional general assembly line sure elon so why doesnt tesla tear down all of its buildings including the gigafactory and replace them with giant tents that would result in higher quality according to the ceo apparently tesla,0,2018-06-27 07:40:08,0,0,1,0.0,0.0,0.8837679624557495
1223,5936,tesla max pain is 20000 for maturity 10282016 prev close 19910,0,2016-10-21 15:07:48,0,1,0,0.0,0.8509157299995422,0.0
1224,6708,tesla dominated by bulls lifting the market higher throughout the day tsladailytechnicalreportfor20180206sentiment slightly bullish tesla tesla,1,2018-02-06 21:17:05,0,1,0,0.0,0.8953881859779358,0.0
1225,1398,head to head review kandi technologies group kndi vs tesla tesla p5901326 stocks,0,2018-03-04 00:25:57,0,0,1,0.0,0.0,0.7361246943473816
1226,38831,time to up all the s on tesla for the out years to account for making machines that make machines new tesla highs soon,0,2017-05-08 11:14:27,0,1,0,0.0,0.8009250164031982,0.0
1227,17079,tesla a joke bloomberg quotes gordon johnson saying a fully funded debt takeover of tesla unlikelymusk said an equity buyout,0,2018-08-21 08:34:43,1,0,0,0.9724464416503906,0.0,0.0
1228,28776,watching all these but most likely focusing on spy tesla wynn feyeyhoo babaaapl nflxlulu zqk ttph,1,2015-09-09 12:59:34,0,1,0,0.0,0.43584614992141724,0.0
1229,31764,sorry if it doesnt move tesla in favor of shorters its not news,1,2018-05-24 18:57:20,0,1,0,0.0,0.8826578259468079,0.0
1230,31805,bid financials updated thursday january 15 2015 084554 am tesla btzo brnw ugaz,1,2015-01-15 14:44:35,0,1,0,0.0,0.5146812796592712,0.0
1231,19458,in the context of todays cnbc tesla piece ponder this chartcc is this dishonest media,0,2018-06-15 17:18:10,0,1,0,0.0,0.8519741892814636,0.0
1232,25158,tesla huge decline in deliveries of the model s and x in 1q hits teslas margins at a crucial time,0,2018-04-03 15:17:56,0,1,0,0.0,0.8797581195831299,0.0
1233,5035,3heres the twentyone page pdf detailing the issues on his 80k vehicle 20tesla20model20320performance20e280a220issues20upon20deliverypdfdl0seems like he accepted delivery because hes a true believer figures will fix but tbh i think this teslemon is too far gonetsla tslaq,0,2018-11-15 05:56:56,1,0,0,0.963977575302124,0.0,0.0
1234,17078,nice tesla bearish engulfing on day chart u still playing,0,2017-09-21 17:58:34,1,0,0,0.962810754776001,0.0,0.0
1235,18662,another hot stock to check out gcei global clean energy stocks investing pennystocks potn jbzy nphc andi avfb cnct onci frfs frlf aapl tesla neo arnh gdx btc vplm,1,2018-02-06 00:42:23,0,1,0,0.0,0.8522045612335205,0.0
1236,29884,the enforcement called out for cooking the books back in 2016 obviously tesla gave zero shits then and gives zero shits now what will it take,0,2018-09-30 16:59:21,0,1,0,0.0,0.7324715256690979,0.0
1237,26516,if you dont see how this is not ok you are blinded by your love of tesla fred lamberttsla sentimentchange,1,2018-10-27 01:34:34,0,0,1,0.0,0.0,0.8538632392883301
1238,35892,elon musk wisdom of the day first i think moats are lame with respect to opening up tesla charging stns for revenue generation opportunity isnt spacexs reusable rockets a classic moat others cant replicate yet,1,2018-05-03 02:17:31,0,1,0,0.0,0.5357086062431335,0.0
1239,9164,one mistake most traders make is taking on too many speculative positions when they have a good winner like tesla be selective patient,1,2017-04-10 19:19:06,0,1,0,0.0,0.852439284324646,0.0
1240,37155,on periscope dow up 232 aapl nflx nvda tesla cmg fb spy snap twtr,0,2017-04-26 11:30:02,0,1,0,0.0,0.9049211144447327,0.0
1241,24020,ideal intensity indicator i3 optimize entries and exits for more ocrx two tesla fb,0,2017-11-02 14:24:50,0,0,1,0.0,0.0,0.5133284330368042
1242,17160,shooting in the dark here but stocks about to get highly ebullient see a major market melt up coming straight on for high beta heavily shorted merchandise like tesla twtr likely to go parabolic sign me up for 700 to 2800 for tesla and 75 to 100 for twtr by december 2019,1,2018-12-06 21:16:52,0,0,1,0.0,0.0,0.8612425923347473
1243,32338,hang tight tslaq bros we are closer to bk just a matter of time and epic victory will be ours we dont need to go all out though tesla management is doing enough of that for us,0,2018-10-02 18:32:37,0,1,0,0.0,0.7067701816558838,0.0
1244,20050,tesla some profit taker sell off here,1,2015-04-22 19:52:15,0,1,0,0.0,0.6150559186935425,0.0
1245,31649,tesla musk is a flight risk why do you think he builds rockets,0,2018-09-18 15:56:11,0,1,0,0.0,0.6093685030937195,0.0
1246,24482,heres when you will get your tesla tesla model3,0,2017-06-26 16:12:00,0,1,0,0.0,0.8722667694091797,0.0
1247,2856,s r wrong but in tesla makes s 4 overseas east coast in 1st half of quarter,1,2018-11-01 19:43:49,0,0,1,0.0,0.0,0.9253033995628357
1248,37222,tesla dropping like a rock dropping like its hot knew still more pb left we will catch the reversal on this one we love reversals d,0,2015-10-12 22:29:16,0,1,0,0.0,0.8966070413589478,0.0
1249,27203,is it possible that there is a friend of tesla large investor buying shares on days like these,0,2018-03-12 17:01:08,0,0,1,0.0,0.0,0.6031897068023682
1250,39016,final call exclusive black friday deals dont miss out trading courses chat room simulator vix uso tesla,0,2016-11-26 07:07:14,0,1,0,0.0,0.8980230093002319,0.0
1251,28705,with tesla buying scty matter of time before electric cars not needing charging stations anymore futureisclean,1,2016-06-22 17:45:36,0,1,0,0.0,0.610426664352417,0.0
1252,19524,when are you shutting down the 50b ponzi scheme in tesla,1,2018-05-01 23:38:41,0,1,0,0.0,0.7035866975784302,0.0
1253,26278,tesla 268 624 this stock is ready to fly would like to see dd day soon,0,2015-07-01 04:18:26,0,1,0,0.0,0.9352654218673706,0.0
1254,13976,tesla this might be nasty,0,2017-05-08 14:15:07,1,0,0,0.975347638130188,0.0,0.0
1255,8413,the more criticism you get the more tesla skyrockets,1,2018-10-27 01:14:30,0,0,1,0.0,0.0,0.7327906489372253
1256,26520,rt tesla hft algos triggered sell in sigmax crossfinder ats lx 1142 pt 21300 quant msft gpro goog amzn nflx fb tesla qqq,0,2015-11-25 16:42:37,0,1,0,0.0,0.8130466341972351,0.0
1257,35539,tesla lot of buying in 330,1,2018-10-24 14:06:10,1,0,0,0.78330397605896,0.0,0.0
1258,22181,tesla downgraded by bidaskclub to buy tesla tesla,0,2017-06-20 19:03:29,0,1,0,0.0,0.7136030793190002,0.0
1259,2885,track trending assets in 1 watchlist goog tesla assetsgoogtsla,0,2015-08-12 21:25:48,0,1,0,0.0,0.5973894596099854,0.0
1260,11477,amzn tesla red beans in a sea of green,1,2018-02-09 15:12:01,1,0,0,0.9535704851150513,0.0,0.0
1261,30010,tesla covered half of my 230 puts and all of my 235 puts think if we break 220 we see 215 today,1,2016-07-21 16:25:15,0,1,0,0.0,0.8924684524536133,0.0
1262,30410,tesla buy the dip,0,2017-08-10 16:09:36,0,1,0,0.0,0.6848369836807251,0.0
1263,33844,exclusive tesla targets november 2019 for start of model y production sources by tesla follow our charged auto industry coverage,0,2018-04-12 13:20:17,0,1,0,0.0,0.717181384563446,0.0
1264,13167,tesla well upward trend confirmed 225 by the end of this week,1,2016-05-11 14:08:52,0,1,0,0.0,0.6936944127082825,0.0
1265,19025,tesla is holding a hackathon to fix two problematic robot bottlenecks in model 3 production tesla,0,2018-05-16 13:44:28,1,0,0,0.575617253780365,0.0,0.0
1266,13370,2nd week of december 2017 what could be driving auto stocks p2502983 f tesla gm iyk,0,2017-12-19 20:01:13,0,0,1,0.0,0.0,0.9536128640174866
1267,38882,nvda tesla googl amzn baba aapl the data let us know risk was high holding longs at the close yesterday prices needed a reset to support,0,2017-12-19 15:15:58,0,1,0,0.0,0.6739856004714966,0.0
1268,469,tesla tesla produced a record 80000 vehicles in q3 and deliveries could be even crazier,0,2018-10-01 14:02:50,0,0,1,0.0,0.0,0.650381863117218
1269,39785,tesla shorts mondays suck,0,2018-03-12 19:15:07,0,1,0,0.0,0.8393732309341431,0.0
1270,26273,tencent wrecked this short on tesla,0,2017-04-04 13:09:14,0,1,0,0.0,0.6508249044418335,0.0
1271,35663,tesla tslaq tesla nio nionio down 010tesla down 10which is the growth stock,1,2018-11-20 19:43:20,0,1,0,0.0,0.9392135143280029,0.0
1272,12050,tslathinking about putting tesla on autopilot thinkingaboutputtingteslaonautopilot,0,2016-10-18 02:45:10,0,0,1,0.0,0.0,0.7370187640190125
1273,33738,weekly nasdaq100 stocks trend mu nvda tesla swks lrcx amat xlnx adi txn tmus dish ctsh nflx adp,1,2016-12-28 11:02:00,0,1,0,0.0,0.5756916999816895,0.0
1274,13185,says tesla will remain a public company muskteslapublichtml via,0,2018-08-25 04:03:44,0,1,0,0.0,0.7701760530471802,0.0
1275,21496,wow even lease of naked tesla s85d will assume 53 of residual value looool,0,2016-01-21 14:05:10,0,1,0,0.0,0.5779594779014587,0.0
1276,34304,jnsh hope you attended the seminar about dccharging electronschicago evcharging electriccars evs tesla,1,2017-09-08 22:16:25,0,1,0,0.0,0.8645187616348267,0.0
1277,10880,tesla market cap almost back to 60b,1,2018-11-01 14:42:10,0,1,0,0.0,0.8853533864021301,0.0
1278,17542,norway oil regions business outlook strongest since 2013 survey gld xauusd tesla barc lyg jpm c gbtc sq amzn coin aapl spy nflx nvda mu opec usd jpy usoil ukoil,0,2018-03-15 05:18:36,1,0,0,0.9523466229438782,0.0,0.0
1279,37406,these options buyers generated profits cien dltr hal jack nvda pkg tesla via,0,2016-06-09 00:15:03,1,0,0,0.8215442895889282,0.0,0.0
1280,21114,you bail on tesla yet would be really smart if you did or is your ego in a place where youre willing to ride elon down 40,1,2018-12-20 00:03:26,1,0,0,0.8569819331169128,0.0,0.0
1281,7264,tony seba 100 electric transportation and 100 solar by 2030 tesla gm f ilhmf trrxf lit,1,2015-02-08 18:14:02,0,0,1,0.0,0.0,0.6542176008224487
1282,144,pl good gains in the end but it was a definite struggle no super easy plays emes fb tesla uvxy vrx,0,2015-11-04 21:17:23,1,0,0,0.5375590324401855,0.0,0.0
1283,5148,check sedg changing the solar inverter biz and has a piece in the new tesla battery wall profitable,1,2015-06-08 16:32:21,0,1,0,0.0,0.8673772215843201,0.0
1284,38537,uwti company info updated tuesday march 24 2015 110715 pm pbr amat admd tesla,1,2015-03-25 03:12:07,0,1,0,0.0,0.5208353400230408,0.0
1285,14117,not just millennials have fallen captive to the cult around elon its live by the musk die by the musk for tesla shareholders,0,2018-07-17 11:06:50,0,0,1,0.0,0.0,0.8078124523162842
1286,21813,it points to either an overbloated model 3 inventory at current prices or to being behind in its stated goal of hitting q3 model 3 production of 50000 to 55000 unitsreminder that tesla is facing many other issues besides an incompetent ceotsla,0,2018-09-18 18:53:22,0,0,1,0.0,0.0,0.5967150330543518
1287,32142,pilgrim im long on tesla target 265 get other traders and investors ideas on,0,2015-05-27 21:43:41,0,1,0,0.0,0.6075677871704102,0.0
1288,22324,tesla after rising 400 in the last two years tesla shares have dropped 13 in 2015,1,2015-01-19 04:02:36,1,0,0,0.7372387647628784,0.0,0.0
1289,8879,same locked tesla amzn nvda holding some spy mostly and ba small size,1,2018-02-15 15:12:36,0,1,0,0.0,0.7404165863990784,0.0
1290,22799,wouldnt call them foolish if germanjapanese car makers put all their efforts in electric tesla has no chance competing in terms of,0,2017-10-23 05:25:31,1,0,0,0.4883059561252594,0.0,0.0
1291,36984,1 to 4 trade alerts with 50 to 100 profit potential everyday try our team fb nflx amzn nvda tesla aapl gs,0,2018-09-21 02:45:03,0,1,0,0.0,0.7174106240272522,0.0
1292,20450,musk for sure oil companies are going to be scaling back their investments in new oil fields massively tesla dude,1,2015-02-12 01:47:08,0,0,1,0.0,0.0,0.8291726112365723
1293,15609,do not forget to sign up to our webinar today 1015 est axon cnat cei vtgn fb vstm btgn hear enph sfix nndm spy tpiv twtr tesla pennystocks trading stocks,0,2018-06-14 09:10:03,0,1,0,0.0,0.6949514746665955,0.0
1294,22385,12 tesla after a week ago saying the roadster was totally unsafe and they knew it how now do they blog there is no car company in the,0,2016-06-10 10:08:44,0,0,1,0.0,0.0,0.6867783665657043
1295,28998,tesla me watching this stock everyday,0,2018-05-16 17:22:56,0,0,1,0.0,0.0,0.8129976391792297
1296,31691,the price of musk cutting off analysts for tesla its 2 billion tesla,1,2018-05-03 12:16:40,0,1,0,0.0,0.9055348634719849,0.0
1297,1992,dont worry just use duct tape tesla tslaq,0,2018-06-26 13:18:15,0,1,0,0.0,0.8120611310005188,0.0
1298,7337,ntsb unhappy over tesla crash statement tesla tesla accidents accidentsanddisasters automotiveaccidents,0,2018-04-02 12:10:02,0,0,1,0.0,0.0,0.8087613582611084
1299,14844,tesla stock jumps to defy impending death cross chart pattern tesla,0,2017-12-12 12:05:38,1,0,0,0.5501763224601746,0.0,0.0
1300,38650,who needs a guinea pig when you can have a cage with selfdriving teslas tesla teslasimulator madewithunity ai,1,2015-01-18 21:04:37,0,0,1,0.0,0.0,0.9277982115745544
1301,17348,i feel terrible for these employees they have been swallowing lower pay in exchange for tesla shares thinking that was better than unionizing has done anything but destroy others in his quest to be the greatest conman,0,2018-09-18 16:52:35,0,1,0,0.0,0.6869943141937256,0.0
1302,32676,advanced micro devices inc tesla inc valeant pharmaceuticals short interest update amd tesla vrx 0612advancedmicrodevicesincteslaincvaleantpharmaceuticalsshortinterestupdate,1,2017-06-12 10:04:28,0,0,1,0.0,0.0,0.7010546922683716
1303,39332,scoop tons of rear wheel drive cars at the tesla tentsale,1,2018-09-09 23:27:52,0,1,0,0.0,0.3968227803707123,0.0
1304,14625,i love how longs think 7 years to hammer home first mover advantage to just 1 market share is success meanwhile the big boys are now coming theyll make em faster better cheaper and the ceos wont need to keep twittering to prop up their share price tesla,1,2018-04-27 11:02:12,0,1,0,0.0,0.7518189549446106,0.0
1305,5215,should buy back shares before tesla shorts soon having to buyback the tens of millions of shorted shares institutions scooping up billions in stock after the company soon turns profitable and hedge funds frontrunning next summers sp 500 inclusion,1,2018-07-24 18:12:29,0,0,1,0.0,0.0,0.5843659043312073
1306,17987,perfectly reasonable explanation clearly there is no need for bi to be anything more than tesla prs stenographer tesla,0,2018-07-20 22:31:28,0,1,0,0.0,0.49365898966789246,0.0
1307,1034,dragon returned home yesterday after its second monthlong stay at the station its now headed to port for a cargo handover to m,0,2018-08-06 23:26:03,0,0,1,0.0,0.0,0.8644753098487854
1308,22236,tesla the longer this halt goes the more and more it looks like tesla exelon was notis not in the loop on any of this,0,2018-08-07 18:38:18,0,1,0,0.0,0.8917511105537415,0.0
1309,23534,tesla tesla deliveries rise 49 without help from model x xrefnewsalerttweetadw1126416,0,2015-10-02 21:21:13,0,0,1,0.0,0.0,0.7380046248435974
1310,4650,long 20 shares tesla 300789,0,2018-05-07 19:19:23,0,0,1,0.0,0.0,0.6106120347976685
1311,5071,tesla seems to have some nasty 325 overhead to deal with the distribution is going well so far under 325 bonus in a few days stocks,0,2017-05-10 19:46:30,1,0,0,0.8911013603210449,0.0,0.0
1312,26114,the tesla ytd chart is the definition of past support is future resistance,0,2018-05-15 19:30:16,0,1,0,0.0,0.9046560525894165,0.0
1313,36445,there is no turn around tesla underreported depreciation by 400500m that is it,1,2018-10-25 14:01:52,0,0,1,0.0,0.0,0.48757341504096985
1314,10873,with past performance like this how can you not sign up for a free 7day trial to winning option swing trades since 2006 baba googl tesla bidu,1,2018-08-03 23:25:04,0,1,0,0.0,0.7767969965934753,0.0
