,index,body,Target,Date,I(positive),I(neutral),I(negative),I(positive)*score,I(neutral)*score,I(negative)*score
2483,29228,active traders try one of these free trading guidesnflx tesla aapl wynn gs fb amzn googl nvda,1,2018-11-03 03:30:10,1,0,0,0.8510693311691284,0.0,0.0
2484,5223,via oldmangloom me an idiot i dont see how tesla doesnt need to raise more capitalelon a genuous we are seeing high demand from retarded billionaires with no next kin for our new spacex space tourism flight geosynchronous space tomb tesla,0,2018-09-18 01:46:43,0,1,0,0.0,0.7476101517677307,0.0
2485,6756,view our past pickspennystockpickshtmltsys sune siri vale free ftr s xoma cldn tesla gluu unbiased,0,2015-11-23 18:21:52,0,1,0,0.0,0.659733235836029,0.0
2486,21459,tesla below 197 we get 195 very quick,1,2016-12-14 20:52:40,0,1,0,0.0,0.7579140067100525,0.0
2487,11783,tesla and netflix trying to bottom here after some tough selling the high fliers coming down for some air hard to name two more innovative and exciting companies than tesla nflx,1,2018-03-29 15:17:43,0,1,0,0.0,0.7649524807929993,0.0
2488,13082,a checklist to follow while doing your due diligence sune tesla aapl,0,2016-04-18 18:50:33,0,0,1,0.0,0.0,0.7499406337738037
2489,12962,i should stop trading tesla going forward might change the nemesis title to this one although fb is right there pcln behaving well,1,2016-06-21 21:14:20,0,0,1,0.0,0.0,0.816818118095398
2490,26890,tesla first mover advantage secured autopsy tesla tslaq,1,2018-12-07 17:41:59,0,1,0,0.0,0.7305996417999268,0.0
2491,15165,tesla operating cash flow 423 million increase in accounts payable 628 million,0,2016-10-26 20:31:43,0,0,1,0.0,0.0,0.7624926567077637
2492,17213,big put buyers putoptionactivitytoday20171010html adbe mtch wdc mat splk hrb cvx jpm dyn ngd tgt amtd symc mmm fit himx tesla swk,0,2017-10-10 23:14:00,0,1,0,0.0,0.7072200775146484,0.0
2493,18685,we have now indexed 360 tesla legal proceedings up from 324 previously the big drop at the end is november ongoing tsv data at are we missing any you never replied to our request for comment on access omnicare inc,0,2018-11-13 19:03:02,1,0,0,0.6158972978591919,0.0,0.0
2494,7653,get connected and feel the difference in a welcoming professional community of talented traders and moderators who are working together as a team to profit in the market daily ask them as many questions as you likeamd tesla appl izea nlst agrx renn fred ssc baba mu,1,2018-09-11 16:55:25,0,1,0,0.0,0.5196433663368225,0.0
2495,22719,analysts now believe in tesla and revised up,1,2018-08-12 13:13:12,1,0,0,0.8201854825019836,0.0,0.0
2496,1052,whoa tesla fans should be worried tesla fireshundredsofworkers,0,2017-10-15 03:59:37,0,1,0,0.0,0.5523182153701782,0.0
2497,26052,this is an excellent news to be published by as headline credible relevant source of information tesla tslaq,1,2018-10-07 20:04:06,0,1,0,0.0,0.5038006901741028,0.0
2498,17626,international lithium and ganfeng lithium the end of the lithium big 3 tesla tesla lit ilhmf goog aapl,1,2015-04-28 13:23:19,0,1,0,0.0,0.7056996822357178,0.0
2499,32396,a bull with no horn tesla,1,2016-06-23 11:48:06,0,1,0,0.0,0.8368518352508545,0.0
2500,31386,tesla remember 618 389 is key to watch if break and hold above it see 400 pretty soon then 428,0,2017-06-26 11:50:30,0,1,0,0.0,0.6640221476554871,0.0
2501,21161,tesla tesla tops 355 as elon musk lays off workers and buys more stock symbtslainsttypefreqshow,0,2018-06-14 18:27:40,0,1,0,0.0,0.5877352952957153,0.0
2502,29954,tesla green oh my,1,2018-01-04 16:32:26,1,0,0,0.638401985168457,0.0,0.0
2503,26330,the proper response to conflict whether it lies within or without us is disengagementthe most undervalued biotech everfunded by the bill and linda gates foundationbestinvestmentfor2018ishtmlspy aapl amzn fb msfttwtr goog andi tesla nvdanlst crm amat symc adbe,0,2018-04-13 18:11:42,0,1,0,0.0,0.7129277586936951,0.0
2504,4029,is tesla leader an ego driven inexperienced leader with childlike optimism prone to gross exaggeration or simply a charismatic sociopath,1,2016-07-03 18:32:25,1,0,0,0.9383367896080017,0.0,0.0
2505,1012,if you are going to play this game you have to assume that any day could be the last large cap bankruptcies have been guillotinequick and almost never foreshadowed by any kind of formal warning from auditors or anyone else tesla,1,2018-08-02 01:14:35,0,1,0,0.0,0.8719267249107361,0.0
2506,15714,and after this blocked me tesla,1,2018-08-17 20:32:11,1,0,0,0.5987682342529297,0.0,0.0
2507,7231,tesla 200k 29589 bullish above 300 bearish below 294,1,2018-03-27 14:29:01,0,0,1,0.0,0.0,0.9497774243354797
2508,8889,tesla thinkin they burn 325ss almost 24k now lol,0,2017-12-22 20:48:19,0,0,1,0.0,0.0,0.7270306944847107
2509,1109,tesla tesla given a 19500 price target by ubs group analysts p1315274,1,2018-02-11 17:31:24,1,0,0,0.7748545408248901,0.0,0.0
2510,38631,attacking tesla for taking zev credit money is odd its free money for them wouldnt you say itd be stupid for them to leave it on the table,1,2018-10-09 23:15:15,0,1,0,0.0,0.7931275367736816,0.0
2511,15726,put protection cost analysis to hedge downside risk baba gld jpmmsft twtr tesla amzn snap nvda amzn c fb,1,2018-10-12 00:07:36,1,0,0,0.6777386665344238,0.0,0.0
2512,1107,mydx goodpickn save before todays powerhour mydx flashbackfriday tesla f trading baba,1,2017-04-21 16:55:02,1,0,0,0.8035809993743896,0.0,0.0
2513,38397,tesla model 3 conducting final road tests deliveries of the 35000 tesla to start in 3 months tslaisthefullteslamodel3waybeforeyouresuppose1794073497,0,2017-04-07 01:50:22,0,1,0,0.0,0.7672446370124817,0.0
2514,1133,its so ironic i mean didnt elon musk invent the wheeltsla,0,2016-04-19 19:47:34,0,1,0,0.0,0.8829641342163086,0.0
2515,25877,the lexus hybrid pretty car so is the mercedes bye bye tesla,1,2018-09-06 12:45:17,0,1,0,0.0,0.5719403028488159,0.0
2516,4824,1 to 4 trade alerts with 50 to 100 profit potential everyday try our team fb nflx amzn amd tesla aapl googl,1,2018-04-29 13:15:05,1,0,0,0.5425370335578918,0.0,0.0
2517,28509,tesla trading like a dog wit flees,1,2017-09-29 18:36:26,0,1,0,0.0,0.7776854038238525,0.0
2518,15170,tesla 500000 more available magnets for electric cars well have to invade afghanistan and north korea for materials lol,1,2016-04-05 23:08:05,0,0,1,0.0,0.0,0.9302890300750732
2519,16079,some stocks on my trade list today twx hum kate mro fox tesla plus usual futures previous earnings plays,0,2016-08-03 11:25:00,0,1,0,0.0,0.4956776797771454,0.0
2520,3230,teslas big model 3 bet rides on risky assembly line strategy via solid read beyond headline tesla,0,2017-04-24 14:50:42,0,1,0,0.0,0.7910845279693604,0.0
2521,17728,stellar about to see 70 reservations flood into orders in no time tesla will keep getting stronger with every week that passes,0,2018-05-11 16:49:12,0,1,0,0.0,0.8824658393859863,0.0
2522,13793,tesla goldman and morgan stanley are underwriting the share repurchase interesting,0,2015-08-13 11:44:32,0,1,0,0.0,0.629162073135376,0.0
2523,29273,more sec is seeking undetermined civil penalties against elon musk tesla,0,2018-09-27 20:19:29,0,1,0,0.0,0.7768136858940125,0.0
2524,31368,this tesla bro is mad today,0,2018-11-12 16:15:09,0,1,0,0.0,0.8892919421195984,0.0
2525,9330,and closed tesla 345p at 1060 for a quick 15 trading options stocks money aapl amzn googl nvda,1,2017-09-26 15:06:56,1,0,0,0.8898423314094543,0.0,0.0
2526,35537,this is what happened to my husband and his car today no accidentout of the blue in traffic on santa monica blvd thank you to the kind couple who flagged him down and told him to pull over and thank god my three little girls werent in the car with him,0,2018-06-16 05:17:21,0,1,0,0.0,0.8385301828384399,0.0
2527,25336,teaches howtoperfect your socialmedia presence with datascience vlo twx unp rai tesla blessed,0,2016-12-24 22:35:10,0,1,0,0.0,0.4642324447631836,0.0
2528,15922,there some stupid people out there that said i imagine the wantabe flippers are currently in the tesla deposit retrieval process and just havnt deleted this cl listings,1,2018-12-08 15:50:27,0,1,0,0.0,0.8481814861297607,0.0
2529,24266,active traders try one of these free trading guidesnflx tesla aapl cost gs fb amzn googl nvda,0,2017-10-15 16:30:19,0,0,1,0.0,0.0,0.9248282313346863
2530,3855,active traders try one of these free trading guidesnflx tesla aapl bidu gs fb amzn googl nvda,1,2018-09-15 20:30:12,0,1,0,0.0,0.6998698711395264,0.0
2531,26045,tesla doing the thing twtr refuses to do after earnings go up,0,2016-10-26 20:12:32,0,1,0,0.0,0.46516236662864685,0.0
2532,20747,tesla model 3 sales will be top 3 next month dec 2018tsla tesla model3,1,2018-12-05 11:29:35,0,0,1,0.0,0.0,0.5870592594146729
2533,9568,elan musk is losing billions tesla,1,2015-03-27 18:44:23,0,1,0,0.0,0.5205070376396179,0.0
2534,38005,tesla stock gains 047 as elon musk buys an additional 25 million in co stock tesla,0,2018-06-14 02:30:00,0,1,0,0.0,0.8884190320968628,0.0
2535,1491,just how good is model3 so good i traded my modelx for one yes you read that correctly thankselon tesla tslaq tesla,0,2018-08-30 14:40:51,0,1,0,0.0,0.5405262112617493,0.0
2536,15236,tesla twtr both one or the other or neither,0,2017-09-20 17:26:00,0,1,0,0.0,0.7384448647499084,0.0
2537,10192,watch the latest dailyrecap video hosted by spx xle amzn googl aapl uso gld nugt tesla,0,2016-05-04 20:44:46,0,1,0,0.0,0.8005062937736511,0.0
2538,13680,tesla loop ventures founder gene munster gives his take on tesla earnings,1,2018-10-26 01:38:48,1,0,0,0.7438956499099731,0.0,0.0
2539,21944,im far more worried about the financial markets misbehaving again right now than i am of tesla if tesla fails not sure that it will it wont tank the entire world economy,1,2018-10-24 09:38:17,0,1,0,0.0,0.7671849131584167,0.0
2540,10718,when you pull up to take profit in your tesla stock,0,2017-04-04 23:55:09,1,0,0,0.8518648743629456,0.0,0.0
2541,10877,despite increased competition tesla will maintain its 50 market share in the us by gene munster tesla ventures2019techpredictions,0,2018-12-27 14:49:14,1,0,0,0.9043442010879517,0.0,0.0
2542,30365,curious if you are long tesla,0,2018-04-10 22:01:29,0,1,0,0.0,0.8449553847312927,0.0
2543,25030,ive been wondering this for a while the assumption that this isnt just a failing company but a fraudulently failing company has obvious implications to any potential outcome so more a question of how do i stay out of jail than just how do i save the company tesla,1,2018-10-07 09:22:45,0,1,0,0.0,0.8216350674629211,0.0
2544,16100,oh tesla how i love your price action,1,2016-05-19 13:41:15,0,0,1,0.0,0.0,0.583294689655304
2545,32927,musk tweets about tesla motors inc game changer tesla,1,2015-09-03 17:10:49,0,1,0,0.0,0.663620114326477,0.0
2546,25175,this tesla chart is just screaming sell if you ask me what do you think,0,2015-04-10 15:25:05,0,1,0,0.0,0.5404914021492004,0.0
2547,7609,yes agreed should count as cash is fungible just like abl is also just a loan and proceeds from abl draw shld not get backed out of tslas cash balance,1,2018-11-08 18:12:43,0,1,0,0.0,0.8846121430397034,0.0
2548,10491,this tesla so far strong premarket action tryna get back to closing price,1,2015-08-31 11:49:49,0,1,0,0.0,0.7305246591567993,0.0
2549,4237,tesla tesla downgraded by vetr to hold p634469,0,2018-04-11 05:23:42,0,0,1,0.0,0.0,0.5388632416725159
2550,30903,the more vehicles tesla produces the more it compounds an everexpanding list of problemsoperational issues are the principle reason i think elon has no hope of finding a buyer like solarcity before it tesla would now just be dead weighttsla scty tslaq,0,2018-08-22 18:26:01,0,1,0,0.0,0.693367063999176,0.0
2551,3643,tesla stock opens lower after morgan stanley analysts say the model x is cool but its price is too high tesla,1,2015-10-06 13:34:50,1,0,0,0.6434110403060913,0.0,0.0
2552,10036,tesla sells vision of future against its more troubling current reality tesla,0,2016-08-04 14:18:05,1,0,0,0.5012084245681763,0.0,0.0
2553,22846,tesla rinse and repeat gap down at market open then ramp up for 1 hour then consolidate rest of day,0,2018-11-14 02:43:29,0,1,0,0.0,0.5324172973632812,0.0
2554,32592,tesla wind down is starting already and i was expecting bulls to push this to 360 couldnt even break 354,0,2018-06-29 15:52:31,0,1,0,0.0,0.5719667673110962,0.0
2555,29584,thats really not a thought its more like facts you should try them sometime facts are delicious inconvenient but delicious tesla shortthebottom,1,2018-05-01 09:54:25,0,1,0,0.0,0.8970892429351807,0.0
2556,2767,tesla misses the estimize eps consensus by 56c and the estimize revenue consensus by 3175m 2016utmcontentbeatormissutmmediumtweetutmsourcetwitter,0,2016-08-03 20:32:13,1,0,0,0.41095584630966187,0.0,0.0
2557,13192,rt tesla algos triggered sell in sigmax crossfinder ats lx 0858 pt 20500 goog baba amzn gpro nflx fb aapl qqq hft quant,1,2015-04-15 13:01:11,0,1,0,0.0,0.7922021746635437,0.0
2558,28156,active traders try one of these free trading guidesnflx tesla aapl hd gs fb amzn googl nvda,1,2018-08-13 01:30:05,0,1,0,0.0,0.8535201549530029,0.0
2559,37397,tesla will gradually break that 370 resistance may fly today later or this week,0,2018-12-12 15:07:18,0,1,0,0.0,0.7901024222373962,0.0
2560,29729,have to admit as lies go this is one of the better ones ive heard recently i am sure that the tesla ceo might actually have succeeded in persuading an sec office in say salt lake city with this line of horse shit muskbelievedhehadverbalagreementwithsaudisforteslabuyout1538172847,0,2018-09-28 22:40:25,0,0,1,0.0,0.0,0.5850478410720825
2561,1090,tesla earnings reported after the market closed,1,2017-02-23 15:43:40,0,0,1,0.0,0.0,0.9220969080924988
2562,20364,musk have to admit he makes up facts bullish tesla,0,2018-09-17 18:27:26,0,1,0,0.0,0.6311852335929871,0.0
2563,34859,tesla on highs green,1,2016-06-23 14:27:24,0,1,0,0.0,0.8793078064918518,0.0
2564,32126,tesla is a bunch of poo,0,2018-08-07 11:13:27,0,0,1,0.0,0.0,0.9015688896179199
2565,27943,not exactly breaking newstsla tslaq tesla,0,2018-10-05 15:04:43,0,0,1,0.0,0.0,0.6253042817115784
2566,13108,telsa model x deliveries surge in norway to become second bestselling car in the country modelxdeliveriessurgeinnorwaytobecomesecondbestsellingcarinthecountry,0,2016-10-04 19:17:34,0,0,1,0.0,0.0,0.7858007550239563
2567,35632,how bout taking step one in building a plant here on earth tesla,0,2016-10-25 21:07:31,0,1,0,0.0,0.6090303659439087,0.0
2568,31188,live in2min stocks up 60 googl tesla amzn lead fb rlyp z ua,0,2016-06-08 23:28:50,0,0,1,0.0,0.0,0.5864555239677429
2569,14095,is it possible that this is a temp store hub for deliveries on the east of lathrop def not a bull here but my skepticism questions everything tesla,0,2018-07-19 19:43:32,1,0,0,0.6882023215293884,0.0,0.0
2570,1048,1 to 4 trade alerts with 50 to 100 profit potential everyday try our team fb nflx amzn amd tesla aapl googl,1,2018-07-26 13:15:10,0,1,0,0.0,0.574374258518219,0.0
2571,39617,back in the real world the 10k shows a loss of 19 billion with a b in 2017 on track for a bigger loss in 2018 vendors have liens posted and payments are slow due to cash burn the car tested was an 80k car not the 35k that was reserved for by fanboys and girls tesla tslaq,0,2018-07-20 11:35:12,0,1,0,0.0,0.8569626808166504,0.0
2572,31479,and just where will this truck be manufactured certainly not at fremont which will be bursting at its seams by 2020 tesla,1,2017-09-07 12:21:04,0,1,0,0.0,0.7315007448196411,0.0
2573,17041,if you want some excitement everyday buy tesla,0,2018-11-16 17:43:49,0,1,0,0.0,0.7353242039680481,0.0
2574,13172,frfs pulls back 16 after hitting 1195 look for dips in the low 08s to load nsav mspc bioaq vape celz btop aagc mlhc aapl tesla wh rlbd pnat dirv sode msft hiph rshn nnsr amzn amrn fusz frfs acbff gcan rdgl rbiz sbfm lclp canb ftws hpil mlhc,0,2018-10-02 09:47:24,0,1,0,0.0,0.7057362198829651,0.0
2575,22087,tesla nj delivery operations presented by,1,2018-09-11 21:05:22,0,1,0,0.0,0.8855819702148438,0.0
2576,34877,cat bac gdx eem amd mcd nvda tesla ge fb nflx aapl goog amzn all updated good stuff and all free,1,2017-07-26 16:25:38,0,0,1,0.0,0.0,0.5428528785705566
2577,13424,his claims and continuous over promise and under delivery reminds me of elizabeth holme there is no green in electric car is a big lie if electricity is produced from ng coal which it is disclaimer neither long nor short tesla but have done my home work,1,2017-11-14 07:48:09,1,0,0,0.8091254234313965,0.0,0.0
2578,12156,i dunno buying the senior notes seems about as dumb as it gets your upside is minimal and theres obviously substantial risk does an 8 return justify this tesla,1,2018-09-08 19:53:16,0,0,1,0.0,0.0,0.8122460246086121
2579,32777,im not either since sec does civil and if they find criminal theyll kick it to doj i do think the doj will do something about tslajust like theranos started as sec but elizabethholmes was arrested indicted under doj that case took about four years thats super fast,0,2018-08-25 20:17:40,0,1,0,0.0,0.8613683581352234,0.0
2580,19855,rt trade of the day tesla twap hft algo for 080416 ts sell quant msft goog pcln fb nflx amzn aapl qqq,0,2016-08-04 14:53:55,0,1,0,0.0,0.850127100944519,0.0
2581,9932,psa if you are buying teslamodel3 performance s or x feel free to use my referral code you so you can avail of lifetime supercharging its a winwin tesla,1,2018-09-05 18:17:13,1,0,0,0.6437520980834961,0.0,0.0
2582,29330,panasonic look at growth and operating metrics before investing panasoniclookatgrowthandoperatingmetricsbeforeinvestingsourcefeedf tesla pcrfy pcrff,0,2015-12-01 16:56:09,0,0,1,0.0,0.0,0.8415077328681946
2583,2743,long nio i am test driving a nio next to a tesla at a race track in beijing this sunday stay tuned,1,2018-11-06 19:29:30,0,1,0,0.0,0.7933436036109924,0.0
2584,16125,shortville is nonexistent now this storm completely wiped the town off the map tesla congrats,1,2018-06-07 14:11:27,0,1,0,0.0,0.8474246263504028,0.0
2585,842,aannnddddits gonetsla,1,2018-11-19 17:18:36,1,0,0,0.5074423551559448,0.0,0.0
2586,7778,bulls will discover this thread in a couple of months searching for explanation on why tesla collapsed,1,2018-10-11 10:06:04,0,0,1,0.0,0.0,0.855650007724762
2587,21278,afternoon price volume leaders tesla fb amzn aapl baba nflx googl goog bidu nvda msft amd see the full list at activepricevolumeleaders,0,2018-08-07 19:10:34,0,0,1,0.0,0.0,0.8901063799858093
2588,28703,theyre praising him for behaving nicely and apologizing during the tesla conference call last week i guess that things really havent changed but just delayed,0,2018-08-08 21:52:51,0,1,0,0.0,0.6853704452514648,0.0
2589,35496,tesla running here 45 off 5 day ma support,0,2018-01-31 16:00:00,0,1,0,0.0,0.8568561673164368,0.0
2590,39170,tesla what if elon announces he is stepping down as ceo amzn fb twtr nflx ge nugt uso,1,2018-07-31 19:10:33,0,1,0,0.0,0.8770531415939331,0.0
2591,11335,tesla solar has the biggest rooftop solar job in the worldtesla is installing worlds largest solar rooftop array 70mw at gf 1once completed battery cells packs model 3 drive units will be made with 100 re tesla tesla tslaq,1,2018-10-12 15:19:13,0,0,1,0.0,0.0,0.7362569570541382
2592,33322,nowplaying all da smoke by future young thug in hiphop music newmusic aapl msft gld uonek czbs mck mfbp wwde byfc carv ibwc orcl tesla gbtc siri intc auy nasdaq thefour detroitbasketball lgrw,1,2018-02-06 20:40:59,0,1,0,0.0,0.9141780138015747,0.0
2593,10955,bookmark this listen to it on your commute how caught tesla in 2013 and his greatest market lessons,0,2015-04-06 16:44:08,0,0,1,0.0,0.0,0.9285030364990234
2594,25369,goldman sachs sees a 22 upside in tesla over next 6 months tesla,1,2016-05-18 14:32:44,0,1,0,0.0,0.5935004353523254,0.0
2595,35217,tesla scty this is all par for the course wrote about that in real time while it was happeningputtingsubprimesolar,1,2018-07-31 21:03:07,0,1,0,0.0,0.9083523154258728,0.0
2596,38198,survived the great put squeeze of the centurytslafundingsecured,1,2018-08-17 16:49:38,0,1,0,0.0,0.7053982019424438,0.0
2597,20071,webinar was very convincing imo feels like its a matter of when not if tesla will partner with tomtom tesla,0,2016-08-15 14:43:53,0,1,0,0.0,0.9194796681404114,0.0
2598,21860,another great morning in tesla nflx sls alna the room is on fire thank you aj and all the great mods,0,2018-04-02 14:43:12,0,0,1,0.0,0.0,0.6811587810516357
2599,33406,1st is civil or criminal gut reaction is they go civil it will probably be settled it will depend what the sec asks for and what musk tesla is willing 2 agree 2 gut tells me it will be less severe than bears think is appropriate 2 severe a penalty punishes shareholders,0,2018-08-28 19:13:36,1,0,0,0.7611148357391357,0.0,0.0
2600,20853,we can imagine that any model x involved in an accident where these doors somehow get misaligned will be a total loss tesla,0,2016-04-20 16:02:19,0,1,0,0.0,0.8974965810775757,0.0
2601,573,some good trades today missed some as well but good call 266 avg on tesla long and calls,0,2018-04-03 18:03:41,0,1,0,0.0,0.8229285478591919,0.0
2602,14927,83 of tesla shares in float are held by institutions not retail 17 that surprises me,1,2016-02-10 16:29:22,0,1,0,0.0,0.8787215352058411,0.0
2603,1465,did you really use the name porsche and tesla in the same sentence as if tesla is any way a comparable car tesla and tesla the comonay is a pos pig with lipstick,1,2018-07-11 12:36:24,1,0,0,0.861309289932251,0.0,0.0
2604,884,a watch list for oct 2nd syrg crc davx simo tap mck incy and tesla aapl nflx baba,0,2016-11-02 06:24:20,0,1,0,0.0,0.721674919128418,0.0
2605,15894,does anyone know of specific tesla holidays where the faithful gather en masse wondering if there will be sacrifices if the news worsens spx ndx iwm,1,2018-04-23 18:51:01,0,0,1,0.0,0.0,0.8719234466552734
2606,25133,tesla trading very funny algos coming off gas on the failed push watch out below if they flip 220 vs 230 basically,0,2016-08-03 20:29:29,0,1,0,0.0,0.5033141374588013,0.0
2607,29597,referral discount helltsla,0,2018-09-17 21:14:48,0,0,1,0.0,0.0,0.6321480870246887
2608,13544,ty jim5011 drn direxion daily real estate bull 3x shares changedrn tesla hyg fxc drn invest stock,1,2015-08-30 19:36:44,0,0,1,0.0,0.0,0.9327715039253235
2609,2029,as a of your tesla makes up how much tesla,1,2018-08-01 05:13:30,0,1,0,0.0,0.7890546917915344,0.0
2610,35759,tesla chart via lauch coming on 29th,0,2015-09-25 01:57:10,0,1,0,0.0,0.7080718278884888,0.0
2611,13150,a barking dog doesnt bite where are the cars with 50 million worth of batteriesgo tesla,0,2018-11-12 14:22:19,0,1,0,0.0,0.6206103563308716,0.0
2612,16866,perhaps but from a forensic pointofview pretty incredible fintwit has been well ahead of most others as this saga has playedout in real time tesla,0,2018-08-11 20:18:02,0,1,0,0.0,0.8570435047149658,0.0
2613,28358,norways 1 trillion wealth fund is now allowed to stay invested in tesla on the event of tesla going private,0,2018-08-23 07:07:44,0,0,1,0.0,0.0,0.7370107173919678
2614,17083,check out my new forbes article on virtual reality and tesla interview from this weeks media at fb tesla oculus,0,2015-10-03 17:16:44,0,1,0,0.0,0.6653321981430054,0.0
2615,31741,tesla getting smacked with likely much more to come for one of the most deceptive nastiest ceos in the usa public markets,1,2018-12-17 15:18:38,0,0,1,0.0,0.0,0.6715477705001831
2616,5536,this is a dope id get tired of these jokers too tesla,1,2018-08-01 20:33:25,0,0,1,0.0,0.0,0.6891382336616516
2617,34449,rt trade of the day nflx twap hft algo for 080916 ts sell quant msft pcln goog fb amzn aapl tesla qqq,0,2016-08-09 16:31:12,0,1,0,0.0,0.7409133315086365,0.0
2618,15125,new grohmann machine scale to 8000 week with minimal additional capital investmenttesla will likely achieve a battery cell cost of 100 per kwh by the end of the year tesla,1,2018-09-11 22:36:28,0,1,0,0.0,0.6681234240531921,0.0
2619,29474,tesla may be a 0 but it aint because of management turnover thats for sure also might be 1000 stock still0interest,1,2018-09-12 19:49:42,0,0,1,0.0,0.0,0.782119631767273
2620,25986,tesla tslaq teslawho should be indicted first,1,2018-12-19 02:06:01,0,1,0,0.0,0.5375685095787048,0.0
2621,28556,looking like tesla going greenmay have to get drunk for 1st time in my lifethis 1 stock is no good very bad boy needs a spankingtsla,0,2016-07-26 19:39:16,0,1,0,0.0,0.7633946537971497,0.0
2622,3835,ron baron who managed baron growth fund since 1994 underperformed sp500 by 7 39 29 over last 1 3 5 yrs now he make calls on tesla,0,2016-06-07 19:10:03,0,1,0,0.0,0.9075684547424316,0.0
2623,23886,tesla bullish but dt still intact we loaded on leaps in this name when others were fearful load up the boat when 300 is crossedthumbnail uurl u uwidth 1929 uproxyurl u,0,2018-04-05 05:23:05,0,1,0,0.0,0.6286870837211609,0.0
2624,17698,there also should be a bless you in addition to like on go tesla,1,2018-11-20 16:07:15,0,1,0,0.0,0.936378538608551,0.0
2625,11764,tesla still in bull or beast mode today inside day down close these can be bullish trade over 34512 tomorrow is bullish,0,2018-03-13 21:22:08,0,1,0,0.0,0.9385323524475098,0.0
2626,38969,tesla inc stock why 53 growth was not good enoughtsla 0710teslaincstockwhy53growthwasnotgoodenough,1,2017-07-11 13:33:48,0,0,1,0.0,0.0,0.9044365882873535
2627,15232,i vote for the slight breeze lol tesla tslaq,0,2018-10-02 18:46:56,0,0,1,0.0,0.0,0.8337988257408142
2628,38437,been such a great month i had to buy a few cheap lotto ticket puts on tesla yesterday boom,0,2017-02-16 18:01:45,1,0,0,0.9531824588775635,0.0,0.0
2629,39778,breaking elon musk does not wear underpants investing and faith wraul tesla,1,2017-06-06 15:16:20,0,1,0,0.0,0.8956414461135864,0.0
