,index,body,Target,Date,I(positive),I(neutral),I(negative),I(positive)*score,I(neutral)*score,I(negative)*score
2369,8049,solid trading today on tesla i love the volatility and how much this trends,1,2018-07-05 17:46:45,0,1,0,0.0,0.8165387511253357,0.0
2370,2645,tna direxion daily small cap bull 3x shares last pricetna vxx tesla uwti tna invest finance,0,2015-07-16 16:48:15,0,1,0,0.0,0.8246363401412964,0.0
2371,33807,tesla said fuck the market im grownfollowingthemarketisforsuckersrelativestrengthgalore,1,2018-12-13 18:33:52,0,0,1,0.0,0.0,0.7975839376449585
2372,30244,i dont look to jump over 7foot bars i look around for 1foot bars that i can step overmymx the most undervalued biotech to buy now funded by the bill and linda gates foundationbestinvestmentfor2018ishtmlspy aapl amzn fb msfttwtr goog andi tesla nvdaseed lulu,0,2018-04-13 19:51:34,0,0,1,0.0,0.0,0.7971467971801758
2373,1000,gild gilead sciences inc day lowclick here gild xlv gdxj tesla gild investing tradeideas,1,2015-05-21 13:38:37,0,1,0,0.0,0.9140971302986145,0.0
2374,8021,prediction bertel will never be called to advice the president because he is a loser tesla,1,2017-02-06 06:00:46,0,0,1,0.0,0.0,0.5374248027801514
2375,14756,do you know how to find a quality trader if he is not bullish on doge right now you are subscribed on noob btc bitcoin dogethereum btc ltc litecoin eth ethereum crypto bch bcash cc etf stock cme dogecoin intc elonmask tesla tesla,1,2018-09-30 01:47:18,0,1,0,0.0,0.7493773698806763,0.0
2376,28616,tesla freefobthe model 3 key fob is being offered on the store for 15000 as an alternate option to the phone key and key card the key fob is not being offered free of charge at this time as it is optional and not a feature that comes with the vehicle,0,2018-11-09 13:37:24,0,0,1,0.0,0.0,0.8635745644569397
2377,772,notheres just a little bit of dust in my eyethats from the path that you made when you said your goodbyeim not weeping because you wont be here to hold my handfor your information theres an inflammation in my tear glandim not upset because you left me this way 4 tesla,0,2018-08-28 21:35:27,0,0,1,0.0,0.0,0.8128654956817627
2378,28585,means bios tesla are showing relative strength to the spy and could continue thru day3 if markets hold it go up,0,2016-04-06 16:50:22,1,0,0,0.8372716307640076,0.0,0.0
2379,14917,trip chowdry thinks tesla can now sell 12002000 additional cars in maryland 40110 higher per capita then in californiaacid trip he is,1,2015-05-13 15:11:28,0,1,0,0.0,0.8737727403640747,0.0
2380,20490,on scale 110 10 being mother theresa trustworthy 1 being trump how do you rate goldman sachs a dg of tesla b ug of nvda,1,2017-02-27 16:28:38,0,0,1,0.0,0.0,0.8347541689872742
2381,33988,tesla must get back to alot of nice but let get real its still a pie in the sky money talks bulls walks,1,2017-02-22 14:55:39,0,0,1,0.0,0.0,0.7404589056968689
2382,12214,tesla shorts covered 22m shares at the start of this week in response to sec settlement si down to 319m shares for settlement last night,1,2018-10-05 17:00:52,0,1,0,0.0,0.5689837336540222,0.0
2383,18670,tesla 1st tesla model xs have been spotted in europe video teslamodelxsspottedeuropevideo,1,2016-02-24 13:35:53,0,0,1,0.0,0.0,0.6451007723808289
2384,7969,aapl news actives on open cboe aapl aa amzn celg mcd sina tesla board view symbolaapl,1,2015-03-04 14:52:12,0,0,1,0.0,0.0,0.7766665816307068
2385,27548,now works too hard we live in a crazy world tesla he should be lazy it is the american way sarcasm,0,2018-08-17 21:13:01,0,1,0,0.0,0.8718827366828918,0.0
2386,32422,tesla todays move is definitely personal as if custom elon buy programs were activated this stock looks really angry,0,2018-01-09 02:26:58,0,0,1,0.0,0.0,0.6281411051750183
2387,277,trade update tesla stock chart shows potential 10 decline tesla,0,2016-05-16 12:40:37,0,1,0,0.0,0.8607007265090942,0.0
2388,18137,amazing short squeeze in tesla today may be the biggest 1 day short squeeze i have seen in a very long time,0,2018-08-02 19:51:49,1,0,0,0.9541819095611572,0.0,0.0
2389,32447,tesla tesla shareholder alert the law offices of vincent wong notifies investors of an investigation invol,0,2017-10-19 15:55:24,0,1,0,0.0,0.6610482931137085,0.0
2390,25642,bullish on tesla shorts are being squeezed cost to borrow short has skyrocketed if gets over gap just under,0,2016-07-03 01:04:17,0,0,1,0.0,0.0,0.6761628985404968
2391,11858,bought the dip on tesla,1,2017-11-17 14:43:31,0,0,1,0.0,0.0,0.7429890632629395
2392,29686,what do you mean buy more at 330 tesla,1,2017-04-05 18:25:39,0,1,0,0.0,0.8729493618011475,0.0
2393,2279,check out tesla up nearly 6 after its earnings report,0,2017-08-02 21:02:38,0,1,0,0.0,0.8931818008422852,0.0
2394,1912,teslas debt price is deteriorating update tesla sdebtpriceisdeterioratingupdate via,1,2018-03-21 13:22:02,0,0,1,0.0,0.0,0.7178614139556885
2395,9523,new tesla board of directors fundingsecured halt arabmoney fintwit,0,2018-08-08 00:40:29,0,1,0,0.0,0.906358003616333,0.0
2396,7336,lol the conspiracy theory would be to ignore tesla historical facts and the fact fundamental analysis shows model 3 will ever show profits musk is at least 0 for 6 in precious claims of positive cf soon believing model 3 profitable definition of insanity bot,1,2018-05-04 12:49:49,1,0,0,0.48263925313949585,0.0,0.0
2397,20418,tesla max pain 21000 maturity 09302016 previous close 20581,0,2016-09-28 20:56:33,0,1,0,0.0,0.8691025972366333,0.0
2398,36591,oil slides following trump criticism of opec gld xauusd tesla barc lyg jpm c gbtc sq amzn coin aapl spy nflx nvda mu opec usd jpy usoil ukoil 0420oilslidesfollowingtrumpcriticismofopec via,0,2018-04-20 17:36:39,0,1,0,0.0,0.8782997131347656,0.0
2399,32974,it seems elon musk might be juggling too many jobs maybe he should resign from tesla to pursue spacex tesla,0,2015-02-12 00:06:59,0,0,1,0.0,0.0,0.9231662750244141
2400,19704,seriously tesla bulls when you say things like that you expose your ignorance the oems will make evs at scale when the economics work and guess what words you wont hear ramp hell burst rate etc theyll simply build quietly feel free to timestamp this tweet,0,2018-06-29 19:44:21,0,1,0,0.0,0.8642675280570984,0.0
2401,33252,the only real fun im having today is watching tesla because im short up the ass,1,2018-03-14 18:49:11,0,0,1,0.0,0.0,0.7439186573028564
2402,37319,all out tesla put easy money lol 266 to 26735 is the target,0,2015-07-07 14:18:51,0,0,1,0.0,0.0,0.8066325783729553
2403,5045,elonmusk out as tesla chairman per sec settlement on fraud charges 0929elonmuskandsecreachsettlementonfraudcharges via tesla,1,2018-09-29 23:21:36,0,1,0,0.0,0.46546828746795654,0.0
2404,24056,move fast and break thingsand by things i mean lawstsla,1,2018-09-18 17:25:13,0,0,1,0.0,0.0,0.8616562485694885
2405,34756,we believe mr mortons departure reflects the intensity of tslas work culture and is not indicative of problems with fundamentals or financial reporting bairdtsla,1,2018-09-10 12:41:45,1,0,0,0.4593864679336548,0.0,0.0
2406,13468,a momentum stock reversal via smb videoinfcontactkey6d433a9bdbf7a7f6fae6d60f1bf42449f66a4a8b376152f9d731ed031394502f tesla,0,2016-03-24 20:15:12,0,0,1,0.0,0.0,0.799930214881897
2407,35872,tesla closing every day at all time highs is incredibly bearish,1,2017-04-04 20:06:47,0,1,0,0.0,0.8775480389595032,0.0
2408,26428,rt stockguy22 sat webinar uploaded vbuvtsesdjnwibm googl nflx fb amzn aapl tesla ibb xbi vrx yhoo wdc chk f,0,2016-05-01 17:31:25,1,0,0,0.9348329901695251,0.0,0.0
2409,31754,you want to really catapult your career just write one positive article about tesla show you can report both sides,1,2018-07-12 19:18:02,0,1,0,0.0,0.7522112131118774,0.0
2410,2980,do you think every car manufacturer will have to get rid of their dealerships in order to survive in the future poll teslamotors tesla tesla tslaq elonmusk frunkpuppy,0,2018-11-01 15:51:25,0,0,1,0.0,0.0,0.848747968673706
2411,1146,good thing i rolled all my puts tesla,0,2018-11-10 13:44:20,0,1,0,0.0,0.8563970923423767,0.0
2412,22252,this holiday season give yourself the gift of longevity via process theres no better feeling than being in control of your trading click below and get started masterclass ps60 ps60workshop tesla nvda nflx amzn fb qqq aapl baba googl,1,2018-12-24 17:37:10,0,1,0,0.0,0.4819999635219574,0.0
2413,24075,looks like someone bought that little tesla dip,1,2018-12-31 21:05:50,0,1,0,0.0,0.8256555199623108,0.0
2414,20214,tencent did not write a 18b check to tesla it was almost all bought in the open market before the dealtry reading the filing,1,2017-04-04 22:08:58,0,0,1,0.0,0.0,0.8453101515769958
2415,25858,in another unrelated tech entrepreneur sec case judge nathan was unsympathetic to the defendants arguments and denied his 2017 motion to dismiss remember the documentary well crazy story id247276567z42ccd7f1,1,2018-10-04 18:06:44,0,1,0,0.0,0.563439130783081,0.0
2416,37862,landing,1,2017-05-01 15:35:36,0,1,0,0.0,0.9309243559837341,0.0
2417,14696,party on through 2030 dudes nothing can possibly go wrong tesla,0,2017-06-14 01:10:46,0,0,1,0.0,0.0,0.5588574409484863
2418,35354,will be driven in self driving eclasses in frankfurt auto show in 4 weeks while tesla works on adaptive cruise control,1,2015-08-17 12:49:51,0,1,0,0.0,0.8233088254928589,0.0
2419,32958,from mclaren aapl gets engineering brilliance for a few billion from tesla it gets defective unsafe cars a scam ceo for 50bno contest,0,2016-09-21 14:40:02,0,0,1,0.0,0.0,0.67510986328125
2420,12950,tna direxion daily small cap bull 3x shares current pricetna aem tesla goog tna tradeideas finance,1,2015-08-25 19:46:38,1,0,0,0.9276244640350342,0.0,0.0
2421,261,wow brand new nhtsa tesla suspension complaint this time for a 2014 model i can not vouch for its accuracy,1,2016-06-19 13:25:48,0,1,0,0.0,0.8694635629653931,0.0
2422,22522,crbp aeterna zentaris inc stock message boardread more crbp tesla coup finance,0,2016-10-24 09:35:36,0,0,1,0.0,0.0,0.9355228543281555
2423,14483,haha whatyou couldnt see this problem coming hahahahahatsla is going tslaq lol,1,2018-09-24 18:43:02,1,0,0,0.5839007496833801,0.0,0.0
2424,9606,id agree with the first half of your tweet but not the second it seems to me that crucial production information is being withheld a free market relies on transparency with shareholders and buyers disclosure i own a tesla vehicle but have no positions regarding tesla,1,2018-07-02 17:02:25,0,1,0,0.0,0.7737288475036621,0.0
2425,29435,which of course has absolutely nothing to do with his employer ms being lead underwriter for most of tesla s capital rounds so far,0,2017-06-14 20:51:13,0,1,0,0.0,0.9334399104118347,0.0
2426,8528,two sets of books explains financially delivered code in logistics systemtslatslaq,1,2018-10-25 04:46:18,1,0,0,0.631740152835846,0.0,0.0
2427,8568,rebutting the point of autopilot causing the accident with the point of it falling apart tesla tslaq,1,2018-05-25 22:25:32,0,1,0,0.0,0.8821606636047363,0.0
2428,20970,i have no ax to grind with tesla but damnyoure making nflx seem like a value stock,0,2018-08-01 21:46:10,0,0,1,0.0,0.0,0.9307981729507446
2429,17367,active traders try one of these free trading guidesnflx tesla aapl ibb gs fb amzn googl nvda,0,2018-11-16 23:30:09,0,1,0,0.0,0.7696754336357117,0.0
2430,26971,dolv has an updated otc market business description that says it produces ev cars only 0427 cents sp what a steal 500 km dolv tesla,1,2017-05-17 17:46:37,0,1,0,0.0,0.5952911972999573,0.0
2431,7989,we are long in vox xlv xly tesla and holding long term positions in gdx chk elliottwave,1,2017-11-09 14:58:40,0,1,0,0.0,0.6195894479751587,0.0
2432,18119,yknow i really dont believe in bringing a persons family into these talks but ross brought it upon himselfso hey rosss wife the question is who says tesla is worth 60 billionif you can buy a dozen eggs for 2 why pay 20tslaq tesla tesla,0,2018-06-29 22:21:22,0,1,0,0.0,0.4903673231601715,0.0
2433,5001,tesla is going to revisit 199 close the gap of 628 will keep an eye on it stocks trade investing premarket,0,2016-10-06 13:19:03,0,1,0,0.0,0.8708985447883606,0.0
2434,34241,my take is that even giving tesla the benefit of the doubt its valuation is far too high but ill also say that interperiod revenue and costs recognition changes without past period adjustments is poor accounting and suspicious,0,2018-11-15 16:42:06,0,1,0,0.0,0.8176393508911133,0.0
2435,26629,equities get trumped market update by vince vora for april 6th 2017stocks vix itb amzn fxy tgt tesla,1,2017-04-06 22:54:41,0,0,1,0.0,0.0,0.8308814167976379
2436,25980,was thinking of hedging off some of my long put delta with long stock but it just feels dirty to buy this pig after seeing the insideevs numbers not going to hedge at this point tick tock tesla tslaq,0,2018-08-01 17:36:07,0,0,1,0.0,0.0,0.48958584666252136
2437,1427,are we heading into a recession cramers mad money 7715 areweheadingintoarecessioncramersmadmoney7715sourcefeedf tesla shak aldr ci vsat jblu va aa fcx,0,2015-07-08 11:40:49,0,1,0,0.0,0.6753286123275757,0.0
2438,4990,you must be very pleased with netflix this q i got back into tesla at 189 after bailing at 248 so far so good there,0,2015-01-26 15:34:23,0,1,0,0.0,0.9155975580215454,0.0
2439,39360,tesla 322 dbl bottom needs to hold or its lights out to 320 test,1,2017-07-11 17:03:29,0,1,0,0.0,0.753109872341156,0.0
2440,35455,out tesla puts 18,1,2018-12-06 16:17:13,1,0,0,0.8538882732391357,0.0,0.0
2441,23082,and tesla is now trying to break through a yearlong 260 resistance shorts are putting everything on the line here to keep it away from 400,0,2018-06-15 16:01:38,0,1,0,0.0,0.876035749912262,0.0
2442,35456,dust direxion daily gold miners bear 3x shares volumedust xlp tesla ery dust pennystocks pennystocksdxj,0,2015-07-25 03:38:14,1,0,0,0.8298606872558594,0.0,0.0
2443,2464,tesla files their 10q hours ago no mention of any go private transaction,0,2018-08-07 19:02:36,1,0,0,0.5532438158988953,0.0,0.0
2444,37985,tesla capitulate into close hope so still holding 350 put expiring tomorrow,0,2018-08-09 19:04:13,0,0,1,0.0,0.0,0.8125545978546143
2445,20755,tesla is up next same type of fraud going on there elon will be prosecuted next year,0,2018-06-16 10:12:04,0,0,1,0.0,0.0,0.8167261481285095
2446,27816,any idea total number of loaner cars at tesla 40006000,1,2018-10-02 19:51:30,0,1,0,0.0,0.6814600825309753,0.0
2447,17953,tesla up and over 10wk again,0,2017-10-10 20:05:50,0,0,1,0.0,0.0,0.8398163318634033
2448,18837,tesla as long as nobody starts posting gifs of bears riding tricycles,0,2016-05-19 19:39:05,1,0,0,0.5187041759490967,0.0,0.0
2449,1801,dt sticking with tesla short position october 300 puts defend trade here with short call spread tesla,1,2018-09-20 14:07:10,0,1,0,0.0,0.5398706793785095,0.0
2450,23032,riding for the cause rn on squak box asked some fucko whether the 420blazeit tweet was because shit is crumbling tesla,0,2018-08-21 12:13:57,1,0,0,0.8471774458885193,0.0,0.0
2451,39272,might sound crazy but i think soon tesla will have a 75 million plus share dayand it wont be the good kind,0,2018-06-21 18:48:26,0,0,1,0.0,0.0,0.4386981129646301
2452,39551,a tesla bar the bottle has to be prepaid two years in advance before you get a slot when you arrive they only have the especial at double the price the normal tequila hasnt arrived bartender elon asks you to kindly come back next year cashier keeps the change for months,0,2018-04-05 12:35:25,1,0,0,0.9038031101226807,0.0,0.0
2453,20416,8xnikkei has published tons 400 in the last 3 month vast majority are about tesla and going private other than that 2030 specific to tesla,1,2018-09-27 02:02:29,1,0,0,0.6664955019950867,0.0,0.0
2454,14224,no time frame so if someone gets a nonlidar solution on the market in 10 years it will prove musk right even if tesla has gone chapter 11 by then,0,2018-02-07 23:03:18,0,0,1,0.0,0.0,0.8205228447914124
2455,34940,risks to suppy chain and consensus estimates due to teslas miss tesla,0,2017-01-04 06:30:13,0,1,0,0.0,0.679423451423645,0.0
2456,6969,devonshire issues part two of tesla short thesis with expanded analysis of tesla financial and business model risks,0,2016-05-24 12:31:10,0,0,1,0.0,0.0,0.9190235733985901
2457,33128,how many more executives are left to resign at tesla this is wild,1,2018-09-13 13:08:03,0,1,0,0.0,0.8111274838447571,0.0
2458,1285,the tesla board trying to figure out how the funding works on a tesla buyout at 80b,0,2018-08-09 23:27:15,0,0,1,0.0,0.0,0.7710314393043518
2459,30778,shw sherwin williams co day highshw tesla itb cafd shw finance tradeideas,0,2015-09-27 13:47:20,0,1,0,0.0,0.7268571853637695,0.0
2460,21941,cop stock price updated friday october 16 2015 025925 am ief sbux tesla avgo,1,2015-10-16 07:34:40,1,0,0,0.5657694935798645,0.0,0.0
2461,1901,unp bac aapl ibm nflx mu fb t ge baba tesla jd nvda c ebay amzn amd ea1018 most active options,0,2017-10-19 02:07:20,0,1,0,0.0,0.9033914804458618,0.0
2462,29233,model x malfunctions are hurting tesla reliability score yet same ceo wants to build manned mars rockets soon consumerreportsreliabilityrankingmodelx,0,2016-10-26 00:29:54,1,0,0,0.5287229418754578,0.0,0.0
2463,31850,spy morning gap strategy day trade opening gaps vwgnrzstg4kyfmt22 aapl qqq amzn tesla nflx fb stocks stockmarket daytrading,1,2017-07-08 19:30:44,0,1,0,0.0,0.8351739048957825,0.0
2464,1416,rely signature group holdings inc market caprely tesla ntek xiv rely share stockmarket,0,2015-06-01 05:15:19,0,1,0,0.0,0.8840230703353882,0.0
2465,33443,tesla hes right,1,2018-12-27 02:09:47,0,0,1,0.0,0.0,0.8466636538505554
2466,23006,twtr poll will twitter get bought outbuyoutpolltsla acia twlo vrx ilmn googl goog cmg qqq spy,0,2016-10-11 15:36:32,1,0,0,0.5847946405410767,0.0,0.0
2467,3715,tesla autopilot fooled by turn combined with brow of hill ends up driving on the wrong side of the road without disengaging ai tesla vflxyhwfvazaiamplatformtopinfluenceartificialintelligencevia trumpery45,1,2018-05-07 14:00:20,0,1,0,0.0,0.8172762989997864,0.0
2468,7745,tesla is nothing more then a busted growth story when will the rerating occur no idea,0,2018-11-04 13:43:48,0,1,0,0.0,0.7145969867706299,0.0
2469,8124,credit suisse positive on tesla production progress creditsuissepositiveteslaproductionprogresssourcefeedf premarket tesla,1,2016-02-08 12:50:03,0,1,0,0.0,0.5281903147697449,0.0
2470,7625,tesla tesla model 3 production was slow because a supplier really dropped the ball said elon musk traders,1,2017-11-02 01:42:44,0,0,1,0.0,0.0,0.91019207239151
2471,566,sold all tesla may26 310c at 432 from 224 almost 100 profit great run still holding jun2 calls,1,2017-05-25 14:46:58,0,0,1,0.0,0.0,0.8862656354904175
2472,20305,tesla not a new chart but todays close has a historical importance and cant wait to see how the bulls push above h,1,2016-12-08 05:10:01,0,1,0,0.0,0.8493776917457581,0.0
2473,12172,7 will the bloomberg tracker be continued well see kudos to for all the great info along the way i feel confident even without the bbg tracker there is enough information publicly available to determine production rates tesla,1,2018-03-12 01:43:51,0,0,1,0.0,0.0,0.7019158601760864
2474,17466,keeping drinking while big government keeps investigating tesla,0,2018-11-15 00:37:53,0,1,0,0.0,0.7595603466033936,0.0
2475,13199,tesla ir firm working overtime this weekend tesla n cnbc lovers,0,2018-06-24 20:34:21,0,0,1,0.0,0.0,0.7485695481300354
2476,19242,tesla huge potential next week if youre into that sought of thing,0,2018-06-01 16:22:10,0,1,0,0.0,0.9127403497695923,0.0
2477,21422,well just have to wait for the financials to deteriorate to the point where tesla simply runs out of money if capital markets tighten and suppliers get nervous this could happen as soon as june imo,0,2018-04-04 14:55:01,0,0,1,0.0,0.0,0.5447039604187012
2478,22121,dont many mutual funds fiscal year end oct 31 halloween how scary tesla,1,2018-09-07 17:59:52,0,1,0,0.0,0.6077204346656799,0.0
2479,20989,tesla is going to embarrass warrenbuffett tesla brkb ta,0,2017-10-09 18:45:47,0,1,0,0.0,0.9121647477149963,0.0
2480,7462,if today was a taste of whats to come 2018 is going to be a challenging year for cash hungry tesla,0,2018-02-09 20:59:44,1,0,0,0.6151505708694458,0.0,0.0
2481,11699,mercedes plans to take on tesla with a 1 billion us electric push cnnmoneystream tesla,0,2017-09-21 18:35:20,0,1,0,0.0,0.8412233591079712,0.0
2482,14085,hi christopherthks for fl see my last price target for aapl twtr tesla goog on,1,2015-07-31 03:58:41,0,0,1,0.0,0.0,0.7951548099517822
2483,29228,rdgl0033 whats an atm stock swingtrade alert amzn tesla wmt tgt nvda spy gld ebay aapl fb twtr gs s goog dis ibm msft bidu vz adbe amat adsk avgo baba cdns cavm cern chkp csco ctxs ctsh csc dvmt dov dst atvi ea mu pypl siri,1,2018-09-10 10:04:25,0,1,0,0.0,0.871328592300415,0.0
2484,5223,things not normally found in the same articleambienmalariagrimes brought to you by tesla ceo elon muskthis tesla prspin will backfire famously musk totally lacks selfawareness,0,2018-08-17 06:21:43,0,1,0,0.0,0.7001897096633911,0.0
2485,6756,how much would mgt be worth if was ceospy qqq iwm uwti goog aapl pawn zumz scty tesla lc twtr bac sq ibm twtr,0,2016-05-26 14:02:29,0,0,1,0.0,0.0,0.563241183757782
2486,21459,teslas deal with solarcity is a remarkably bad idea teslasdealsolarcityremarkablybadideasourcetweet tesla scty,1,2016-06-23 14:08:06,0,1,0,0.0,0.9116559624671936,0.0
2487,11783,how to trade aapl nflx bidu googl fb msft tesla twtr mu aal and more weekly earnings stock options picks subscribe weekly earnings stock options picks 3 months optionspickscomproductsdailystockoptionspicks3monthsofalerts optionspickscomproductsdailystockoptionspicks3monthsofalerts,1,2018-04-30 13:27:41,0,1,0,0.0,0.8358851075172424,0.0
2488,13082,tesla got that for 2 pts,0,2017-08-02 21:14:36,1,0,0,0.9217362999916077,0.0,0.0
2489,12962,buy tesla stock on monday,1,2018-09-29 23:41:32,0,1,0,0.0,0.6593904495239258,0.0
2490,26890,heres your treatslooks like elon pulled many trickstrade carefully broschartoween2018tsla tslaq,1,2018-10-24 20:42:09,0,1,0,0.0,0.8785607814788818,0.0
2491,15165,what that a swatting attempt on mrtripp there tesla,0,2018-06-21 19:12:23,0,1,0,0.0,0.5630477666854858,0.0
2492,17213,with big oil dieselgate and german auto cartels defending a fossil fuelpowered future when will policy makers and the media start to support an electricvehicle future read here tesla teslamotors teslamodel3 tesla electricvehicle elonmusk,0,2018-08-24 17:55:44,0,1,0,0.0,0.5655117630958557,0.0
2493,18685,tesla tesla isnt seen as a real threat to existing automakers whyautocompetitorsarentscaredofteslainctsla,0,2017-09-17 12:39:31,0,1,0,0.0,0.508542537689209,0.0
2494,7653,ok despite my ve bias from tesla earnings seems nothing to be new is there,1,2017-02-22 21:32:19,1,0,0,0.7668719291687012,0.0,0.0
2495,22719,todays top 5 technically ranked large caps amd fmc tesla nrg wdc sccrankings via,1,2017-04-11 20:12:19,0,1,0,0.0,0.8896406888961792,0.0
2496,1052,facing this lineup is no bueno wy tesla dks aeo low mnkd aks ddd jcp,0,2016-03-22 05:02:46,0,0,1,0.0,0.0,0.9030148386955261
2497,26052,tesla active relative volume 611 1h 300 am nasdaq ndx,1,2015-05-13 11:12:36,0,1,0,0.0,0.8979173898696899,0.0
2498,17626,dont worry too much new numbers coming out in few days i will make a friendly 100k bet that its more than 2078 i would to get tesla model 3 performance for free by winning from this bet tesla,1,2018-09-30 14:19:36,0,0,1,0.0,0.0,0.9400623440742493
2499,32396,just received verbal approval at bar that i will never have to pay taxes again more drinks and govt guy will confirm it on a napkin tesla,1,2017-07-20 16:18:11,0,1,0,0.0,0.8182352781295776,0.0
2500,31386,in case you wondered what i meant by watching for responsive selling conviction i meant thistsla,0,2016-05-16 17:40:12,0,0,1,0.0,0.0,0.4890196621417999
2501,21161,better answer stay away because this stock is a tesla,0,2018-04-02 21:54:57,0,1,0,0.0,0.8908091187477112,0.0
2502,29954,why tesla is the only smart car to buyfuture ready self driving hardware in every new vehiclenew chip software advantage battery tech superiority charging network will make it extremely difficult for competitiontsla tesla tslaq,1,2018-12-21 04:59:05,0,1,0,0.0,0.9363644123077393,0.0
2503,26330,day trading chatroom for free stocks trading spy gbsn drwi cdrb tesla sune csii,0,2016-07-17 08:25:04,0,1,0,0.0,0.9193330407142639,0.0
2504,4029,tesla jefferies will most likely raise target after meeting with musk,1,2017-12-11 16:00:19,0,1,0,0.0,0.8416412472724915,0.0
2505,1012,tesla motors alibaba group heres why the stocks are up today tesla baba,1,2015-10-23 14:04:52,0,0,1,0.0,0.0,0.7819067239761353
2506,15714,are you on the tesla accounting staff if not how would you know,1,2018-10-03 10:14:41,1,0,0,0.8209000825881958,0.0,0.0
2507,7231,tesla sell side back 2 their old tricks stifel falling for the banana in the tailpipe trick once more tesla still a short by any measure,1,2015-05-07 15:30:35,0,1,0,0.0,0.6282689571380615,0.0
2508,8889,is this the next valeant nextvaleantsourcetweet amzn arlz avg depo dsnky ge kkr ms ul un vrx mrd rrc tesla scty,0,2016-09-16 14:42:18,1,0,0,0.6982618570327759,0.0,0.0
2509,1109,tesla up almost 50 in last 2 months beast qqq,1,2018-12-12 15:50:05,1,0,0,0.4094262421131134,0.0,0.0
2510,38631,tesla dropping earnings on top of f tomorrow might be a bad sign for shorts after reviewing all recent info on tesla dominating its categories citron is long telsa for this quarter full report citron research tweets,1,2018-10-23 13:40:06,0,0,1,0.0,0.0,0.7684157490730286
2511,15726,obviously tesla tslaq,1,2018-12-27 23:25:44,0,1,0,0.0,0.7933297753334045,0.0
2512,1107,ashr anglogold ashanti ltd 52wk lowashr etp tesla gld ashr pennystocks invest,1,2015-10-15 07:32:34,0,1,0,0.0,0.8301830887794495,0.0
