,index,body,Target,Date,I(positive),I(neutral),I(negative),I(positive)*score,I(neutral)*score,I(negative)*score
3801,9165,go s spotty prophetic record muddles tslas assurance on cash 0404musksspottypropheticrecordmuddlesteslasassuranceoncash via,0,2018-04-04 08:50:02,0,0,1,0.0,0.0,0.8068540096282959
3802,6612,whatever the tesla reorgrestruct is this is what elon is referring to as the short burn of the century in time for the flamethrowers that are due later this month believe they intend to disavow scty debts which will be a massive legal problem given his own debt xchange,1,2018-05-04 21:39:19,0,1,0,0.0,0.8627015352249146,0.0
3803,11181,tesla can head into 270,1,2017-03-16 13:48:03,0,0,1,0.0,0.0,0.6034786701202393
3804,2189,main takeaway after reading this article the author has obviously never been in a modern auto factory previous to tesla or he would not present any of this as novel or hes simply an elon stooge,1,2018-06-08 16:50:20,0,1,0,0.0,0.8615490198135376,0.0
3805,22599,yes soo what tesla lol,1,2018-02-09 18:30:06,0,1,0,0.0,0.8609017729759216,0.0
3806,35938,can tesla win military contracts read here tesla teslamotors teslamodels teslamodelx teslamodel3 elonmusk,0,2017-03-02 12:27:11,0,1,0,0.0,0.7060019373893738,0.0
3807,8745,tslaq all the institutional funds are dumping tesla shares they know its going down its just a matter of time now tesla is a zeroreality,1,2018-10-21 23:06:32,0,1,0,0.0,0.9082045555114746,0.0
3808,19032,ideally tesla takes 336 see 342 nvda takes 147 see 151 but only 4 trading days this week weekly vol not enough learn 2 lock gains,1,2017-05-31 02:38:06,0,1,0,0.0,0.6976200938224792,0.0
3809,16703,tesla chart looks like a crypto no gradual movements sideways until it is determined that pricing should be different which then happens all at oncegetting ready for the drop to 100,0,2018-08-27 18:24:38,0,1,0,0.0,0.6835559606552124,0.0
3810,7402,its the best car ive ever owned that needed service within the first 1000 milestsla negativedrivingexperience,1,2018-09-12 00:12:00,1,0,0,0.526419997215271,0.0,0.0
3811,32874,tesla yes tesla is officially a friggin anvil i will enjoy watching the bernie madoff of rentseekingcrony capitalists die a slow death,1,2018-08-17 14:31:51,0,1,0,0.0,0.6110453009605408,0.0
3812,16552,ive made my position clearmarket is about to open tesla,1,2018-08-16 13:13:03,1,0,0,0.944976806640625,0.0,0.0
3813,23719,gme gamestop corp stock message boardgme ewj frcto tesla gme invest nasdaq,1,2015-07-10 13:37:16,0,1,0,0.0,0.8748577833175659,0.0
3814,30868,tesla boucing off the 20 on the weekly if breaks 205 target testing 9 ma on 2 min,0,2016-05-05 14:45:22,0,1,0,0.0,0.8230845928192139,0.0
3815,37746,tesla oh well sometime this month we will reengage,0,2016-08-03 20:21:29,0,1,0,0.0,0.6990213990211487,0.0
3816,14794,ryto sunshine biopharma inc askryto fxi tesla clx ryto invest share,0,2016-01-17 01:46:33,0,0,1,0.0,0.0,0.7317683696746826
3817,36515,wall streets top banks cant agree about tslas future model3elonmuskgoldmansachsmorganstanley via,1,2017-10-03 22:13:37,0,1,0,0.0,0.4966493546962738,0.0
3818,2277,customized research for gm vs tesla stock11923stock22033,1,2017-04-12 20:24:15,0,1,0,0.0,0.9064022898674011,0.0
3819,27929,finally a tesla in north korea it was a bit of a hype in norway in 2013 but happy to hear you catching on,1,2018-07-07 13:09:20,0,1,0,0.0,0.7744876146316528,0.0
3820,25878,stay long tesla staylong tvtradingideas,0,2017-04-26 04:39:14,0,0,1,0.0,0.0,0.7048720121383667
3821,25228,tesla today seems to go opposite spy today picked it up as a hedge,0,2016-04-25 17:14:22,0,1,0,0.0,0.8501247763633728,0.0
3822,13608,pcln stock message board updated thursday february 5 2015 011138 am tza bidu cnet tesla,0,2015-02-05 06:41:29,0,0,1,0.0,0.0,0.6829466223716736
3823,1888,spreaker gratitude happy money success wealth slv gld qqq dia djia btc ltc spy stockmarket commodities investing finance stocks gold silver fb twtr aapl amzn tesla intc amd nflx,0,2018-09-21 05:32:45,0,1,0,0.0,0.5137411952018738,0.0
3824,516,aaaaaand tesla up 10 on this new legal liability,0,2018-12-27 00:49:48,0,1,0,0.0,0.9007962942123413,0.0
3825,19766,as much as i hate tesla valuation the stock is intriguing if oil and gasoline prices continue to rise would be huge catalyst,0,2016-05-24 16:37:17,0,1,0,0.0,0.9132195115089417,0.0
3826,8374,top money flow today free stocks app tlt tesla jnk jpst bac lqd gld bil spy amzn ewj shy msft eem fndf fxi aapl ba vz ko,1,2018-10-23 19:01:16,0,1,0,0.0,0.907476544380188,0.0
3827,23717,dont underestimate elonmusk tesla killed the tesla killer porsche edition teslakilledteslakillerporscheeditionsourcetweet vlkay tesla,0,2016-09-02 15:07:31,0,0,1,0.0,0.0,0.8246369957923889
3828,4093,in case anyone thinks delivery problems are just model 3 model s deliveries arent great either normally i skip them storey tslapage 49x,0,2018-08-23 12:24:28,0,0,1,0.0,0.0,0.6663092374801636
3829,2650,tesla has been dead money for over 2 years and down 1125 over last year youve already seen all time highs,0,2016-05-26 18:25:19,1,0,0,0.8946797847747803,0.0,0.0
3830,28984,good thing you can rely on your robust profits to see you through this period tesla,1,2018-07-10 14:18:18,0,1,0,0.0,0.8392204642295837,0.0
3831,35287,tesla tesla still fighting back,0,2015-01-06 16:42:16,0,0,1,0.0,0.0,0.8247035145759583
3832,38825,musk saudi fund approached multiple times on going privatetsla,1,2018-08-13 13:04:56,0,1,0,0.0,0.9209863543510437,0.0
3833,33341,tesla active relative volume 469 1h 200 am nasdaq ndx,0,2015-08-14 06:06:05,0,0,1,0.0,0.0,0.49668681621551514
3834,21258,otoh he is actually making these videos with a tesla who the hell buys or even rents a tesla 100d to make tesla short disinformation seems unlikely unless its just like a relatives car still wouldnt explain the why we see different cars seems unlikely,0,2018-06-11 19:52:58,0,1,0,0.0,0.8681280016899109,0.0
3835,15375,tesla heres why tesla is the riskiest stock in history whyteslariskieststock160751803html stocks,0,2017-02-28 16:51:57,0,0,1,0.0,0.0,0.8681545853614807
3836,14073,snap short sale maximal entry point seekingalpha snap tesla aapl goog shortselling trading stocks,1,2017-03-06 06:57:54,1,0,0,0.5060293674468994,0.0,0.0
3837,5292,tesla tesla is a stock that canaccord genuity seems to be very interested in nasdaqtslaisastockthatcanaccordgenuityseemstobeveryinterestedin,1,2018-08-04 03:14:09,0,0,1,0.0,0.0,0.5861499905586243
3838,33385,not until you tell us what youve done with peter hochholdinger tesla,1,2018-07-14 02:53:34,0,1,0,0.0,0.8762582540512085,0.0
3839,14592,1 avg american earns 60k family income a yr 70k car is not mass market2 tesla cannot produce a 35k car at a profitreason enough,0,2018-09-24 04:07:32,1,0,0,0.8311364054679871,0.0,0.0
3840,34156,we calculated 63day expected return of tesla for you 693,1,2017-07-07 05:25:02,0,1,0,0.0,0.7871783971786499,0.0
3841,11347,tesla indy appealing to you or too late in day,0,2015-09-14 17:55:40,1,0,0,0.9218124747276306,0.0,0.0
3842,23266,todays million dollar put options tradeaapl amzn bkng cgc hclp qqq tbt ttm ba baba exas sage slb spy tesla amat vlo aveo sq z,1,2018-11-06 21:06:07,0,0,1,0.0,0.0,0.5244367718696594
3843,14686,sears most valuable asset could be its billions in losses chicago tribune shldq rdgl nhpi mhhc hmny czni retc tesla bioaq mlhc grdo rcgp wwio trep gifx bizsearsbankruptcytaxlosses20181024storyhtml,1,2018-10-25 04:36:52,1,0,0,0.9397019147872925,0.0,0.0
3844,1418,yep i did the same lowering costbasis i already made a killing on the last couple of swings buying incrementally on way down selling incrementally on way up tesla tesla,1,2018-10-09 21:43:00,0,1,0,0.0,0.8165980577468872,0.0
3845,9056,not that hard to see tesla play this range like it did decmar before making its mind up spx,1,2018-06-05 01:30:47,0,1,0,0.0,0.5748999714851379,0.0
3846,27164,maybe not that extraordinary teslas 10q reveals q3 may not have been profitable after all tesla,1,2018-11-07 11:52:33,0,1,0,0.0,0.900704026222229,0.0
3847,6282,tesla 2975 weekly for 220 gain only holdin apr 21 300 calls,0,2017-04-03 14:37:27,0,0,1,0.0,0.0,0.9080740213394165
3848,29659,hi shaquanathks for fl see my last price target for aapl twtr tesla goog on,0,2015-07-30 20:34:56,0,1,0,0.0,0.7258945107460022,0.0
3849,36365,eca filings updated thursday november 24 2016 071520 am tesla ccj t baba,0,2016-11-24 12:42:09,1,0,0,0.9678868055343628,0.0,0.0
3850,20296,lol despite the tesla model 3 production haltbloombergs resident tesla pr flack allaround journalistic scumbag tom randall decided to leave the weekly estimate 2866 and instead contributed the following very important information to his douchey little web page,1,2018-04-17 16:42:19,0,0,1,0.0,0.0,0.4906855523586273
3851,22281,future generations must thus realize they cant search for ceo elon musk must look only for elon musktsla,0,2016-07-31 22:59:42,0,0,1,0.0,0.0,0.6056868433952332
3852,14083,lol first ehremind me how far can it go full gross weightyou like physicstsla 500 miles 80000 lbshow you like them physics,0,2018-06-30 03:22:36,1,0,0,0.5862338542938232,0.0,0.0
3853,18121,tslasaudis must be getting nervous about their recent investment they may be the next one to open a lawsuit,1,2018-08-15 15:35:25,0,0,1,0.0,0.0,0.675142765045166
3854,29286,if you follow tesla share your opinions here sm amgn el nvs,0,2016-11-10 04:38:09,0,0,1,0.0,0.0,0.6665278673171997
3855,31815,i sold otm options last week with a descent premium tesla chart,1,2017-07-10 18:08:30,0,0,1,0.0,0.0,0.9099008440971375
3856,25262,more tesla capex awesome,1,2018-03-26 17:06:30,0,1,0,0.0,0.47328001260757446,0.0
3857,35706,dag db agriculture double long etn tickdag xlk axgn tesla dag invest sharedd dupont co prev close,1,2015-08-30 04:35:09,0,0,1,0.0,0.0,0.752640962600708
3858,2207,tesla trying to make a move,1,2015-11-17 18:56:58,0,1,0,0.0,0.8193265795707703,0.0
3859,2554,people ask why i am not always short tesla this is the reason the risk of being wrong at the wrong point in the hyperbolic curve is 2 big,1,2017-05-01 20:14:39,0,1,0,0.0,0.5315039157867432,0.0
3860,12969,tesla motorss equal weight rating reiterated at morgan stanley 24200 pt tesla tesla,1,2017-01-07 10:47:32,1,0,0,0.7832592129707336,0.0,0.0
3861,39951,when youre trying to save the world tslastyle truth and safety are disposable inconveniences,0,2018-04-06 14:52:53,0,0,1,0.0,0.0,0.8410503268241882
3862,11900,tesla sues auto parts maker over model x door delays who will tesla sue over the current doors that dont work,0,2016-01-19 21:03:58,0,1,0,0.0,0.8381054401397705,0.0
3863,35391,tesla will most likely not be around in its current form when autonomous cars l4 and l5 are ready and legal around the world ps do you think the rest of the sector is sleeping,1,2018-05-03 11:58:03,0,1,0,0.0,0.8792622089385986,0.0
3864,12662,120117 elliott wave updates for momentum tesla nvda v baba,1,2017-12-01 19:16:25,0,1,0,0.0,0.9002169966697693,0.0
3865,6847,definitely the pot calling the kettle black tesla tslaq,1,2018-07-27 22:54:53,1,0,0,0.7893887758255005,0.0,0.0
3866,7324,goal is for tesla to be cf positive and profitable for every qtr going forward goodluck,1,2018-08-01 21:39:30,0,1,0,0.0,0.7240935564041138,0.0
3867,24506,via bagholderquotes i hope he plows all you bears with his boring machine tesla tesla,0,2018-10-05 03:29:38,0,1,0,0.0,0.6388228535652161,0.0
3868,18368,475k preorders for model 3s 2500 built in 4th qtr 50 years to meet preorders totally fkedtsla,0,2017-11-02 15:19:19,0,0,1,0.0,0.0,0.645979642868042
3869,33932,creepy tesla nflx,0,2018-05-07 16:05:55,0,1,0,0.0,0.911994457244873,0.0
3870,24585,tlt investor opinions updated wednesday november 23 2016 091520 am erx twer tesla sh,0,2016-11-23 14:49:18,0,1,0,0.0,0.8468775749206543,0.0
3871,10465,tesla aapl why tesla motors could be the next apple,0,2015-09-22 18:06:48,0,0,1,0.0,0.0,0.4159794747829437
3872,20136,tesla tesla rallied off the trendline with a pickup in volume this trendline seems to be important as demand has come in 1,1,2017-10-04 03:01:46,0,1,0,0.0,0.8909637331962585,0.0
3873,13098,8 biggest price target changes for thursday alny cib hsni tesla stz swhc stx,0,2016-10-06 14:05:01,1,0,0,0.9587516188621521,0.0,0.0
3874,34308,i hadnt read that the question was asked did tesla decline to answer if so that is a story by itself,1,2018-04-30 15:14:13,1,0,0,0.8567745685577393,0.0,0.0
3875,27685,bot pdco spy dow fb tesla stocks trading,1,2017-06-01 14:54:09,0,0,1,0.0,0.0,0.6570260524749756
3876,8840,tesla if the officers read the daily tslaq feed on twitter theyd have realized a fire truck would have been more effective melntesladriverasleep20181202storyhtml,1,2018-12-04 03:12:14,1,0,0,0.5342403054237366,0.0,0.0
3877,36769,b tesla breaking and staying above 293 tomorrow will confirm downtrend ended new uptrend is forming,1,2018-10-16 23:55:26,0,1,0,0.0,0.881260097026825,0.0
3878,12790,sorry but what would be the happy model 3 news musk already promised 5000week production by q4tsla,1,2017-07-02 18:15:25,0,1,0,0.0,0.6615376472473145,0.0
3879,39698,all this gs downgrade taught me is tesla 220 buy a teslatsla 220 buy tesla stock,0,2017-03-01 17:15:14,0,1,0,0.0,0.8581807017326355,0.0
3880,6915,have you checked out tesla financial many people say elon musk a fraud is there any reason for that thanks,0,2017-11-19 13:09:56,1,0,0,0.733610212802887,0.0,0.0
3881,19306,tesla if holds over vwap all bets off,0,2016-10-28 14:41:16,0,0,1,0.0,0.0,0.8170651197433472
3882,27437,teslamotors just posted another strong quarter for sales tesla via cnnmoney,0,2015-10-02 22:19:07,0,0,1,0.0,0.0,0.913749098777771
3883,29807,i found the tesla of 90s some garbage called iomega watch the iomega dumpster fire begins around the 20min mark ht timecontinue1129vbq2y3lrgkrg,1,2017-12-08 20:55:33,0,0,1,0.0,0.0,0.9059537649154663
3884,4580,perhaps tesla needs some good news to send it downward its thin veneer is still intact with recent bad press,1,2016-07-14 17:06:15,0,1,0,0.0,0.8697587847709656,0.0
3885,14360,tesla motors tesla outperform rating reiterated at robert w baird,0,2016-11-03 00:05:07,1,0,0,0.9228325486183167,0.0,0.0
3886,2342,3 reasons to avoid nvidia stock for now stocks qcom intc tesla amd nvda reasonstoavoidnvidiastockfornowaspxsourceiaasitlnk0000003 geforce radeon,1,2017-09-24 14:22:20,1,0,0,0.9273166060447693,0.0,0.0
3887,37509,looking for a 260 close on tesla,0,2015-09-18 17:28:37,0,0,1,0.0,0.0,0.7325206398963928
3888,6802,our group scnaed ba unusual option on apr 04now ba still watching baba mu tesla nvda amzn join in usalerts,0,2018-04-05 14:57:15,0,1,0,0.0,0.8164064288139343,0.0
3889,36912,amzn tesla audi launches electric suv in teslas backyard with assist from amazon,0,2018-09-18 07:30:34,0,1,0,0.0,0.7600885033607483,0.0
3890,8932,tesla breaking here on 2x bottom,0,2015-08-11 14:34:36,0,0,1,0.0,0.0,0.8188896179199219
3891,17135,tesla and cmg on same days you must be partying tonight,0,2015-10-20 21:44:33,0,1,0,0.0,0.7380852699279785,0.0
3892,14151,tesla wow 230 off 216 premarket,1,2015-05-07 13:42:34,0,0,1,0.0,0.0,0.8391003608703613
3893,6483,great analysis by tv tesla prospects outlined quite nicely potential speed bumps include inflation geopolitical shenanigans,1,2017-04-30 11:35:59,0,1,0,0.0,0.6090336441993713,0.0
3894,27634,tesla right now there is zero edge long or short i tried it both ways and getting stopped out,1,2018-09-07 18:41:04,0,1,0,0.0,0.5956329107284546,0.0
3895,7162,we can conclude from this that elons forecasting power is just above toddlers and that his memory capacity is right above the goldfishor that he is a shady liar tesla liar tesla tslaq elonlies,1,2018-06-19 03:28:55,0,1,0,0.0,0.8867242336273193,0.0
3896,13094,tesla shorts dont get cockythe one thing ive learned over the past 2 weeks is that much of the general public is still under the elon is magical spell some still think semis will be on the road this yearrepeat the facts the model 3 and elon are bankrupting tesla,0,2018-08-23 17:39:46,0,1,0,0.0,0.6060949563980103,0.0
3897,23815,tesla like this one if vwap or ea9 hold the pb over r1,1,2015-05-13 13:56:21,0,1,0,0.0,0.7820253968238831,0.0
3898,11834,dog 11s for a street car is insaneused to do this all the time and its just crazytsla,1,2018-08-12 15:18:49,0,0,1,0.0,0.0,0.83222496509552
3899,15024,tesla under chanos double bottom limited by its defining mat,0,2017-12-20 14:06:29,0,1,0,0.0,0.9430120587348938,0.0
3900,11594,for instance there might be a pattern of car companies that fail as they growing vs those that succeed past the growth stage tesla might obviously fall into one or the other,0,2018-08-06 07:05:06,0,1,0,0.0,0.8781992793083191,0.0
3901,39330,tesla teslas explosive stock price now deserves to crash hard explosivestockpricenowdeservescrashhard spy qqq stockmarket stocks investing finance,1,2017-05-04 12:33:11,0,1,0,0.0,0.7525084018707275,0.0
3902,2949,tesla dropped 4275 pts on friday wow 244 is the next level before 225,0,2018-09-30 20:08:02,0,1,0,0.0,0.5994749069213867,0.0
3903,19057,widely followed tesla analyst adam jonas morgan stanley on tesla semi a new age of trucking begins today tesla unveiled the future of trucking with its class 8 semi that topped most of our expectations in terms of performance cost savings capability and time to market,1,2017-11-17 13:39:18,0,1,0,0.0,0.7611319422721863,0.0
3904,29470,if youre not making money in this market want consistency try our team fb nflx amzn googl tesla aapl gs,1,2017-08-14 17:45:07,0,1,0,0.0,0.6771872639656067,0.0
3905,23157,mission e is only 85k model s killer tesla,0,2018-05-08 22:46:31,0,1,0,0.0,0.7102598547935486,0.0
3906,3693,tradenow tesla extension in wave 3 tesla via,0,2016-09-25 09:07:37,0,1,0,0.0,0.526341438293457,0.0
3907,12865,oh tesla puts but damn im assuming it will be expensive tomorrow i have small account,0,2017-11-02 04:33:15,0,1,0,0.0,0.5343441367149353,0.0
3908,33764,right dude the thing is when i tweet nonsense after a weekend liquid lunch i dont do it with a 70 billion enterprise value burning 5 billion a yeartslaqtsla,0,2018-03-03 22:51:13,0,1,0,0.0,0.6393973231315613,0.0
3909,15238,now would be a great time for the fed to enter tesla headquarters,0,2018-03-21 17:51:28,0,1,0,0.0,0.6488802433013916,0.0
3910,37009,baird gives elon something to smile about by naming tesla its top stockmarket pick for 2017 tesla,1,2016-12-30 16:38:02,1,0,0,0.9411823749542236,0.0,0.0
3911,22741,my crystal ball is telling me tesla a decent entry point any thoughts,1,2015-04-27 13:10:11,0,1,0,0.0,0.9313377737998962,0.0
3912,21418,spy orb trades that worked friday theopeningfiveminutecandlespy wim qqq dia tlt uvxy fb nflx tesla lnkd uso tltstudy,1,2016-02-13 14:36:32,0,1,0,0.0,0.8670166730880737,0.0
3913,6399,autonation ceo tesla may not be around in 10 years if musk keeps relying on baitandswitch tactics,0,2018-09-19 14:55:41,0,1,0,0.0,0.7602083086967468,0.0
3914,23353,big bullish unusual option activity detected mu etsy baba tesla big bearish fcx dis nvda mu,1,2017-12-26 19:30:34,0,1,0,0.0,0.43996962904930115,0.0
3915,2672,the fastest growing green and overall jobs sector in america might hurt the most popular millennial corporation in america tesla hal xom f c bac,1,2018-08-16 21:52:31,0,1,0,0.0,0.7170252203941345,0.0
3916,29440,best qualitytsla,1,2018-07-10 01:49:31,0,1,0,0.0,0.6036860942840576,0.0
3917,5751,tesla model 3 brakes in action dont forget your shoes,1,2018-05-21 16:41:11,0,0,1,0.0,0.0,0.8960484862327576
3918,37448,elon is fucking delusional tesla down 15 now in after hours trading to 285,1,2018-05-02 22:22:23,0,0,1,0.0,0.0,0.875430703163147
3919,6149,tslatesla files for public sale of 21 million shares,0,2015-08-13 11:22:20,0,1,0,0.0,0.5873681902885437,0.0
3920,24177,should apple buy telsa 3 points to ponder sf business times aapl tesla,0,2015-02-18 20:25:06,0,1,0,0.0,0.8108248114585876,0.0
3921,11069,tesla paused model 3 production for a planned upgrade in february,0,2018-03-12 17:40:53,0,1,0,0.0,0.6964446306228638,0.0
3922,29607,interior of skoda low end vw vision s every carmaker can make really cool concept cars like model 3 tesla,1,2016-04-11 14:39:32,0,1,0,0.0,0.8221700191497803,0.0
3923,39608,chinese media coverage of tesla s china gigafactorytslaq,0,2018-08-24 12:08:17,0,0,1,0.0,0.0,0.8817393183708191
3924,312,tesla just broke under 240 next key support could take it down towards 200day sma 23125 will be watching it closely for swing again,0,2015-10-01 15:03:14,0,1,0,0.0,0.6015082597732544,0.0
3925,21995,will never happen timestamp this tweet if you want tesla,1,2018-08-16 03:02:59,0,0,1,0.0,0.0,0.8598186373710632
3926,16135,short tesla off the open loss 345 probability towards gap fill near 327 holds 347 could pop back up,1,2017-08-18 14:01:33,0,0,1,0.0,0.0,0.5518089532852173
3927,13208,tesla the 2018 cadillac ct6 platinum awd is a criminally underrated luxury sedan,0,2018-03-04 19:23:03,0,1,0,0.0,0.549527108669281,0.0
3928,31640,tesla dip buy engage,0,2018-09-18 15:46:45,0,1,0,0.0,0.9010202884674072,0.0
3929,3780,save us all companies playing a key role in saving mankind a closingbell collection by jnj goog tesla usall,0,2015-07-03 20:32:13,0,1,0,0.0,0.593985915184021,0.0
3930,12481,tesla bearish reversal is finally in with that evening star bearish doji printed daily candle yesterday adding to my puts,1,2017-06-15 10:34:05,0,1,0,0.0,0.7391934990882874,0.0
3931,26341,wrong again if tesla was bk it would offer 100 stock not 5050 youre really clueless when it comes to issues around the cap deck take a look at your tweets the past couple years youll see what we mean,0,2018-12-09 02:01:21,0,1,0,0.0,0.8809537291526794,0.0
3932,24225,im a bull during a bull market and bear during a bear market calls and puts right now its bull market spy spx aapl nflx baba nvda tesla ba amzn gs,0,2018-02-27 16:20:41,0,0,1,0.0,0.0,0.9462826251983643
3933,17433,i posted this tesla newbie tesla still a long play see wider stops,0,2015-02-25 03:19:38,1,0,0,0.5425370335578918,0.0,0.0
3934,14815,this week it unveiled a fleet of electric and hybrid cars buggies and bikes in a move it believes will give tesla a run for its moneytsla,0,2018-08-24 14:37:01,0,1,0,0.0,0.5979193449020386,0.0
3935,35241,lol short answer yes hodl your tesla,1,2018-01-04 21:39:26,0,1,0,0.0,0.7856121063232422,0.0
3936,5959,this car makes tesla model s look like a pos,1,2018-08-13 13:20:29,0,1,0,0.0,0.527680516242981,0.0
3937,25148,i feel shorts are in complete control right nowthey wont let it go more than 89 a day so 240 it is tesla,0,2018-10-06 19:41:23,0,1,0,0.0,0.7476420402526855,0.0
3938,15943,ok i agree 100 with you and the tech patents tesla has are not monitzable 180 in november,0,2017-10-09 14:13:15,0,1,0,0.0,0.6420046091079712,0.0
3939,33940,oh fam for sure theres major bad news coming between the heightened pace of tweets and the sudden poscast see joe rogan when morton quit its coming tesla,1,2018-11-01 22:26:13,0,1,0,0.0,0.8556535840034485,0.0
3940,20708,tesla shorts better be covering,0,2018-09-17 16:39:59,0,1,0,0.0,0.6800243854522705,0.0
3941,30577,everything we know about the model x tesla modelxreport via,1,2015-06-15 04:44:44,0,1,0,0.0,0.6721567511558533,0.0
3942,32989,tesla is visionary up huge long term but from a sentiment standpoint it must be so frustratingly to longs no matter elon musk tesla,0,2018-08-09 19:20:07,0,1,0,0.0,0.6241400241851807,0.0
3943,33558,are you sure about that because it looks that way mr musk we are not going bankrupt musk vows as tesla suppliers panic over stopped payments tesla 0820wearenotgoingbankruptmuskvowsteslasupplierspanicoverstoppedpayments,0,2018-08-21 00:05:53,0,1,0,0.0,0.7116537094116211,0.0
3944,31071,about that model year 2022 tesla pickup truck tslaq tesla,0,2018-06-26 20:23:54,0,1,0,0.0,0.8123378157615662,0.0
3945,29042,its actually odd tesla board members can sell before signing the 10k,0,2017-03-01 03:02:16,1,0,0,0.8277273774147034,0.0,0.0
3946,27138,alert srco poised to explode aapl avxl grnh qqq trtc nflx usd ibm fnma goog mfst tesla q2 earning,0,2016-07-26 16:34:13,0,0,1,0.0,0.0,0.6944088339805603
3947,37994,tesla bulls about to be gored with new financing dilution and going concern issues theres nothing special with their business and product on 12 years vs others other than cost disadvantages,0,2018-08-21 00:56:41,0,0,1,0.0,0.0,0.8046084642410278
3948,18267,hiphop music newmusic aapl msft gld uonek czbs mck twtr mfbp wwde byfc carv ibwc luv orcl tesla gbtc siri intc auy listening to bank account using app mymixtapez,0,2017-12-22 19:31:02,0,1,0,0.0,0.827151894569397,0.0
3949,34830,tesla issued a subpoena and price doesnt budge,1,2018-11-02 16:22:39,0,1,0,0.0,0.7396960258483887,0.0
3950,35700,i am happy to beat tesla up all day but any exec who wouldnt accept this settlement should be fired class actions have a life of their own and enormous defense costs and risks and there is almost no cost one shouldnt pay to head one off,0,2018-11-14 15:08:47,0,1,0,0.0,0.5950582027435303,0.0
3951,15933,tbt proshares ultrashort 20 year treasury ask sizetbt nsit cxrto tesla tbt investing pennystocks,1,2015-10-30 04:49:35,0,1,0,0.0,0.9009921550750732,0.0
3952,20275,look out tesla,1,2017-03-16 18:18:25,0,0,1,0.0,0.0,0.8066489100456238
3953,15016,qld new 52 week high should bode well for googl tesla amzn long all these names from this morning in weekly and monthly calls,1,2017-05-15 14:53:25,0,1,0,0.0,0.7970871329307556,0.0
3954,4955,fb twtr tesla comp likely go much higher over next several weeks to few months then i might go 100 cash for a major correction crash,0,2015-02-27 13:10:14,0,0,1,0.0,0.0,0.6994271874427795
3955,37214,tesla damn these are some easy pops n drops but i cant focus today due to sht around my house so no trade 303 bounce and 309s sold,0,2018-10-01 17:24:24,0,0,1,0.0,0.0,0.730185866355896
