,index,body,Target,Date,I(positive),I(neutral),I(negative),I(positive)*score,I(neutral)*score,I(negative)*score
0,32823,tesla bout to rip 1114chinaisleadingtheworldtoanelectriccarfuture,0,2018-11-15 14:54:30,0,1,0,0.0,0.5926697254180908,0.0
1,16298,fire broke out around 2pm that was 3 hours ago tesla tslaq,1,2018-12-19 01:14:08,0,1,0,0.0,0.7050753831863403,0.0
2,28505,like an aging uncle trying to look like a hipster big auto is desperately trying to give the impression that it is abreast of the latest technology but it continues to piddle around with dead ends like plugin hybrids and hydrogen fuel cellswell stated tesla automobile,0,2018-01-26 17:47:39,0,0,1,0.0,0.0,0.9026233553886414
3,6689,tesla no position many ppl want to buy,0,2018-04-04 13:49:44,0,1,0,0.0,0.8254958391189575,0.0
4,26893,stock i believe are overvalued gpro tesla aapl fb splk amd fit not many stock undervalued out there most fairly valued,0,2016-09-08 21:36:23,0,1,0,0.0,0.490817666053772,0.0
5,36572,nbdrs traders cheat sheet from r1 0759 and r2 0829 2 pennys take us over r2 and 50d ma cant wait to see how this blockchain and fintech consulting company performs today dirv msmy frlf byoc tggi tvog fusz rsls tesla cvsi rbiz drus dsgt,0,2018-08-21 11:15:37,0,1,0,0.0,0.8239607810974121,0.0
6,12335,tesla and theres the lower low nothings changed pathetic ability to hold any zone,0,2018-08-14 14:01:57,0,0,1,0.0,0.0,0.7633640170097351
7,29591,its ok ive deployed the troops instructed our biggest fan ryan to get a crew together and kick that guys door downthey are to lecture him about how elon is saving the world if that fails tickle torture tesla,0,2018-06-28 21:14:41,0,0,1,0.0,0.0,0.7856366634368896
8,18948,also i think theyre addicted by now tweeting crap every 10 min when they arent asleep i am addicted to checking tesla feed and if one of my fav shorts doesnt post for 2 hours i am gonna panic,0,2018-06-02 04:22:01,0,1,0,0.0,0.8931527733802795,0.0
9,31067,ironic that a company named weight watchers got an overweight upgrade this morning and its chief spokesman is oprah anyway its moving up premarket wtw others play rh le sage tesla glmd,0,2018-06-12 12:57:32,0,1,0,0.0,0.8172701597213745,0.0
10,22241,coincidence or twitters algorithm revealing their close relationship tesla,1,2018-07-12 00:37:59,0,0,1,0.0,0.0,0.6661019921302795
11,13787,earnings review teslas small improvements in margin and production in q1 might be to by trefis team tesla gm f,1,2015-05-11 15:29:17,0,1,0,0.0,0.6230073571205139,0.0
12,5128,localized matrixsimple to google and the true architectural goal of any independent ai systemtsla has big value for this alonewont just be used for cars could licensesell it to lots of other manufacturers for diverse products,0,2018-08-12 11:46:05,0,1,0,0.0,0.7914099097251892,0.0
13,9125,my fav is when i bought tesla sub 100 people were saying it wasnt worth 20 you need vision and quant analysis,1,2015-03-22 18:20:22,0,1,0,0.0,0.49505576491355896,0.0
14,35041,and my nflx short from yesterday has made up for my tesla loss and then some always protect your capital cause you recover easily,1,2015-05-06 13:45:38,0,1,0,0.0,0.9154903888702393,0.0
15,3510,instead of suing the plaintiff should write a thank you letter to and thanking the tesla tslaq not killing him,1,2018-10-30 17:56:36,0,1,0,0.0,0.8300436735153198,0.0
16,16441,todays million dollar put options tradeamzn fb ibm pxd spy mu lrcx nflx qqq tesla vxx gld nvda,0,2018-04-18 20:06:07,0,1,0,0.0,0.49709463119506836,0.0
17,19463,dont miss our next free option trade sign up for our daily free trades at nvda tesla gs gild ibb googl fb,1,2017-10-31 16:01:10,0,1,0,0.0,0.9186097383499146,0.0
18,26283,rt tesla elon musk should blast off copies of all the service he receives over the tweet into space spacex,0,2018-08-14 16:41:24,1,0,0,0.7744449377059937,0.0,0.0
19,36216,the white paint of that tunnel wall was probably thicker than model3 paintboringcompany boringco tesla tslaq tesla,1,2018-12-19 06:12:37,0,0,1,0.0,0.0,0.9308896660804749
20,17407,perhaps is showing maturity in defiance of the feds or he is pumping the stock to bolster the tesla is too big to let fail narrativei pick the latter,1,2018-10-27 17:42:55,0,1,0,0.0,0.5638703107833862,0.0
21,10919,say whaaat germany tesla buyers must pay back plugin grant teslabuyersmustpaybackplugingrant,1,2018-07-17 22:24:06,0,1,0,0.0,0.7634677290916443,0.0
22,30866,active traders try one of these free trading guidesnflx tesla aapl hd gs fb amzn googl nvda,1,2018-10-17 01:30:09,0,1,0,0.0,0.881068766117096,0.0
23,34436,is trying to do 2 things get shorts out at high prices and keep long term investors invested if you are a short term long investor he will buy your stock but that will be way less than the 70b number needed to buy everyones shares tesla,0,2018-08-07 19:15:47,0,0,1,0.0,0.0,0.4599834978580475
24,12701,1 tesla reading about nissan leaf and how people are up in arms about short range the pundits say shorter ranges dont sell,0,2017-09-07 13:20:22,0,1,0,0.0,0.49694666266441345,0.0
25,35676,melted half of puts ready for maybe rebound to scale or total melt up by friday spy aapl oled nvda tesla fb,0,2017-06-12 23:24:09,0,0,1,0.0,0.0,0.8414814472198486
26,34089,model3 models modelx anyone need a referral code to get six months of free supercharger on any model tesla teslamodel3 tslatslalina21201,1,2018-12-22 18:57:30,1,0,0,0.7119184732437134,0.0,0.0
27,21261,tesla should brace for serious competition from aapl in driverless cars morgan stanley 9e043448bd398d2d56b687edssteslashouldbraceforhtmlsocsrcsocialshsoctrktw via,0,2017-06-15 12:08:39,0,1,0,0.0,0.7204501032829285,0.0
28,26173,added few more tesla puts,0,2015-12-30 14:46:56,0,1,0,0.0,0.6644101142883301,0.0
29,28283,except for the fact that he predicts ramps all the time and he was midway through the quarter tesla,0,2017-10-09 14:53:30,0,0,1,0.0,0.0,0.776134729385376
30,37266,cashed the rest of positions in great month other than goldman short gdx gld lit alb tesla fb cmg,0,2017-01-27 17:17:33,0,1,0,0.0,0.8424285650253296,0.0
31,32506,tesla reportedly slashing parts orders for model3 teslareportedlyslashingpartsordersmodel3uprof51emaillink tesla,0,2017-10-27 16:59:55,0,0,1,0.0,0.0,0.6519025564193726
32,33381,tesla suspended cause its rigged plz fix,0,2018-08-07 18:33:03,0,1,0,0.0,0.8328598737716675,0.0
33,39380,stock predictor based on genetic algorithms up to 3661 return in 1 month stocks money nbg tesla,0,2015-02-22 19:31:12,1,0,0,0.7075849771499634,0.0,0.0
34,20845,audi opens reservations with deposits for its two new etron vehicles etronquattrosportbackreservation these nurbergring tested where tesla overheats vehicles with audicaliber interiors will annihilate tslatslaq,0,2018-01-11 18:33:55,0,1,0,0.0,0.9135900139808655,0.0
35,252,now offering 7 day free trial to options day trading team room or twtr feed bkng aapl nflx tesla amzn googl,0,2018-11-02 15:15:09,1,0,0,0.8137250542640686,0.0,0.0
36,35119,thestreet china may cut delay electric car production tesla,1,2017-03-06 14:14:39,0,1,0,0.0,0.9223942160606384,0.0
37,3434,tesla nice death cross coming shortly,1,2017-11-01 19:18:54,0,1,0,0.0,0.7713261246681213,0.0
38,1278,update aeis musk energy name new all time highs and starting to go parabolic xlk tesla trade2017,0,2017-06-09 00:37:23,1,0,0,0.6462180018424988,0.0,0.0
39,8285,up this morning over 200 in uwti and tesla the dow is about to break even on the year and im excited bullish,0,2016-03-17 15:14:51,0,1,0,0.0,0.6612644791603088,0.0
40,15215,tesla also super excited to take delivery of ms this saturday thanks brenna,0,2018-01-24 14:06:33,0,0,1,0.0,0.0,0.6034718155860901
41,2624,via qtrresearch i dont want to say that these headlines seem to be proof that elon may have been full of shit but tesla,0,2018-08-10 19:03:02,0,1,0,0.0,0.8068212866783142,0.0
42,3698,tesla shorting tesla like watching paint dry,1,2018-03-16 14:45:58,0,1,0,0.0,0.8054639101028442,0.0
43,6039,via capcube larry ellison pumping tesla for his bud insane druggie too funny worry about orcl larry of course pumps along as well tesla,1,2018-10-26 17:52:08,1,0,0,0.9275172352790833,0.0,0.0
44,4095,shorters really grasping at straws today desperation slow news day i guess the class action suits for that tweet are already priced in tesla tesla,1,2018-10-09 15:50:34,0,1,0,0.0,0.623431384563446,0.0
45,39574,performance 3 magnificent a little rainbowfarting space shipexits corners faster than a bmw m4 outpunches a porsche boxster and outclouds a rollsroyce tesla tslaqcomcdnampprojectorgvsinsideevscomwsjreviewsteslamodel3performanceampampjsv01usqpmq331aqgcaeoatgaoriginhttps3a2f2fwwwgooglecomauprerendersize1visibilitystatevisiblepaddingtop54p2r0horizontalscrolling0csi1aoh15320559678874viewerurlhttps3a2f2fwwwgooglecomau2famp2fs2finsideevscom2fwsjreviewsteslamodel3performance2famp2fhistory1storage1cid1capswipe2cnavigateto2ccid2cfragment2creplaceurl,1,2018-07-21 07:29:57,0,1,0,0.0,0.7690038084983826,0.0
46,14775,tesla when the paid bears smell blood they just pile on chapter 11 etc as stock rallies big oil allies strike includes sec dark forces,1,2018-09-28 12:59:13,1,0,0,0.5309173464775085,0.0,0.0
47,39974,kevin oleary on tesla coming up on does this get you into the game,0,2018-08-08 18:27:43,1,0,0,0.911454975605011,0.0,0.0
48,14518,yup this is a bit like madoff trying desperately to cover his tracks as it all falls aparttsla,0,2017-06-05 15:36:16,0,0,1,0.0,0.0,0.8919246196746826
49,314,just remembered about when we got a and they forced us to take it on finance if we wanted the car same day as cash apparently takes 23 days to clear this is why im never buying from this brand again and moving to tesla,0,2018-08-01 16:21:58,0,0,1,0.0,0.0,0.5874212980270386
50,5787,elon is busy on twitter with verbal intervention also there are so many tesla bears,1,2018-07-01 17:53:09,0,1,0,0.0,0.5731846690177917,0.0
51,10859,1 to 4 trade alerts with 50 to 100 profit potential everyday try our team fb nflx amzn googl tesla aapl gs,1,2018-05-01 17:45:07,0,1,0,0.0,0.7646585702896118,0.0
52,20809,tesla earnings scheduled for after the close tomorrow the lunatics are out my neck hurts from shaking my head so much so well play the lunatic theme songspx ndx iwm v3fn36lz3wy,1,2018-05-02 03:03:03,0,0,1,0.0,0.0,0.6807199716567993
53,22987,under the letter of the law they may be independent but in substance thats another matter tesla,1,2018-10-03 19:48:33,0,1,0,0.0,0.5524845123291016,0.0
54,27031,the numbers walkback has officially started tesla,0,2018-08-27 17:08:08,0,1,0,0.0,0.8308178782463074,0.0
55,14998,you are guilty of libel and may want to consult your attorney before you end up on the receiving end of a lawsuit please provide quantifiable proof that sec also thinks todd marron is a buffoon including references tesla tesla tslaq,1,2018-09-30 21:03:06,0,1,0,0.0,0.8214177489280701,0.0
56,38588,convince me why shorting the hell out of tesla against f is the wrong play over 1st 18months of trumppence,0,2017-01-23 03:39:23,0,0,1,0.0,0.0,0.6473771333694458
57,33052,when tl break tesla via,0,2016-03-23 22:02:10,1,0,0,0.6229314804077148,0.0,0.0
58,27996,spy fade time little early well seespx qqq jia iwm aapl nflx amzn fb googl uso tesla gs bac jpm,0,2016-05-20 14:01:52,0,1,0,0.0,0.7031488418579102,0.0
59,28904,rt metatrades hyperloop technologies raises 80m for frictionfree trains that go 760 mph tesla scty,0,2016-05-15 02:23:33,0,1,0,0.0,0.5276378989219666,0.0
60,28177,will anyone catch the pullback of tesla the run up was easy but the pullback is will be more profitable,0,2018-01-11 18:01:15,0,1,0,0.0,0.9148136377334595,0.0
61,32862,interior of skoda low end vw vision s every carmaker can make really cool concept cars like model 3 tesla,0,2016-04-11 14:39:32,0,1,0,0.0,0.9140227437019348,0.0
62,35302,tesla stock chart of past 5 days also in ar augmentedreality using superstocks app,0,2018-04-09 18:54:42,0,0,1,0.0,0.0,0.7598896026611328
63,31370,tesla down 33 from its september high but short interest keeps climbing up 29 of shares outstanding,1,2015-03-13 12:04:52,0,1,0,0.0,0.5059832334518433,0.0
64,22667,btw that was a hidden reference to the kind of logic spewing out of tesla,1,2017-02-14 15:44:04,1,0,0,0.4884745180606842,0.0,0.0
65,24533,key to understanding risk graphs gld slv tesla,0,2015-02-25 20:40:00,0,1,0,0.0,0.8935878872871399,0.0
66,1566,i almost ordered one then saw deposits not escrowed i dont loan money interest free to company thats burned 6b in cash tesla,0,2016-04-01 23:55:35,0,1,0,0.0,0.8440787196159363,0.0
67,12296,2182017 the next big move via gs bac jpm nflx amzn googl aapl pcln fb ntes tesla,1,2017-02-20 16:39:17,0,1,0,0.0,0.6771737337112427,0.0
68,34134,tesla 15 drop from yesterdays highs tesla stock,1,2018-07-03 18:26:53,0,1,0,0.0,0.5776569843292236,0.0
69,16810,gill who downgraded tesla shares on july 19 from hold to sell told cnbc on monday we think the valuation is closer to 200 he said needham does not put out official price targets on its sellstsla,0,2018-08-20 16:19:32,0,0,1,0.0,0.0,0.8211249709129333
70,14470,tesla and goog chatter making rounds again,1,2015-05-28 14:50:03,0,1,0,0.0,0.8724734783172607,0.0
71,27084,tesla announces common stock offering of 250 million tesla,1,2017-03-15 20:34:56,1,0,0,0.8049901723861694,0.0,0.0
72,21047,tesla company is set to start accepting online orders for the model s and model x in united arab emirates reports companyissettostartacceptingonlineordersforthe,1,2017-02-13 14:12:14,1,0,0,0.6205581426620483,0.0,0.0
73,36979,tesla initiated with an underperform at jefferies 280 pt,0,2017-09-19 10:00:12,0,1,0,0.0,0.9128798246383667,0.0
74,32734,the model 3 is best selling us luxury car,1,2018-10-04 14:26:00,0,1,0,0.0,0.8833457231521606,0.0
75,32798,tesla could be changing the dynamics of global energy tesla,1,2015-04-30 09:32:52,0,0,1,0.0,0.0,0.8616197109222412
76,22898,tesla great example of why fundamentals matter this breakout nothing like 2012 tesla,1,2017-11-08 01:06:25,0,1,0,0.0,0.8038815855979919,0.0
77,4859,251 profitpacked option trades yearlydelivered to your inbox dailyfree aapl tesla nflx celg snap,1,2018-10-13 11:00:44,0,0,1,0.0,0.0,0.9031394124031067
78,8648,tesla appropriate hourly close cant say daily yet is 235,0,2015-09-01 19:37:30,0,1,0,0.0,0.6585960388183594,0.0
79,38406,building an exit door for musk and warning shareholders of exodus the markets did understand the purpose the dream is over tesla,0,2018-08-17 14:29:00,0,0,1,0.0,0.0,0.8833277821540833
80,38975,you lost around 800 million your stock and your bonds are both down and youre bragging tesla longs are going to get everything they deserve,1,2018-05-02 21:09:51,0,1,0,0.0,0.6869264841079712,0.0
81,3719,the ev boom just keeps getting biggerelectricvehicles solarenergy solarpower nuclearhydro oilandgas china uk france netherlands gm ba tech future business shipping transportationsourceansh aapl ba bidu byddy gm goog googl tesla vlkay,1,2018-05-29 16:18:42,1,0,0,0.7686327695846558,0.0,0.0
82,15280,via keubiko incorrect that is teslas fremont facility searching the night sky for shortys drones through an instagram filter tesla,1,2018-09-25 13:13:08,1,0,0,0.7460150718688965,0.0,0.0
83,13125,tesla bullbear debate live,0,2018-04-02 16:31:29,0,1,0,0.0,0.5738688111305237,0.0
84,24168,if youre not making money in this market want consistency try our team fb nflx amzn spx tesla aapl gs,0,2017-08-13 22:15:07,0,0,1,0.0,0.0,0.5213262438774109
85,31578,spy aapl amzn fb googl nflx tesla twtr pcln what a close bears going happy on the weekend,1,2015-11-13 21:08:20,0,1,0,0.0,0.571506679058075,0.0
86,15146,tesla losses only because they are investing in futurelost 224 mio outside us us only 60 mio due to 200 mio zev,0,2015-02-27 00:56:04,1,0,0,0.5215324759483337,0.0,0.0
87,31543,tesla initial model 3 thoughts gm tesla investing stocks,1,2017-07-30 01:35:42,0,1,0,0.0,0.5192617774009705,0.0
88,25649,3 yet in early 1942 they had declared war on the ukussrusa who had more men and money and ultimately better technology too tesla,1,2017-12-27 19:08:31,0,1,0,0.0,0.8568357825279236,0.0
89,37863,tesla supporters are super creepy,0,2018-06-26 01:39:38,0,1,0,0.0,0.8792030215263367,0.0
90,29169,i see stocks have 5ma cross 10ma on 5 minutes chart areaaplibmfbnvdatsla not yetbabaamznmsftcscowb,0,2018-01-09 15:22:36,0,0,1,0.0,0.0,0.9162928462028503
91,14075,710 s mack aveo drys mbrx abil dcth nvda twtr tesla thld avgr vnce ears maybe spi tops pm and morning news will also guide,1,2017-07-10 07:48:14,0,0,1,0.0,0.0,0.8606979846954346
92,20451,tesla playing hard to get already been 24 mins,1,2015-08-05 20:25:00,0,1,0,0.0,0.7389944791793823,0.0
93,9536,tesla breaks out of a short cup handle pattern,1,2017-05-30 13:37:29,0,0,1,0.0,0.0,0.8021647334098816
94,10642,twtr abandon ship ieeeeeeee twitter stocks stockmarket finance spy qqq iwm spx aapl nflx lnkd amzn fb goog googl tesla cmg,0,2016-05-03 13:53:01,0,1,0,0.0,0.6639110445976257,0.0
95,30745,teslas bull market viewed tu2026 tesla teslasbullmarketviewedthroughcrudeoilprices,1,2016-01-19 16:10:00,0,1,0,0.0,0.8278961181640625,0.0
96,4750,tesla musk is changing the world in a good way,0,2015-02-14 00:15:27,1,0,0,0.8455219864845276,0.0,0.0
97,36513,good example of a responsible company they apparently have a real qa department with accountabilitytsla tslaq tesla teslamodel3,1,2018-10-21 18:20:18,0,1,0,0.0,0.5870630145072937,0.0
98,24787,i expected more from you nflx when you gonna catch up to tesla,0,2018-04-05 19:27:52,0,1,0,0.0,0.8711422085762024,0.0
99,7306,active traders try one of these free trading guidesnflx tesla aapl jpm gs fb amzn googl nvda,1,2017-11-05 13:30:09,0,0,1,0.0,0.0,0.5161654353141785
100,13143,i know righti wonder how much paper profit hes sitting oni dont think he has lost any money yet other than not trimming at 350 330 310 etctake a little off the table big guys b4 elon fires everyone but himself and u lose it all tesla,1,2018-05-14 20:01:25,0,0,1,0.0,0.0,0.7449620366096497
101,27415,so when i shorted tesla and then covered for a profit i was really acting foe russian bots hunh,0,2018-08-12 02:12:44,0,1,0,0.0,0.5271351337432861,0.0
102,25484,nissan gears up to install worlds largest electric vehicle power system not tesla,0,2016-03-01 14:10:31,0,1,0,0.0,0.6342527270317078,0.0
103,1484,timeline of a unicorn a new expense sneaks up on tesla newexpensesneaksteslasourcetweet tesla advertising branding electricvehicle commonsense,1,2016-02-24 16:05:21,0,1,0,0.0,0.7881168723106384,0.0
104,35900,tesla tesla q2 18 earnings results adj eps 306 estimate 290 revenue 4b estimate 403b,0,2018-08-01 20:18:30,0,1,0,0.0,0.6765010952949524,0.0
105,13253,which cult stock is upgraded next for a nice 35 squeeze amzn yday nvda todaynext must be oversold and still have a compelling fundamental story so that rules tesla out,1,2018-09-28 17:12:27,0,1,0,0.0,0.6719151139259338,0.0
106,8891,jaguar battery supply shortfall hinted for the ipace tesla tslaq,1,2018-09-04 11:07:39,0,0,1,0.0,0.0,0.8297417759895325
107,23163,when tesla outsells everyone in hong kong its a big deal when tesla is outsold globally numbers suddenly dont matter make up ur mind,1,2017-05-01 18:02:14,0,0,1,0.0,0.0,0.6858460307121277
108,8895,is tesla about to announce a motorcycle pcrfy tesla via,1,2015-04-01 07:41:03,1,0,0,0.7924711108207703,0.0,0.0
109,26782,whats inside a tesla battery cell watch here tesla teslamotors teslamodels teslamodelx electricvehicle,1,2017-03-23 11:51:01,1,0,0,0.6110300421714783,0.0,0.0
110,34569,tesla suck point,0,2018-06-12 15:21:55,0,0,1,0.0,0.0,0.857090950012207
111,816,another of those why tesla will very likely fail imo exchanges with an enthusiast see thread below if anyone is interested wasted time,0,2017-10-27 13:11:44,0,0,1,0.0,0.0,0.92657470703125
112,6401,tesla to launch in turkey in 2018,0,2018-08-13 09:40:08,0,1,0,0.0,0.6710540652275085,0.0
113,1464,custom tesla ai chip in production cars in 4 to 6 months even retrofitted if needed when will the probably much slower nvda xavier chip be available in production cars and do useful things for the driver,0,2018-08-08 22:12:07,0,0,1,0.0,0.0,0.8043359518051147
114,27809,wednesday links demonizing corporations crypto carnage and being hard on yourself linksdemonizingcorporations vnq fb amzn nflx tesla fed,1,2018-03-28 16:47:44,0,0,1,0.0,0.0,0.4933570921421051
115,37677,tesla puts a thing beauty day after day,0,2018-04-24 15:12:30,0,1,0,0.0,0.8799229264259338,0.0
116,6275,maybe a tesla school bus,0,2018-08-29 01:43:34,0,1,0,0.0,0.6529232859611511,0.0
117,28737,main reason musk tweeted about going private tesla stock price rose above 360 level so tesla now able to pay off some 900 million in obligations in stock instead of in cash,0,2018-08-08 00:49:13,0,0,1,0.0,0.0,0.6200991868972778
118,2507,might be too long ago but does anyone else remember when elon announced a privatization offer at 420 and then the tmc bulls spent monthsyears of combined brain power calculating out just how big the short squeeze would be retro tesla,0,2018-08-27 22:05:00,0,1,0,0.0,0.7788282036781311,0.0
119,21746,the short thesis is more seemingly only based on an eventual doj action rather than any other business performance indicators add to it greedy oversell of lask week u r looking at a not pretty picture for a short seller this week this month or this year tesla,1,2018-09-30 14:43:27,0,1,0,0.0,0.86274653673172,0.0
120,34165,tesla shed 4 billion in 24 hours market called musks private bluff can practically smell the lawsuits approaching tesla,0,2018-08-09 18:00:20,0,1,0,0.0,0.7642099261283875,0.0
121,11897,a look at tslas q1 report and colorful earnings call the companys push to quickly become profitable and avoid a fresh capital raise seems to have a price attached,1,2018-05-03 03:45:12,1,0,0,0.5537472367286682,0.0,0.0
122,4178,in a few of years as tesla and evs dominate the car industry and ice cars become uncool ice car marketing will be shifted to developing nations the same way cigarette smoking is still heavily promoted in those regions,1,2018-10-09 15:27:48,1,0,0,0.7947174310684204,0.0,0.0
123,28722,at 385 are we seeing a triple top off this news tesla,0,2018-08-07 20:00:49,0,1,0,0.0,0.8294520974159241,0.0
124,21802,so today is bidu tesla calls so far,0,2015-06-17 14:34:05,1,0,0,0.7226412892341614,0.0,0.0
125,23587,tesla registered 559 new model3 vins highest vin is 44462 vin5yj3e1ea2jf044462vin,1,2018-05-22 10:29:15,1,0,0,0.6305431127548218,0.0,0.0
126,625,the first couple douchebags in line a year ago will soon get to play a fun little game called russian roulette tesla,0,2017-06-22 14:30:44,1,0,0,0.7265974283218384,0.0,0.0
127,19903,ibm international business machines dividendibm tesla xlf ibb ibm invest tradeideasief ishares barclays,0,2015-12-13 20:43:25,0,1,0,0.0,0.8498862981796265,0.0
128,23138,tesla hourly stochastics show lower daily higher what are you thoughts this morning,1,2015-03-12 12:45:11,0,1,0,0.0,0.8981696367263794,0.0
129,26907,tesla i think the comparisons are eerily similar musk is the edison of the 21st century,1,2018-05-27 18:22:37,0,1,0,0.0,0.6002655029296875,0.0
130,14857,i dont see how the market cap matters if they can get the vote they can convert to llc dont even need to offer a cash tender its icing on the cake tesla,0,2018-08-12 04:00:44,0,1,0,0.0,0.6664792895317078,0.0
131,31835,stormy weather forcasted in shortsville for the rest of this week tesla shorts run for cover,1,2017-05-01 22:58:27,0,0,1,0.0,0.0,0.8362066149711609
132,16367,why apple should invest in tesla aapl tesla,0,2016-05-26 16:21:24,1,0,0,0.6058984398841858,0.0,0.0
133,3705,sold tesla calls from this morning 60 could have made more oh well,1,2016-06-07 17:00:30,0,1,0,0.0,0.6766560077667236,0.0
134,6224,this is enormous very few companies can play on this scale and tesla is the leader during todays earnings call elon mentioned imminent announcement of gwh scale bes project this announcement could involve supplying powepacks for saudi solar projecttsla,1,2018-05-03 04:42:21,0,0,1,0.0,0.0,0.6242997050285339
135,20856,trending tesla jnug bac spy jpm himx tlt aapl wfc baba gme fcx fb dia uvxy ocn nok get more info,0,2015-01-14 14:12:35,0,1,0,0.0,0.7891803979873657,0.0
136,35489,get on kool oversold and lowfloat 15m on monday next supernovapt 67 lets make money guys fb nflx aapl tesla msft ibm xom,0,2016-10-23 06:00:08,0,0,1,0.0,0.0,0.6357513666152954
137,4273,tesla good rant i agree except that i expect tesla to not build too many variations in the tent for precisely the reasons mentioned by they may only make one flavorthe logistics of this tent are going to be messy and the quality of product is going to be abysmal,0,2018-06-20 00:29:18,0,0,1,0.0,0.0,0.6014160513877869
138,16293,fb fas tesla i boldly predict that market definitely bottomed yesterday 11116 and goes up from here until september 2016 when it tops,1,2016-01-13 04:16:37,0,1,0,0.0,0.7405233979225159,0.0
139,39520,carmakers roll over gadget firms to steal spotlight at ces click010615733380fgmtmtslainfocusat2015cesshowhtm ibdblogs via f gm tm tesla nvda vlkay,0,2015-01-07 00:43:43,0,0,1,0.0,0.0,0.6347276568412781
140,6892,actually when i saw this headline i though they were talking about tesla the company a giant electric dump trucktsla,0,2017-09-17 16:27:12,0,1,0,0.0,0.7326871752738953,0.0
141,28785,findtrade ideas woption trades screener bac ttwo tmus clf ttd bac fb spy aapl chk rcl tesla twtwr,0,2017-09-27 22:44:29,0,0,1,0.0,0.0,0.779939591884613
142,12619,tesla up 770 in pmchanos is fckd,1,2017-04-03 12:05:23,0,1,0,0.0,0.5139666199684143,0.0
143,18636,unsafe did anyone claim they wereim sure one can drive them safely but not if you drive hard the way people buy sports cars and sedans to drivethe issue here is that to make a tesla handle at all or drive it fast you crush the range severely,1,2018-10-22 00:01:39,0,1,0,0.0,0.4804442226886749,0.0
